tweetId,isRetweet,time,text,replies,retweets,likes,entries
1197135968102502402,False,2019-11-20 20:53:51,Today is World Children’s Day - a day to celebrate children and to rededicate ourselves to their wellbeing. No better way to do that than to establish the Department of Children and Youth https://m.youtube.com/watch?v=wr3wkt2dp_I …,51,107,331,"{'hashtags': [], 'urls': [], 'photos': [], 'videos': []}"
1197084253273636864,False,2019-11-20 17:28:21,Fear and hate are profound motivators not just personally but also politically. And so is love. There are far more lovers than haters in this country but haters are politicized and convicted and on the move. Lovers among us need to display as much conviction as do those who hate.,43,137,593,"{'hashtags': [], 'urls': [], 'photos': [], 'videos': []}"
1197083026926317569,False,2019-11-20 17:23:29,"What we have now represents a quantum leap backwards; the only thing that can change that is a quantum leap forward. The politics of fear will only be overridden by a politics of love: Love of each other, love of our children, love of the earth, love of justice and love of peace.",75,211,1000,"{'hashtags': [], 'urls': [], 'photos': [], 'videos': []}"
1197033715010019328,False,2019-11-20 14:07:32,"Trump administration’s  decision to legitimize West Bank settlements is bad for the Palestinians, bad for Israel & bad for the world. America’s main ally should be humanity itself: the only way to demonstrate that re Israel-Palestinian politics is to stand for a 2 state solution.",74,96,505,"{'hashtags': [], 'urls': [], 'photos': [], 'videos': []}"
1196916490617917441,False,2019-11-20 06:21:43,Our national goal when I’m president: a world w/out war by 2100. We need Peace Games as well as War Games & a peace Academy as well as a military Academy. “Mankind must put an end to war or  war will put an end to mankind.” JF https://www.marianne2020.com/posts/peace-games …,61,135,557,"{'hashtags': [], 'urls': [], 'photos': [], 'videos': []}"
1196881734496735232,False,2019-11-20 04:03:37,"New Talk from Democratic Presidential Candidate Marianne Williamson in Omaha, Nebraska https://www.pscp.tv/w/cKRCGTFkdktPTG9WZ3lnalh8MVlwSmtZV01MbnJLanBYwxZQWgx9G2U9KjeeygXaZnL_jn9zdv8_dBykjE8o …",13,71,233,"{'hashtags': [], 'urls': [], 'photos': [], 'videos': []}"
1196660379054678017,False,2019-11-19 13:24:01,"Self-appointed president Anez is suppressing opposition in Bolivia, the country now descending into violence after   coup against Evo Morales. The United States MUST stand on the side of the people and demand free, democratic elections.",136,323,2191,"{'hashtags': [], 'urls': [], 'photos': [], 'videos': []}"
1196533297251311620,False,2019-11-19 04:59:03,Only a candidate who’s telling outrageous truths will be able to defeat a candidate who’s telling outrageous lies https://www.marianne2020.com/posts/only-outrageous-truth-will-defeat-outrageous-lies …,42,137,598,"{'hashtags': [], 'urls': [], 'photos': [], 'videos': []}"
1196435656790171649,False,2019-11-18 22:31:03,I’m praying this morning for the protesters in Hong Kong and for those who love them. May peace and understanding prevail.,793,7238,9966,"{'hashtags': [], 'urls': [], 'photos': [], 'videos': []}"
1196417127844057088,False,2019-11-18 21:17:26,"My plan for peace focuses on the amelioration of human suffering as the core of conflict-prevention; support for advancement of democracy before advancement of US corporate interests; and development, diplomacy & humanitarian aid before military dominance https://www.marianne2020.com/posts/peace-games …",31,82,338,"{'hashtags': [], 'urls': [], 'photos': [], 'videos': []}"
1196303603922866176,False,2019-11-18 13:46:20,“We need to change the bottom line in this country from an economic bottom line to a humanitarian bottom line. https://m.youtube.com/watch?v=gJcC_3aFhFc …,26,102,492,"{'hashtags': [], 'urls': [], 'photos': [], 'videos': []}"
1196297325079080960,False,2019-11-18 13:21:23,A policy here & a policy there won’t fix it. A plan here & a plan there won’t fix it. Treating symptoms isn’t enough; we have to address cause. If we only address external level then forces that are a problem now will be back in ‘22 and ‘24. Gotta go deep http://Marianne2020.com ,23,59,242,"{'hashtags': [], 'urls': [], 'photos': [], 'videos': []}"
1196267582329950208,False,2019-11-18 11:23:11,Spirituality is the path of the heart. The the problem with American politics is how many of our public policies are heartless https://www.marianne2020.com/posts/whats-love-got-to-do-with-it …,29,98,391,"{'hashtags': [], 'urls': [], 'photos': [], 'videos': []}"
1196169762864336896,False,2019-11-18 04:54:29,"I have no problem calling myself a capitalist. It’s not capitalism per se but a virulent strain of capitalism that has corrupted our govt & highjacked America’s value system. Capitalism, like any public institution, should display ethics & moral consideration for people & planet.",260,319,1782,"{'hashtags': [], 'urls': [], 'photos': [], 'videos': []}"
1196121514002640897,False,2019-11-18 01:42:46,We shouldn’t just save Social Security; we should expand it. We should scrap the cap so we all continue to pay into it no matter how much money we make. Plus UBI should be extended to everyone even after 65. High near-poverty rate among so many Seniors is completely unacceptable.,39,121,608,"{'hashtags': [], 'urls': [], 'photos': [], 'videos': []}"
1196101969686851584,False,2019-11-18 00:25:06,If you feel like moving to Iowa to volunteer for Marianne2020 please contact juan@marianne2020.com,51,66,316,"{'hashtags': [], 'urls': [], 'photos': [], 'videos': []}"
1196075422783401984,False,2019-11-17 22:39:37,"We need to totally repudiate the underpinnings of a now corrupt political system in which we have allowed the basic tenet of government “of the people, by the people, and for the people” to be hollowed out in favor of a corporate aristocracy. Only we the people can make it change",14,53,253,"{'hashtags': [], 'urls': [], 'photos': [], 'videos': []}"
1196075421621571585,False,2019-11-17 22:39:37,"Our country shouldn’t be run like a business, we should be run like a family. We should put the welfare of our children & elderly at the top of the list of our national priorities, not the bottom. Yet with corporate profits America’s false God, American people are left to suffer.",24,93,374,"{'hashtags': [], 'urls': [], 'photos': [], 'videos': []}"
1196075420686286848,False,2019-11-17 22:39:36,"The incredible challenges and vulnerabilities faced by the American child today form an invisible crisis, made up of so many millions of pieces that we are not seeing it in its totality. From health to education to their very safety, we are massively failing them as a society.",23,72,360,"{'hashtags': [], 'urls': [], 'photos': [], 'videos': []}"
1195909513624211456,False,2019-11-17 11:40:21,"Just as President Johnson declared a War on Poverty in the 1960’s, it’s time for America to rededicate itself to the alleviation of suffering among those who live in poverty https://www.marianne2020.com/posts/a-single-garment-of-destiny …",22,86,368,"{'hashtags': [], 'urls': [], 'photos': [], 'videos': []}"
1195795844265598978,True,2019-11-17 04:08:40,"""We need to change the bottom line in this country from an economic bottom line to a humanitarian bottom line.""

@marwilliamson speaks at the California Democrats Fall Endorsing Convention pic.twitter.com/mgPX5G29wO",74,173,516,"{'hashtags': [], 'urls': [], 'photos': [], 'videos': [{'id': 'Ya2BJ9FCXgooO8X8'}]}"
1195585999440506882,False,2019-11-16 14:14:49,"Excellent that Rodney Reed will not be executed next week, but it should never have had to come to that. Many have been executed who were later proved to have been innocent. The death penalty is barbaric and should be abolished.",61,285,1372,"{'hashtags': [], 'urls': [], 'photos': [], 'videos': []}"
1195585845132087296,False,2019-11-16 14:14:13,Love is radica pic.twitter.com/P9mMJ76XqA,22,119,426,"{'hashtags': [], 'urls': [], 'photos': [], 'videos': [{'id': 'hdEeA0n1DED8OxIU'}]}"
1195448837797625856,False,2019-11-16 05:09:47,Someone asked how to apply spirituality to politics; spirituality is simply the path of the heart. Our policies re the poor are heartless. Our policies re children are heartless. Our policies re the earth are heartless. Our policies re criminal justice are heartless. CHANGE THEM.,52,254,1059,"{'hashtags': [], 'urls': [], 'photos': [], 'videos': []}"
1195137025709658112,False,2019-11-15 08:30:46,"Come Join Marianne on the National Volunteer call at 8:30pm EST 

Please click the link below to join the webinar:
https://zoom.us/j/620211134 

 - Sarah, Team Marianne 2020",12,23,106,"{'hashtags': [], 'urls': ['https://zoom.us/j/620211134'], 'photos': [], 'videos': []}"
1195131607222497280,False,2019-11-15 08:09:14,This isn’t a time to just talk about problems or even solutions. It’s time to take action. Join with me in doing so.. https://www.marianne2020.com/posts/lets-save-our-children-2 …,25,54,199,"{'hashtags': [], 'urls': [], 'photos': [], 'videos': []}"
1195111907302113280,False,2019-11-15 06:50:57,"There are times that are an emergency, and this is such a time. This is not a time for any of us to think only about ourselves. We must think about our country. We must think about our children. We must think about the state of our humanity http://Marianne2020.com ",16,67,208,"{'hashtags': [], 'urls': [], 'photos': [], 'videos': []}"
1195103904079347717,False,2019-11-15 06:19:09,"What can you do? There’s plenty you can do; there are elections next year! Make sure your congressman has a D or F from the NRA; otherwise, do everything  you can to make sure they lose next year. If you have a Senate race, make sure you support someone who’d rank D or F from NRA",72,124,534,"{'hashtags': [], 'urls': [], 'photos': [], 'videos': []}"
1195096404659585024,False,2019-11-15 05:49:21,"“This is not just a political problem; it’s a moral problem. It’s that we have not yet intervened with a political system so cravenly obedient to corporate profits—in this case, the profits of gun manufacturers—over the health and safety of our children. https://www.marianne2020.com/posts/lets-save-our-children …",34,84,258,"{'hashtags': [], 'urls': [], 'photos': [], 'videos': []}"
1195021154248880129,False,2019-11-15 00:50:20,"Active shooter situation now at Santa Clarita, Ca. high school. May all of us who pray now pray - for blessing for the victims of this horror, for forgiveness for our country that we’ve allowed such things to fester & for the strength to be the people who rise up & say “No more!”",58,134,710,"{'hashtags': [], 'urls': [], 'photos': [], 'videos': []}"
1194906765499850752,False,2019-11-14 17:15:47,Every generation decides for itself what chapter it will write in the ongoing American story pic.twitter.com/efMBm15UBV,19,99,365,"{'hashtags': [], 'urls': [], 'photos': [], 'videos': [{'id': '103t1tFWqFzPgo1s'}]}"
1194669181800722433,True,2019-11-14 01:31:43,"Interview: @MarWilliamson on building an ""economics of love"" http://bit.ly/2QhqnmM pic.twitter.com/4lqt4d6y04",9,49,153,"{'hashtags': [], 'urls': ['http://bit.ly/2QhqnmM'], 'photos': ['https://pbs.twimg.com/media/EJRRSedWoAA1Jz9.jpg'], 'videos': []}"
1194634055070842883,False,2019-11-13 23:12:08,"America needs to start spending far more money on ways to improve people’s lives (schools, peace) & far less on ways to destroy people’s lives (prisons, war). That perversion of our values, codified in public policy for no other reason than profit, must be challenged & rejected.",54,202,787,"{'hashtags': [], 'urls': [], 'photos': [], 'videos': []}"
1194631653685002243,False,2019-11-13 23:02:36,"Our greatest source of wealth-creation is the creativity and productivity of the American people. Therefore anything that allows people greater access to the realization of their own potential - healthcare, education, culture - should be seen as a boost not a suck on our economy.",25,103,361,"{'hashtags': [], 'urls': [], 'photos': [], 'videos': []}"
1194630696200851456,False,2019-11-13 22:58:47,"We need to change more than policy; we need to change paradigm. Switch from improving the economy as a way to improve humanity’s lot, to improving humanity’s lot as a way to improve the economy AND improve humanity. We need to shift from an economic to a humanitarian bottom line.",31,112,457,"{'hashtags': [], 'urls': [], 'photos': [], 'videos': []}"
1194387778089316352,False,2019-11-13 06:53:31,"Thank you, Nathaniel https://twitter.com/natefestinger/status/1194366264082231296 …",36,92,277,"{'hashtags': ['#Marianne2020', '#ClimateEmergency'], 'urls': [], 'photos': [], 'videos': []}"
1194280207974223872,False,2019-11-12 23:46:04,Peace is very serious business https://www.marianne2020.com/posts/peace-is-very-serious-business …,19,58,228,"{'hashtags': [], 'urls': [], 'photos': [], 'videos': []}"
1194271866640199680,False,2019-11-12 23:12:56,Yep. That’s why we need a different kind of president.. pic.twitter.com/l5f2aMilg7,26,167,543,"{'hashtags': [], 'urls': [], 'photos': ['https://pbs.twimg.com/media/EJLn7pMUwAE2eXR.jpg'], 'videos': []}"
1194259695906652162,False,2019-11-12 22:24:34,"If everyone who supports the campaign gives $10 right now, our conversation will remain in the mix. Please take the time to do this. It will make the difference between whether or not we can continue...(and please spread the word https://secure.actblue.com/donate/marianne-williamson-2020-committee …",19,101,212,"{'hashtags': [], 'urls': [], 'photos': [], 'videos': []}"
1194258451125325827,False,2019-11-12 22:19:37,"If you’re not on the campaign  mailing list, please join https://www.marianne2020.com/lets-create-this …",7,33,91,"{'hashtags': [], 'urls': [], 'photos': [], 'videos': []}"
1194252101582348290,False,2019-11-12 21:54:23,"The war underneath all the others is the war for the soul of America. We cannot be great if we are not good, and nothing says good like seeking to wage peace in our hearts and in the world around us. War is very serious business. And so is peace https://www.marianne2020.com/issues/us-department-of-peace-plan …",15,62,207,"{'hashtags': [], 'urls': [], 'photos': [], 'videos': []}"
1194235568944607232,False,2019-11-12 20:48:42,"We spend 53 cents of every dollar on defense related expenditures, while far more economic prosperity derives from investment in education and infrastructure. Same skills and expertise can be transitioned and repurposed! That is the shift from a war economy to a peace economy.",30,151,517,"{'hashtags': [], 'urls': [], 'photos': [], 'videos': []}"
1194228379462950912,False,2019-11-12 20:20:08,"“In the councils of government, we must guard against the acquisition of unwarranted influence, whether sought or unsought, by the military- industrial-complex. The potential for the disastrous rise of misplaced power exists and will persist.” - Dwight Eisenhower. Oh it persists.",7,36,127,"{'hashtags': [], 'urls': [], 'photos': [], 'videos': []}"
1194228378171146246,False,2019-11-12 20:20:07,"Younger generations of Americans have never experienced a time when we were not at war, normalizing what is in fact an aberrational state of humanity.",4,37,162,"{'hashtags': [], 'urls': [], 'photos': [], 'videos': []}"
1194228374547263488,False,2019-11-12 20:20:06,Yesterday we honored our veterans. Today there is no greater honor we could show them than to disenthrall ourselves of the illusion that constant war preparedness is our best and only path to peace. We cannot prepare for war enough that we will simply back up into peace.,18,54,245,"{'hashtags': [], 'urls': [], 'photos': [], 'videos': []}"
1194222809263697920,False,2019-11-12 19:57:59,"“Every gun that is made, every warship launched, every rocket fired signifies in the final sense a theft from those who hunger and are not fed, those who are cold and are not clothed.” - Dwight Eisenhower, Supreme commander of Allied Forces in World War II, 34th President of US",15,125,426,"{'hashtags': [], 'urls': [], 'photos': [], 'videos': []}"
1194220387153825797,False,2019-11-12 19:48:22,"“America is great because she is good. If America ceases to be good, America will cease to be great.” - 
Alexis de Tocqueville",29,81,370,"{'hashtags': [], 'urls': [], 'photos': [], 'videos': []}"
1194154006890700800,False,2019-11-12 15:24:36,The separation of Church and State is important but often misunderstood.. pic.twitter.com/TkMKxkuLXW,19,80,269,"{'hashtags': [], 'urls': [], 'photos': [], 'videos': [{'id': 'Z7qmk0cL4Ie8j0mq'}]}"
1194097610765660160,False,2019-11-12 11:40:30,Live from Las Vegas! Democratic Presidential Candidate Marianne Williamso https://www.pscp.tv/w/cJohLjFkdktPTG9WZ3lnalh8MUJkeFlldm9ZWkV4WAZr5TvtbhF-7TgYLcjU0Wo6O5jZiuAI39ZEGpJqFjWv …,18,73,222,"{'hashtags': [], 'urls': [], 'photos': [], 'videos': []}"
1193990938101608453,False,2019-11-12 04:36:37,The heart of Veteran’s Da https://www.marianne2020.com/posts/the-heart-of-veterans-day …,10,48,160,"{'hashtags': [], 'urls': [], 'photos': [], 'videos': []}"
1193970043417063424,False,2019-11-12 03:13:35,"Today is Veterans Day and my thoughts are with those who served. What they went through, and what they’re going through now, should be on every American’s mind... https://www.facebook.com/williamsonmarianne/photos/a.10153944295320580/10162316328395580/ …",11,44,230,"{'hashtags': [], 'urls': ['https://www.facebook.com/williamsonmarianne/photos/a.10153944295320580/10162316328395580/'], 'photos': [], 'videos': []}"
1193526525749944321,False,2019-11-10 21:51:13,"This is a very pregnant moment in American history. On one hand some things are terrible; there’s no doubt about that. On the other hand, so many people have now gotten a taste of serious governmental malfunction that there’s an openness to fundamental repair and a new beginning.",84,197,1213,"{'hashtags': [], 'urls': [], 'photos': [], 'videos': []}"
1193198812157874176,True,2019-11-10 00:09:00,"While many Democratic presidential candidates have dropped out of the 2020 race, @marwilliamson says she will run ""as long as that kind of connection is happening"" with the voters.
""I'm here because my heart says to be here and I'll be here as long as my heart says to stay. pic.twitter.com/t20VoosJgq",133,264,1110,"{'hashtags': [], 'urls': [], 'photos': [], 'videos': [{'id': 'EI8X1NoWkAIf962'}]}"
1193346221617733632,False,2019-11-10 09:54:45,My opening statement last night from the @democracynow Environmental Justice Presidential Forum at @SCSTATE1896 pic.twitter.com/wzfEaj5k8l,26,77,323,"{'hashtags': [], 'urls': [], 'photos': [], 'videos': [{'id': 'ZJ8FoR84cz_MlBIw'}]}"
1193305794395156485,False,2019-11-10 07:14:06,"Nothing will fundamentally change until American capitalism morally self-corrects, and that’s what’s possible now. It’s not capitalism itself but a virulent strain of it that has corrupted our government and highjacked America’s value system. I’m for capitalism with a conscience.",140,278,1443,"{'hashtags': [], 'urls': [], 'photos': [], 'videos': []}"
1193303408989687808,False,2019-11-10 07:04:37,"From environmental toxins to dangerous pesticides to carcinogens in food to contaminants in water, we’re poisoning ourselves so corporate interests can increase profits and not worry about all those pesky health and safety regulations. This needs to STOP https://www.marianne2020.com/issues/food ",15,118,388,"{'hashtags': [], 'urls': [], 'photos': [], 'videos': []}"
1193301912927559681,False,2019-11-10 06:58:41,"Until we address the underlying problem with America’s food supply, we can’t tackle healthcare in a meaningful way. Cause and not just symptom, people! My Whole Health Plan coming shortly.. https://twitter.com/TKindlick/status/1193234748778434561 …",27,58,270,"{'hashtags': [], 'urls': [], 'photos': [], 'videos': []}"
1193233636566413312,False,2019-11-10 02:27:22,"More Americans are chronically ill than in other advanced democracies. We need more than to provide free healthcare; we need healthier food, water, air & more. We will do more than provide a way to treat sickness; we will provide more ways to prevent sickness & cultivate health.",72,192,917,"{'hashtags': [], 'urls': [], 'photos': [], 'videos': []}"
1193203842046971904,False,2019-11-10 00:28:59,Thank you https://twitter.com/MPowersNorrell/status/1192964765846556672 …,12,37,235,"{'hashtags': [], 'urls': [], 'photos': [], 'videos': []}"
1193148812673478656,False,2019-11-09 20:50:19,A politics of conscience belongs on TV. Help raise a million dollars for TV ads pic.twitter.com/RC08w1rFAP,42,110,448,"{'hashtags': [], 'urls': [], 'photos': [], 'videos': [{'id': 'GD3OUYw_JQ0H03Ih'}]}"
1192992515928006656,False,2019-11-09 10:29:15,"Thank you, Democracy Now and South Carolina State University https://twitter.com/democracynow/status/1192986461768945670 …",34,102,413,"{'hashtags': ['#ejpresforum'], 'urls': [], 'photos': [], 'videos': []}"
1192863202801049601,False,2019-11-09 01:55:24,"""Our goal is to create a beloved community and this will require a qualitative change in our souls as well as a quantitative change in our lives.” - Martin Luther King Jr.",20,92,373,"{'hashtags': [], 'urls': [], 'photos': [], 'videos': []}"
1192843557486366721,False,2019-11-09 00:37:20,"In terms of where we're going, the contest of our era is between exclusion v. inclusion. In terms of process, the contest is between those who think ""they know better"" v.  an organic flow of intelligence that emerges from empowered citizens. The 1st is elitism; the 2nd democracy.",22,89,335,"{'hashtags': [], 'urls': [], 'photos': [], 'videos': []}"
1192832008659120129,False,2019-11-08 23:51:27,We need WW2 level mass mobilization to reverse climate change & heal the earth. This requires change in our hearts as well as a change in environmental policy. An era of irreverence must now transition into an era of devotion to the well-being of the worl https://www.marianne2020.com/issues/climate-change …,28,59,240,"{'hashtags': [], 'urls': [], 'photos': [], 'videos': []}"
1192811390693711874,False,2019-11-08 22:29:31,"Humanity’s arrogance & lack of reverence towards the earth & our fellow human beings over the last 50 yrs has left us needing a Season of Repair. Not just a policy change here and there, but a fundamental reckoning with how much damage has been done and how much repair is needed.",14,57,207,"{'hashtags': [], 'urls': [], 'photos': [], 'videos': []}"
1192811389863247874,False,2019-11-08 22:29:31,"Environmental degradation and ecosystem collapse aren’t just problems coming at us in the future. They are problems already devastating communities & in many cases communities least equipped to absorb the damage.The damage is to our land, property, and most importantly our health",13,54,270,"{'hashtags': [], 'urls': [], 'photos': [], 'videos': []}"
1192803239818907653,False,2019-11-08 21:57:08,"In SC for forum on environmental justice. Huge issue with water contaminants everywhere.  We regulate 70,000 chemicals but 130,000 in commercial use. Contaminants in water in Denmark, SC & govt complicit in leaving it untreated. Same w “forever chemicals” in Merrimack River in NH",18,46,205,"{'hashtags': [], 'urls': [], 'photos': [], 'videos': []}"
1192794269599309825,False,2019-11-08 21:21:29,The social and educational realities of millions of American children shouldn’t be something they and their parents are hoping they can “escape.” Any child without the social & educational opportunities they need is a sign of failure on the part of our society and I will fix that,7,31,142,"{'hashtags': [], 'urls': [], 'photos': [], 'videos': []}"
1192794268613693441,False,2019-11-08 21:21:29,My policies are part of a paradigmatic shift in American society. We need to front end our resources! Every agency that works with kids needs vastly more resources - way more than just additional funds. We need a massive new societal commitment to our kid https://www.marianne2020.com/issues/education …,6,34,154,"{'hashtags': [], 'urls': [], 'photos': [], 'videos': []}"
1192794267544109056,False,2019-11-08 21:21:29,Violence in our society begins with violence against children. Tech companies reported 45 million impressions of sexual violence & abuse against children on the Internet last year. Our society needs & when I’m president we will have a massive realignment of investment in our kids,16,54,271,"{'hashtags': [], 'urls': [], 'photos': [], 'videos': []}"
1192790021671149568,False,2019-11-08 21:04:36,"Only a massive realignment of investment in our children, teachers and schools will ameliorate the dangerous social powder keg underlying American society. We can’t just treat symptoms. The cause of all societal dysfunction begins with despair among parents, children & families.",7,35,169,"{'hashtags': [], 'urls': [], 'photos': [], 'videos': []}"
1192790020878458881,False,2019-11-08 21:04:36,"America has the right social workers, counselors, teachers & early childhood experts. They’re with the kids every day; they know what we need and they know what to do. But only a small % of our underserved kids get the help they need, feeding a multi-generational trend of despair",4,26,159,"{'hashtags': [], 'urls': [], 'photos': [], 'videos': []}"
1192790019796328448,False,2019-11-08 21:04:36,Most don’t realize the high incidence of social & emotional trauma among kids - and teachers! - today. Starting with pre-school we must provide more than education; we must provide entrance into a better life. We need social and emotional learning and trauma-informed education.,5,18,85,"{'hashtags': [], 'urls': [], 'photos': [], 'videos': []}"
