tweetId,isRetweet,time,text,replies,retweets,likes,entries
1174698873811623943,False,2019-09-19 22:56:51,"A system that does not feel, which has no sense of ethical responsibility to people or planet, is a dangerous guide to America’s future. Living for our principles will provide more economic security than living for short-term corporate interests can ever provide. #bigtrut pic.twitter.com/U2bp07hTqj",42,171,561,"{'hashtags': ['#bigtruth'], 'urls': [], 'photos': [], 'videos': [{'id': 'J3SVpSq7MpI6KX5W'}]}"
1174688409190682630,False,2019-09-19 22:15:16,Just touched down in DC. Looking forward to participating in this afternoon’s climate forum hosted by @MSNBC & @GeorgetownUniversity. #BigTruth #Marianne202 pic.twitter.com/BULeZJwgFF,43,67,357,"{'hashtags': ['#BigTruth', '#Marianne2020'], 'urls': [], 'photos': ['https://pbs.twimg.com/media/EE1U4TkVAAA-iBs.jpg'], 'videos': []}"
1174319445587587072,False,2019-09-18 21:49:08,"I want to be President because I want to help navigate a season of repair in order to end one chapter of American history and initiate another.

#marianne2020 #bigtrut pic.twitter.com/SwQhOyeA5q",103,279,971,"{'hashtags': ['#marianne2020', '#bigtruth'], 'urls': [], 'photos': [], 'videos': [{'id': '0AAuBM6SzZXVJG4e'}]}"
1174310853069479937,False,2019-09-18 21:14:59,Truth.. https://twitter.com/spiraljettyclub/status/1174308209802260482 …,38,80,311,"{'hashtags': ['#Marianne2020', '#BigTruth'], 'urls': [], 'photos': [], 'videos': []}"
1174188968834977792,False,2019-09-18 13:10:40,"We will radically change the way we see the world – or there will be no world as we know it, left for us to see https://www.marianne2020.com/issues/climate-change …",23,66,288,"{'hashtags': [], 'urls': [], 'photos': [], 'videos': []}"
1174188967694131200,False,2019-09-18 13:10:39,"It is a psychological, emotional  and moral challenge to face the horror of what stands before us over the next 10 years should we not act. Yet there – in our standing raw before the truth that it confronts us with - lies our only hope of surviving it.",14,67,312,"{'hashtags': [], 'urls': [], 'photos': [], 'videos': []}"
1174188965840244736,False,2019-09-18 13:10:39,Our biggest crisis regarding the climate emergency is humanity’s massive state of denial that it exists on the scale that it does. But our willingness to recognize the depth of the problem is prerequisite to solving it.,39,155,674,"{'hashtags': [], 'urls': [], 'photos': [], 'videos': []}"
1174115266327920640,False,2019-09-18 08:17:48,I will be interviewed by Jonathan Capehart at the 92St. Y in NYC Wed. night at 7:30p https://www.marianne2020.com/events ,12,49,183,"{'hashtags': [], 'urls': [], 'photos': [], 'videos': []}"
1174105984727429120,False,2019-09-18 07:40:55,"Labor unions have been under attack for 40 years, increasing the wealth gap & adding to widespread economic anxiety for millions of Americans. The tide must turn! Great admiration for the striking GM workers. I know it’s tough but you’re right to do it. So many of us are with you",42,161,690,"{'hashtags': [], 'urls': [], 'photos': [], 'videos': []}"
1174050296827277312,False,2019-09-18 03:59:38,Sept. 21 is the International Day of Peace. Let’s join our hearts and minds and make it so.. pic.twitter.com/exkhi65Sj5,26,102,364,"{'hashtags': [], 'urls': [], 'photos': ['https://pbs.twimg.com/media/EEsQhVcVAAAKKPy.jpg'], 'videos': []}"
1174017405086945281,False,2019-09-18 01:48:56,"I'll be in conversation with @washingtonpost's @CapehartJ on Wed, 9/18 @ 7:30 pm ET at 92nd St Y in NYC.

https://www.92y.org/event/marianne-williamson …

(Note: This is not a campaign fundraiser. Ticket proceeds support the work of @92Y, a nonprofit community and cultural center. pic.twitter.com/524oDm3FUP",18,45,178,"{'hashtags': [], 'urls': ['https://www.92y.org/event/marianne-williamson'], 'photos': ['https://pbs.twimg.com/media/EErymwJVUAAD6xi.jpg'], 'videos': []}"
1173814686908731392,False,2019-09-17 12:23:24,"We can make this change...
Other generations have risen to the occasion pic.twitter.com/V5jtHv9Q5M",59,227,749,"{'hashtags': [], 'urls': [], 'photos': [], 'videos': [{'id': 'W7QmNxmOKkB063C-'}]}"
1173610658744737792,False,2019-09-16 22:52:40,An idea grows stronger when it's shared. Last night with @rustyrockets. #Marianne2020 #BigTrut pic.twitter.com/kliCnGOQKc,103,280,976,"{'hashtags': ['#Marianne2020', '#BigTruth'], 'urls': [], 'photos': [], 'videos': [{'id': '_BIDV0_Z6DCzZ9-c'}]}"
1173509676027113474,False,2019-09-16 16:11:24,My talk at the Iowa State Fai https://www.youtube.com/watch?v=7755sgu-L38&feature=youtu.be …,13,65,215,"{'hashtags': [], 'urls': [], 'photos': [], 'videos': []}"
1173357334204076032,False,2019-09-16 06:06:03,"We have to get people excited to vote! People who didn’t vote or people who voted third party. We have to have an agenda that is so big, so exciting, and so phenomenal, and involves such energy and such motivation, and such inspiration that it can take on Donald Trump any day pic.twitter.com/9yeKD4NFgj",152,281,987,"{'hashtags': [], 'urls': [], 'photos': [], 'videos': [{'id': 'FhnaRy2cl1iK5b5d'}]}"
1173339584584806400,False,2019-09-16 04:55:31,My interview on MSNBC with Alex Witt this morning: “He’s a reality show; I’m showing reality. https://youtu.be/NQpMgaXOLy0 ,65,124,453,"{'hashtags': [], 'urls': [], 'photos': [], 'videos': []}"
1173261120305385477,False,2019-09-15 23:43:43,I’ll be on Alex Witt on MSNBC today around 9:45 PT,52,45,299,"{'hashtags': [], 'urls': [], 'photos': [], 'videos': []}"
1173229504296185856,False,2019-09-15 21:38:06,"If you’re in or near Los Angeles, please join us tonight, Sunday Sept. 15! Russell Brand joins me. Meet & Greet at 6pm, event begins at 7pm. Benefit for the campaign. Get your tickets here: https://secure.actblue.com/donate/mw9.15.19wl  pic.twitter.com/yq67wpgGxe",31,57,261,"{'hashtags': [], 'urls': ['https://secure.actblue.com/donate/mw9.15.19wl'], 'photos': ['https://pbs.twimg.com/media/EEgmA5FUYAAl4gH.jpg'], 'videos': []}"
1173008851957768192,False,2019-09-15 07:01:18,"Donald Trump has taken us into an era of political theater - & for better or for worse we will not be going back. Our choices are the cheap drama of Trump’s politics, or the high drama of serious human beings evolving into collective wisdom & strength. And I have a plan for that.",208,311,1889,"{'hashtags': [], 'urls': [], 'photos': [], 'videos': []}"
1172933602981511168,False,2019-09-15 02:02:17,#bigtrut pic.twitter.com/UXS10ddoF6,71,235,820,"{'hashtags': ['#bigtruth'], 'urls': [], 'photos': [], 'videos': [{'id': 'gGClL5Hw9cqmsB9b'}]}"
1172717684607184896,False,2019-09-14 11:44:18,"War is the absence of peace, peace is not the absence of war. We have to cultivate peace just like we have to be prepared for war if war must come pic.twitter.com/wK6RmNjGdK",85,239,1006,"{'hashtags': [], 'urls': [], 'photos': [], 'videos': [{'id': 'zgm57YlPDD5BHCXP'}]}"
1172716649914388485,False,2019-09-14 11:40:12,"Of course a National Security Advisor does not need Senate confirmation. The President appoints the National Security advisor at his/her pleasure. But that is no reason for us to remain quiet. Writing Op Ed’s, calling our reps, using our voices. That’s what matters: speaking up.",86,77,403,"{'hashtags': [], 'urls': [], 'photos': [], 'videos': []}"
1172703815448948741,False,2019-09-14 10:49:12,https://www.theguardian.com/commentisfree/2019/sep/13/who-won-the-democrats-debate-our-panelists-verdict …,39,39,139,"{'hashtags': [], 'urls': [], 'photos': [], 'videos': []}"
1172703662126223361,False,2019-09-14 10:48:35,"Before this trickle-down economics theory took hold of our society the way it did, corrupting our government and so corrupting our entire moral value system, before that, the American corporation - can you imagine this? - was expected to care pic.twitter.com/go8PvnJg4o",56,126,505,"{'hashtags': [], 'urls': [], 'photos': [], 'videos': [{'id': '3cfdWUKlSm53rFpU'}]}"
1172702165925675008,False,2019-09-14 10:42:38,"I hear you, Iowa. Thanks for saying it.. https://www.bleedingheartland.com/2019/09/12/prominent-iowa-democrats-to-debate-non-qualifiers-dont-drop-out/ …",22,59,322,"{'hashtags': [], 'urls': [], 'photos': [], 'videos': []}"
1172696495692234752,False,2019-09-14 10:20:06,Good news John Bolton was fired. But the man now poised to at least temporarily fill his position is someone whose views lie somewhere between dangerous & insane. Make noise! Call reps at (202) 224-3121 (House & Senate) and say NO to Charles Kupperman https://www.huffpost.com/entry/charles-kupperman-nuclear-war-trump-nsa_n_5d7b9809e4b03b5fc88212fd …,238,270,696,"{'hashtags': [], 'urls': [], 'photos': [], 'videos': []}"
1172695839300448258,False,2019-09-14 10:17:30,"“We need a massive infusion of economic hope and opportunity into the life of the average American.""
From my interview with @karaswisher on the Recode Decode Podcast. @Recode @voxdotcom @Stitcher
https://www.stitcher.com/podcast/vox/recode-decode/e/63873150  pic.twitter.com/R3vSUmBCsK",16,45,154,"{'hashtags': [], 'urls': ['https://www.stitcher.com/podcast/vox/recode-decode/e/63873150'], 'photos': ['https://pbs.twimg.com/media/EEZAo_8UEAEfpBX.png'], 'videos': []}"
1172676315167756289,True,2019-09-14 08:59:55," 
 
Joining me on @UPonMSNBC Saturday:  
 
@dcstl  Gregory Cheadle  @sallykohn  @TexasTribAbby  @CalNBC  @chriscquinn  @brhodes  @petersagal  @EmTSuss  @marwilliamson
#uppers",14,23,74,"{'hashtags': ['#uppers'], 'urls': [], 'photos': [], 'videos': []}"
1172665732699586560,False,2019-09-14 08:17:52,"I'll be in conversation with @washingtonpost's @CapehartJ on Wed, 9/18 @ 7:30 pm ET at 92nd St Y in NYC.

https://www.92y.org/event/marianne-williamson … 

(Note: This is not a campaign fundraiser. Ticket proceeds support the work of @92Y, a nonprofit community and cultural center. pic.twitter.com/XaQNY0oBFL",19,47,171,"{'hashtags': [], 'urls': ['https://www.92y.org/event/marianne-williamson'], 'photos': ['https://pbs.twimg.com/media/EEYlREiXYAE3WHc.jpg'], 'videos': []}"
1172618844742901760,False,2019-09-14 05:11:33,"We need a green new century. We are not willing to acquiesce any longer to politicians who say 'well, we want to do all this but of course we have to make oil and gas happy.' This is about saving our planet, this is about saving our country, this is about saving our democracy pic.twitter.com/0CKi2zyAgm",110,266,1158,"{'hashtags': [], 'urls': [], 'photos': [], 'videos': [{'id': 'pXhCbtzWZ-Ept0j9'}]}"
1172586979839467520,False,2019-09-14 03:04:56,"My fundraiser in Los Angeles this Sunday, September 15th will feature a meaningful conversation between myself and special guest @rustyrockets. 

Thank you for all your support! Get your tickets here: https://secure.actblue.com/donate/mw9.15.19wl  pic.twitter.com/j7AQ1effRb",56,86,435,"{'hashtags': [], 'urls': ['https://secure.actblue.com/donate/mw9.15.19wl'], 'photos': ['https://pbs.twimg.com/media/EEXdpC0UYAAkcNK.jpg'], 'videos': []}"
1172467810594783234,False,2019-09-13 19:11:24,Re my hot mic moment Eric Bolling felt the need to put out (hardly conservatives being nice). People keep quoting me as saying I understood “why the Right say the Left is godless.” I said no such thing. I said I understand that they say that about ME.,413,113,878,"{'hashtags': [], 'urls': [], 'photos': [], 'videos': []}"
1172407409244958723,False,2019-09-13 15:11:23,"Some presidents preside over a period of initiation. 
Some presidents preside over a period of consolidation. 
Then sometimes along the way, things can go wrong. 
The next president needs to preside over a season of repair.",98,190,909,"{'hashtags': [], 'urls': [], 'photos': [], 'videos': []}"
1172340913449787392,False,2019-09-13 10:47:09,US Presidential Candidate Marianne Williamson's Post-Debate Commentar https://www.pscp.tv/w/cEr6rTFkdktPTG9WZ3lnalh8MU9kSnJMYXZlTndLWH_pTL-4X9RIWZ1_9MP6TiYIdyQ8UEUV78V67BLE3o34 …,200,418,1050,"{'hashtags': [], 'urls': [], 'photos': [], 'videos': []}"
1172316735233413123,False,2019-09-13 09:11:04,An hour in: Nice people. Nothing transformative. All incremental . Ultimately boring. Nothing even close to what we’ll need to have if we want to defeat the president. Join me post-debate a http://Marianne2020.com/live ,612,590,2885,"{'hashtags': [], 'urls': [], 'photos': [], 'videos': []}"
1172263147522134016,False,2019-09-13 05:38:08,More #BigTruth at my post-debate livestream tonight. 11pmET/8pmPT. https://www.marianne2020.com/live pic.twitter.com/UEZLG9Zwq1,99,149,537,"{'hashtags': ['#BigTruth'], 'urls': ['https://www.marianne2020.com/live'], 'photos': [], 'videos': [{'id': 'l8uulUPH8B3mLzoA'}]}"
1172254878313385988,False,2019-09-13 05:05:17,"Once the Trump era is over we will initiate a season of repair. Among other things, we will reverse the pattern of his executive overreach. See my answers to the New York Times regarding executive power and its abuse https://www.nytimes.com/interactive/2019/us/politics/marianne-williamson-executive-power.html …",116,160,604,"{'hashtags': [], 'urls': [], 'photos': [], 'videos': []}"
1172180816199176192,False,2019-09-13 00:10:59,"Watch my #bigtruth live stream event tonight immediately after the #demdebate. 

Beginning at 8pmPT/11pmET, I’ll be streaming here, Facebook, YouTube, and http://Marianne2020.com/live pic.twitter.com/KTD0Tn63dT",122,171,447,"{'hashtags': ['#bigtruth', '#demdebate'], 'urls': ['http://Marianne2020.com/live'], 'photos': ['https://pbs.twimg.com/media/EERsPDQUUAECWMz.jpg'], 'videos': []}"
1172068024611827712,False,2019-09-12 16:42:47,I’ll be livestreaming from Los Angeles immediately after the debate tonight! 8pmPT/11pmET http://marianne2020.com/live pic.twitter.com/MXCLLQmn7W,91,148,516,"{'hashtags': [], 'urls': ['http://marianne2020.com/live'], 'photos': ['https://pbs.twimg.com/media/EEQFp5mU0AMWhzL.jpg'], 'videos': []}"
1171929857233694720,False,2019-09-12 07:33:46,My feeling exactly.. https://twitter.com/PoliticoRyan/status/1171866837174427653 …,59,121,674,"{'hashtags': [], 'urls': [], 'photos': [], 'videos': []}"
1167678403434164224,True,2019-08-31 14:00:00,"Over 930 local governments have declared a #ClimateEmergency.

It's time for the U.S. to tell the truth too.

Tell your reps to co-sponsor the Climate Emergency Declaration today:

https://climateemergency.us/ pic.twitter.com/cC5ULGLca4",12,47,113,"{'hashtags': ['#ClimateEmergency'], 'urls': ['https://climateemergency.us/'], 'photos': [], 'videos': [{'id': 'EDMdRYbU8AEbkAq'}]}"
1171896876200812544,False,2019-09-12 05:22:42,My plan for a Department of Peac https://www.marianne2020.com/issues/us-department-of-peace-plan …,29,82,338,"{'hashtags': [], 'urls': [], 'photos': [], 'videos': []}"
1171887429118304256,False,2019-09-12 04:45:10,We should see large groups of desperate people as a national security risk. #Marianne2020 #BigTrut pic.twitter.com/I072YTsZhf,67,160,778,"{'hashtags': ['#Marianne2020', '#BigTruth'], 'urls': [], 'photos': [], 'videos': [{'id': '1CH_ptAqIDqAKc8c'}]}"
1171882406560878592,False,2019-09-12 04:25:12,Join Russell Brand and me for a campaign fundraiser Sunday night Sept. 15 https://secure.actblue.com/donate/mw9.15.19wl  pic.twitter.com/porgEPRNT6,26,49,204,"{'hashtags': [], 'urls': ['https://secure.actblue.com/donate/mw9.15.19wl'], 'photos': ['https://pbs.twimg.com/media/EENc05RXsAAWR07.jpg'], 'videos': []}"
1171851911408041985,False,2019-09-12 02:24:02,"Prayers for Peace on 9/11. On this painful day of shared history & grief let’s dedicate ourselves to the creation of a world in which such things no longer happen. An old rabbinical saying: “You are not obligated to complete the task, but neither are you permitted to abandon it.”",33,185,922,"{'hashtags': [], 'urls': [], 'photos': [], 'videos': []}"
1171612517531049984,False,2019-09-11 10:32:46,"I’m sorry Dem Dan McCready lost a close race today in NC’s D-9. It’s instructive to all of us: get busy starting now. Not one seat - House, Senate or White House - will be anything less than hard-fought & critically important in 2020. Don’t delay participating. This is everything",91,231,1194,"{'hashtags': [], 'urls': [], 'photos': [], 'videos': []}"
1171586772050087938,False,2019-09-11 08:50:28,Excellent that John Bolton will no longer be the president’s National Sacurity Advisor. We don’t need warmongers; we need peacebuilders. Read here about my plan for a US Department of Peace https://www.marianne2020.com/issues/us-department-of-peace-plan …,57,194,881,"{'hashtags': [], 'urls': [], 'photos': [], 'videos': []}"
1171541077788000256,False,2019-09-11 05:48:53,"“You can disagree with someone’s opinion, but that doesn’t mean you should be shutting them down or lying about them.” #Marianne2020 via @foxandfriend pic.twitter.com/vVr7o49wyg",153,356,1583,"{'hashtags': ['#Marianne2020'], 'urls': [], 'photos': [], 'videos': [{'id': '7-NnTwTNzMajZLsu'}]}"
1171501318071971840,False,2019-09-11 03:10:54,"American capitalism needs to course-correct, or millions of young people will storm the Bastille. https://www.vox.com/platform/amp/recode/2019/9/10/20859179/marianne-williamson-income-inequality-wealth-bastille-chaos-kara-swisher-recode-decode-podcast?utm_campaign=vox&utm_content=chorus&utm_medium=social&utm_source=twitter&__twitter_impression=true …",101,111,516,"{'hashtags': [], 'urls': ['https://www.vox.com/platform/amp/recode/2019/9/10/20859179/marianne-williamson-income-inequality-wealth-bastille-chaos-kara-swisher-recode-decode-podcast?utm_campaign=vox&utm_content=chorus&utm_medium=social&utm_source=twitter&__twitter_impression=true'], 'photos': [], 'videos': []}"
1171486931550523398,False,2019-09-11 02:13:44,"Dear @realDonaldTrump, we Democrats are indeed “big believers in religion,” especially its tenets of love, mercy, justice, humility & compassion - none of which you demonstrate in any significant way in your policies. That is why we’re going to defeat you in 2020 #marianne2020",225,320,1538,"{'hashtags': ['#marianne2020'], 'urls': [], 'photos': [], 'videos': []}"
1171414340286734336,False,2019-09-10 21:25:17,"“The system is even more corrupt than I knew, and people are even more wonderful than I hoped.” My appearance on Fox and Friends this morning.. https://video.foxnews.com/v/6084943276001/#sp=show-clips …",104,160,684,"{'hashtags': [], 'urls': [], 'photos': [], 'videos': []}"
1171247168553963521,False,2019-09-10 10:21:00,"“Serious harm to the Earth IS preventable: when govt ministers can no longer issue permits for it, insurers can no longer underwrite it, investors can no longer back it & CEOs can be held criminally responsible for it, the harm will stop.”

JOJO MEHTA
Ecological Defence Integrity",34,170,671,"{'hashtags': [], 'urls': [], 'photos': [], 'videos': []}"
1171225655465402369,False,2019-09-10 08:55:31,We should transition from regulating industrial-scale harm to the earth to criminalizing industrial-scale harm to the earth. It’s time to outlaw ecocide.,132,540,2507,"{'hashtags': [], 'urls': [], 'photos': [], 'videos': []}"
1171023006006726658,False,2019-09-09 19:30:15,"Responding to objections to US giving aerial support in Saudi Arabia's genocidal war in Yemen in exchange for $350B arms deal, Sec.of State Pompeo said ""you can have strategic partnerships with people who do not share your values."" No you can't. It just means you have no values.",83,423,1536,"{'hashtags': [], 'urls': [], 'photos': [], 'videos': []}"
1171012228734169088,False,2019-09-09 18:47:26,Russell Brand will be joining me in Los Angeles on Sept. 15 https://www.marianne2020.com/events https://twitter.com/rustyrockets/status/1159550711786549251 …,136,147,706,"{'hashtags': ['#2020Election'], 'urls': ['https://www.marianne2020.com/events'], 'photos': [], 'videos': []}"
1170994759382503425,False,2019-09-09 17:38:01,"US spends over $750B/yr on Defense Dept, $40B on State Dept. Within State is all diplomacy, humanitarian assistance & peace building. With a US Dept. of Peace, waging peace will be given equal power on the national security agenda as is preparation for wa https://www.marianne2020.com/issues/us-department-of-peace-plan …",43,115,399,"{'hashtags': [], 'urls': [], 'photos': [], 'videos': []}"
1170950066066087936,False,2019-09-09 14:40:25,"The way to a prosperous economy & healthy society in the future is thru taking better care of our children today. We’ve normalized the despair of millions of our children, and rescuing them from their trauma is essential to our transformation and repair https://www.marianne2020.com/issues/child-advocacy …",41,136,518,"{'hashtags': [], 'urls': [], 'photos': [], 'videos': []}"
1170897477978992641,False,2019-09-09 11:11:27,"Our democracy itself is at risk. We need to get rid of politicized gerrymandering, make voter registration automatic, make Election Day a holiday or change it to Saturday, and pass a constitutional amendment to publicly pay for all federal campaigns https://www.marianne2020.com/issues/democracy-at-risk …",68,178,653,"{'hashtags': [], 'urls': [], 'photos': [], 'videos': []}"
1170827941036658690,False,2019-09-09 06:35:08,"Happy birthday to @SenSanders, whose inspiration and example are one of the great lights of our time. Here’s to his health and happiness and best year yet ",273,1124,11347,"{'hashtags': [], 'urls': [], 'photos': [], 'videos': []}"
1170825747319144450,False,2019-09-09 06:26:25,"A species whose behavior is maladaptive for its survival has one of two choices: to evolve or go extinct. Our collective human behavior has gone from dysfunction to malfunction, both in that we fight too much and that we are actively destroying our own habitat.The choice is ours.",74,362,1219,"{'hashtags': [], 'urls': [], 'photos': [], 'videos': []}"
1170824198996078594,False,2019-09-09 06:20:16,We can’t directly fight dog whistles; we have to drown them out with a choir of voices that are speaking of higher things. Mercy. Love. Compassion. Justice. Democracy. Conscience. Values. Vision. Collectivized hatred can only be driven out by the power of collectivized love.,88,182,905,"{'hashtags': [], 'urls': [], 'photos': [], 'videos': []}"
1170740773031223296,False,2019-09-09 00:48:46,"The system is even more corrupt than we’ve feared but the people of the US are even more decent than we’ve hoped. The gap between the consciousness of the American people & the way our government operates is the problem that confronts us, & only we the people can fill in the gap.",124,329,1428,"{'hashtags': [], 'urls': [], 'photos': [], 'videos': []}"
1170533123567697920,False,2019-09-08 11:03:38,"This Thursday, September 12, the DNC will host its third presidential debate. I won’t be there, but directly afterwards, live in Los Angeles and via livestream, I will offer my own take on the issues. 

http://Marianne2020.com/events  to register. 

#bigtruth #marianne2020 #demdebat pic.twitter.com/scDe2faJPy",104,210,687,"{'hashtags': ['#bigtruth', '#marianne2020', '#demdebate'], 'urls': ['http://Marianne2020.com/events'], 'photos': ['https://pbs.twimg.com/media/ED6Rq4mU0AI1zUI.jpg'], 'videos': []}"
1170482380974350336,False,2019-09-08 07:42:00,"I spoke at the New Hampshire Democratic Party Convention today.
Here is the link to the full video: https://youtu.be/Ya4g9xZchsg 
#bigtruth #marianne202 pic.twitter.com/Cct6iYn3Ky",104,186,725,"{'hashtags': ['#bigtruth', '#marianne2020'], 'urls': ['https://youtu.be/Ya4g9xZchsg'], 'photos': [], 'videos': [{'id': 'bIkd6BdSWbhEddJh'}]}"
1170424701170008064,False,2019-09-08 03:52:48,Marianne Williamson Live now at NH Democratic convention: https://www.c-span.org/video/?463579-1/hampshire-democratic-party-convention&vod …,33,48,197,"{'hashtags': [], 'urls': ['https://www.c-span.org/video/?463579-1/hampshire-democratic-party-convention&vod'], 'photos': [], 'videos': []}"
1170419809751879680,False,2019-09-08 03:33:22,https://thehill.com/opinion/campaign/460224-why-the-media-dislike-andrew-tulsi-bernie-and-marianne …,86,274,1095,"{'hashtags': [], 'urls': [], 'photos': [], 'videos': []}"
1170299189231792129,False,2019-09-07 19:34:04,"The only thing powerful enough to override an immoral politics is a moral one. Pillars of a moral politics are: creating a moral economics, rescuing millions of traumatized children, reversing climate change, challenging the military-industrial complex, and racial reconciliation.",124,324,1479,"{'hashtags': [], 'urls': [], 'photos': [], 'videos': []}"
1158450849867345920,True,2019-08-06 02:53:00,2020 candidate @MarWilliamson says the U.S. must cope with its ‘original character defect’ of racism by harnessing the ‘moral force’ of reparation pic.twitter.com/qm7d5izfyG,71,226,603,"{'hashtags': [], 'urls': [], 'photos': [], 'videos': [{'id': 'rvWGV2_1bclYsHMB'}]}"
1170291416414793728,False,2019-09-07 19:03:11,"The third DNC debate will be on Sept. 12, and I will be doing post-debate commentary immediately afterwards (8pm PT) live from LA and on livestream. Stay tuned for details.",121,191,1158,"{'hashtags': [], 'urls': [], 'photos': [], 'videos': []}"
1170171264637579264,False,2019-09-07 11:05:44,https://thriveglobal.com/stories/whos-afraid-of-marianne-williamson-everyone/ …,123,218,970,"{'hashtags': [], 'urls': [], 'photos': [], 'videos': []}"
1170153636405497856,False,2019-09-07 09:55:41,"Another very cool fundraiser coming up! This one will be in Los Angeles with special guest @rustyrockets on Sunday, September 15th. Details and  tickets here: https://secure.actblue.com/donate/mw9.15.19wl … #bigtruth #marianne202 pic.twitter.com/xqbUsDDFn0",21,63,274,"{'hashtags': ['#bigtruth', '#marianne2020'], 'urls': ['https://secure.actblue.com/donate/mw9.15.19wl'], 'photos': ['https://pbs.twimg.com/media/ED04huMUYAE9Cdp.jpg'], 'videos': []}"
