tweetId,isRetweet,time,text,replies,retweets,likes,entries
1184912087446904832,False,2019-10-18 03:20:30,"Anything to help people thrive amounts to an economic stimulant. When people are taken care of when sick, not worried about health care for themselves or their kids, educated fully & unburdened by college loans, they’re more creative and productive. That’s where money comes from!",39,164,701,"{'hashtags': [], 'urls': [], 'photos': [], 'videos': []}"
1184897500790038529,False,2019-10-18 02:22:33,"We need strict gun safety laws &  to end foreign wars, but those alone aren’t enough. We must treat cause and not just symptom. We must embrace non-violence if we wish to rid ourselves of violence. That’s why as president I’ll establish a US Dept of Peace https://www.marianne2020.com/issues/us-department-of-peace-plan …",31,73,281,"{'hashtags': [], 'urls': [], 'photos': [], 'videos': []}"
1184894662114451456,False,2019-10-18 02:11:16,"The way to help everyone win is to help everyone win. That’s why universal health care, free college, and cancelling college loan debt are the keys to economically righting our ship. Let more people into the game! Help more people win! America itself then wins.",18,56,235,"{'hashtags': [], 'urls': [], 'photos': [], 'videos': []}"
1184894646402605058,False,2019-10-18 02:11:12,"The idea that by increasing the riches for a few we would uplift the many, is an economic theory that over the last 40 years has created the greatest income inequality since 1929. The American people need to recognize its tenets as a system of economic tyranny, and repudiate it.",11,63,229,"{'hashtags': [], 'urls': [], 'photos': [], 'videos': []}"
1184894635837198336,False,2019-10-18 02:11:10,"The purpose of govt is to help its people; what Lincoln called govt “of the people, by the people & for the people.” Purpose of govt isn’t to help a few people at the expense of everyone else; that’s govt “of a few of the people, by a few of the people & for a few of the people.",20,99,350,"{'hashtags': [], 'urls': [], 'photos': [], 'videos': []}"
1184888092529954821,False,2019-10-18 01:45:10,"We need to begin a new chapter in our history, based not on reacting to this president but in transforming the mindset that produced him. Our country should not be run like a business; it should be run like a family. Prioritize food, love, education, health, safety & home repair",173,527,2505,"{'hashtags': [], 'urls': [], 'photos': [], 'videos': []}"
1184883422596079617,False,2019-10-18 01:26:36,Good conversation with the wonderful Margie Warrell.. https://twitter.com/margiewarrell/status/1184346145000083456 …,7,44,166,"{'hashtags': ['#LiveBravePodcast', '#2020Election', '#USelection'], 'urls': [], 'photos': [], 'videos': []}"
1184822202425729024,False,2019-10-17 21:23:20,Loved being with the wonderful women on the That’s So Retrograde podcast.. https://podcasts.apple.com/us/podcast/thats-so-retrograde/id966362392?i=1000453833549 …,10,49,150,"{'hashtags': [], 'urls': [], 'photos': [], 'videos': []}"
1184794475358351360,False,2019-10-17 19:33:09,"Congressman Elijah Cummings (1951-2019) was someone whose presence lifted all of us to a better place. The example of both his personhood and his politics blazed a trail for the rest of us to follow. May he Rest In Peace, and in his honor may we carry on.",47,213,1249,"{'hashtags': [], 'urls': [], 'photos': [], 'videos': []}"
1184727247011233800,False,2019-10-17 15:06:01,The guiding principle of all public policy should be this: what is it that would make people thrive? Today’s interview with @cenkuygur on @TheYoungTurks. https://tyt.com/watch/the-conversation/3S2qA5RSCChNZEjoLN2okn/episodes/7jE3knIN7QeEdbJtsZgdd3  pic.twitter.com/80tm6IGCc4,42,92,354,"{'hashtags': [], 'urls': ['https://tyt.com/watch/the-conversation/3S2qA5RSCChNZEjoLN2okn/episodes/7jE3knIN7QeEdbJtsZgdd3'], 'photos': ['https://pbs.twimg.com/media/EHD_JoRUUAErTUX.jpg'], 'videos': []}"
1184601295971205120,False,2019-10-17 06:45:32,"“Ladies and gentlemen, I present to you: faux democracy” .. https://www.google.com/amp/s/www.washingtonpost.com/opinions/2019/10/16/marianne-williamson-after-last-nights-debate-theres-no-way-im-dropping-out/%3foutputType=amp …",91,224,708,"{'hashtags': [], 'urls': [], 'photos': [], 'videos': []}"
1184350504144404480,False,2019-10-16 14:08:59,Trickle down economics hasn’t lifted all boats; it’s left millions of people without even a life vest pic.twitter.com/qdzGJLYGkU,41,222,802,"{'hashtags': [], 'urls': [], 'photos': [], 'videos': [{'id': 'nOXQqsSglq6gB0Wu'}]}"
1184288928905363457,False,2019-10-16 10:04:18,"Live from Encinitas, CA! Democratic Candidate Marianne Williamson Speaking on the Spirit of Americ https://www.pscp.tv/w/cHZyIjFkdktPTG9WZ3lnalh8MUx5eEJMbGdvZ1BHTmJdy_pUJbR7yY8E8c6YPZeb4J_gUzVYynpGXJczxjX- …",71,153,515,"{'hashtags': [], 'urls': [], 'photos': [], 'videos': []}"
1184283375919497217,False,2019-10-16 09:42:14,You decide https://www.washingtonpost.com/opinions/2019/10/15/we-may-never-see-marianne-williamson-debate-stage-again-thats-pity/ …,103,143,582,"{'hashtags': [], 'urls': [], 'photos': [], 'videos': []}"
1184271219966627840,False,2019-10-16 08:53:56,"For an alternative conversation, see my livestream tonight at http://marianne2020.com/live . Also on Fb/YT/Twitter. 7pm pacific/10pm eastern",30,116,354,"{'hashtags': [], 'urls': ['http://marianne2020.com/live'], 'photos': [], 'videos': []}"
1184257793445912577,False,2019-10-16 08:00:35,"No, they’re not the only Democratic candidates for President of the United States.",486,1085,7054,"{'hashtags': [], 'urls': [], 'photos': [], 'videos': []}"
1184160491863588864,False,2019-10-16 01:33:56,Tonight is the fourth Democratic debate.. https://www.marianne2020.com/blog ,53,68,274,"{'hashtags': [], 'urls': [], 'photos': [], 'videos': []}"
1184012296361660416,False,2019-10-15 15:45:03,We need more than small random acts of kindness. We need huge strategized acts of doing the right thing pic.twitter.com/bnAofnuz3R,64,253,870,"{'hashtags': [], 'urls': [], 'photos': [], 'videos': [{'id': '93y2H6d54q11MQr_'}]}"
1183998589141319680,False,2019-10-15 14:50:35,"Thank you, Tim! I enjoyed being with you.. https://twitter.com/RealTimBlack/status/1183961537867857920 …",5,50,274,"{'hashtags': ['#marianne2020'], 'urls': [], 'photos': [], 'videos': []}"
1183973313833365504,False,2019-10-15 13:10:09,...to 1)provide universal healthcare 2)free tuition at public colleges & universities 3)cancel all college loans 4)massive realignment of investment in the direction of children 5)reparations for slavery & justice for Native Americans 6)wage peace domestically & internationally.,26,68,300,"{'hashtags': [], 'urls': [], 'photos': [], 'videos': []}"
1183972383905857536,False,2019-10-15 13:06:28,"We need to repeal the 2017 $2T tax cut (put back in the middle class one), stop corporate subsidies, negotiate lower drug prices w/ big pharma,stop military spending over what military says they need, tax 3% billionaire assets, 2% on over $500M. Then we have some cash on hand...",20,72,331,"{'hashtags': [], 'urls': [], 'photos': [], 'videos': []}"
1183970970446336000,False,2019-10-15 13:00:51,"After 40 years the jury is in: Trickle down economics didn’t lift all boats, it left millions of people without even a life vest. No real income inequality in the 1970s; now, 1% of all Americans own more wealth than the bottom 90%. 93 million Americans in poverty or near poverty.",28,53,286,"{'hashtags': [], 'urls': [], 'photos': [], 'videos': []}"
1183970209331171328,False,2019-10-15 12:57:49,"In the 1960’s, President Lyndon Johnson proclaimed a War on Poverty. In the 1980’s the pillars of poverty alleviation were removed in favor of a “trickle-down economic theory” that govt policy advocating for corporate wealth would “lift all boats.”",40,102,570,"{'hashtags': [], 'urls': [], 'photos': [], 'videos': []}"
1183896182629662720,False,2019-10-15 08:03:40,The problem is not just that we invaded Iraq. The equal problem is that the American people so easily allowed it to happen pic.twitter.com/2pERBKKmwW,71,162,627,"{'hashtags': [], 'urls': [], 'photos': [], 'videos': [{'id': 'YB282TagIMlTyPel'}]}"
1183787357385842688,False,2019-10-15 00:51:14,"Biggest threat to our health not only lack of access to healthcare; also lack of access to healthy food, uncontaminated water, non-toxic air, noncarcinogenic-laced food & affordable fresh produce. Til we return power to FDA & EPA to regulate & protect, our health is under attack.",70,241,984,"{'hashtags': [], 'urls': [], 'photos': [], 'videos': []}"
1183598749068615680,False,2019-10-14 12:21:46,I won’t be in the debate this week but let’s make it into #5! Donate what you can so we can increase our exposure and  make it back in for the next one. It’ll be a more interesting evening: https://secure.actblue.com/donate/marianne-williamson-2020-committee …,59,140,612,"{'hashtags': [], 'urls': [], 'photos': [], 'videos': []}"
1183505650552164352,False,2019-10-14 06:11:50,"As it turns out, the American revolution is an ongoing process. Our mistake was in ever thinking that it was a done deal. In fact, it’s never a done deal. It’s a spirit that must be ignited and reignited in every generatio https://www.youtube.com/watch?v=VTIAK_bqisU …",27,110,339,"{'hashtags': [], 'urls': [], 'photos': [], 'videos': []}"
1183456257375637505,False,2019-10-14 02:55:33,"While the vast majority of police officers in this country are good men and women courageously serving us every single day, police shootings of innocent citizens - particularly black Americans - has reached intolerable numbers. A special Independent Commission must now be formed.",125,317,1442,"{'hashtags': [], 'urls': [], 'photos': [], 'videos': []}"
1183415301238509568,False,2019-10-14 00:12:49,"Marianne Williamson Speaking on the Spirit of America - Live from Chicago, I https://www.pscp.tv/w/cHNEgTFkdktPTG9WZ3lnalh8MXpxS1ZFcE5vd2F4Qm-tsxsHwgcDstPdHlF7qgLZPcFhH4ypn5n2GRxIaZDU …",45,133,377,"{'hashtags': [], 'urls': [], 'photos': [], 'videos': []}"
1183347869417431040,False,2019-10-13 19:44:52,"Thank you for sharing your story, Christopher pic.twitter.com/tRUrzFuMd8",15,81,348,"{'hashtags': [], 'urls': [], 'photos': [], 'videos': [{'id': 'XuebBMRYSfXvaEiW'}]}"
1183231709686484993,False,2019-10-13 12:03:17,More of the Chicago intervie https://youtu.be/YkhHRq89Cjw ,7,32,94,"{'hashtags': [], 'urls': [], 'photos': [], 'videos': []}"
1183208653018554368,False,2019-10-13 10:31:40,"On Elizabeth, Tulsi, Amy and m https://cltv.com/2019/10/11/marianne-williamson-brings-presidential-campaign-to-chicago/ …",47,94,397,"{'hashtags': [], 'urls': [], 'photos': [], 'videos': []}"
1183076865486966785,False,2019-10-13 01:47:59,"It’s not just our right, it’s also our responsibility, to stand up to undemocratic forces and put our nation back on track pic.twitter.com/mAVjKKyrNP",32,158,511,"{'hashtags': [], 'urls': [], 'photos': [], 'videos': [{'id': 'DZknCNZjd1S3dk-Y'}]}"
1182890775970897920,False,2019-10-12 13:28:32,"Until we demand public funding for federal campaigns, then how things are is how things will remain.. pic.twitter.com/EuyGPGFXMC",34,154,517,"{'hashtags': [], 'urls': [], 'photos': [], 'videos': [{'id': 'iIVan3C0kyBtLiHC'}]}"
1182866377939529728,False,2019-10-12 11:51:35,"Kudos to Gov @GavinNewsom for banning for-profit prisons and immigrant detention centers, and legalizing public banking in CA. Bad public policy can be repealed; good public policy can replace it.",66,235,1278,"{'hashtags': [], 'urls': [], 'photos': [], 'videos': []}"
1182804485866999813,False,2019-10-12 07:45:39,"It’s important to accept and celebrate who we are, and it’s key to learning how to accept and celebrate who others are too. Congratulations to those who feel that this is day to say to all the world, “This is who I am!” #ComingOutDAy",37,125,650,"{'hashtags': ['#ComingOutDAy'], 'urls': [], 'photos': [], 'videos': []}"
1182779780581810176,False,2019-10-12 06:07:29,"93 million Americans live in poverty or near poverty. The next time somebody tells you the economy is good, ask them “Good for whom?” The way to have a vibrant society and an abundant economy is to help people thrive https://www.marianne2020.com/posts/a-good-economy-for-whom …",57,191,538,"{'hashtags': [], 'urls': [], 'photos': [], 'videos': []}"
1182662237674262531,False,2019-10-11 22:20:24,This is not a time in history to look away from things we know to be true.. https://www.youtube.com/watch?v=rtF011oDc0w&feature=youtu.be …,25,96,287,"{'hashtags': [], 'urls': [], 'photos': [], 'videos': []}"
1182419922166530048,False,2019-10-11 06:17:32,Does a child not have the right to pursue happiness https://www.youtube.com/watch?v=jCL4GbbsMM0&feature=youtu.be …,61,90,353,"{'hashtags': [], 'urls': [], 'photos': [], 'videos': []}"
1182339776323604480,False,2019-10-11 00:59:04,"By withdrawing from Syria the way we have, the US not only abandons our Kurdish allies -signaling to allies everywhere that we’re untrustworthy - but is also leading to the release of thousands of ISIS prisoners our troops have fought valiantly to destroy https://www.nytimes.com/2019/10/10/us/politics/turkey-kurds.html?action=click&module=Top%20Stories&pgtype=Homepage …",84,134,376,"{'hashtags': [], 'urls': [], 'photos': [], 'videos': []}"
1182292830452142085,False,2019-10-10 21:52:31,I have great respect for Tulsi for saying such inconvenient truth. She is absolutely correct https://twitter.com/TulsiGabbard/status/1182282461859811328 …,318,642,2985,"{'hashtags': [], 'urls': [], 'photos': [], 'videos': []}"
1182258217591676929,False,2019-10-10 19:34:59,The part of the brain that rationally analyses an issue is not the part of the brain that decides who to vote for. It will take more than reason alone to inspire a massive enough electorate to choose the democrat in 2020. It will take inspiration that emerges from a call to love.,21,64,335,"{'hashtags': [], 'urls': [], 'photos': [], 'videos': []}"
1182258216585043969,False,2019-10-10 19:34:58,Trump’s campaign will be a political narrative laced with fear; my political narrative is stronger than his because it’s laced with love. I have good and detailed policy positions but those alone will not defeat him. It will take outrageous truthtelling to defeat outrageous lies.,22,66,338,"{'hashtags': [], 'urls': [], 'photos': [], 'videos': []}"
1182258214408245249,False,2019-10-10 19:34:58,For those who say “I just want someone who can win!:” Fear dismantles reason; only love dismantles fear. The  candidate best able to win in 2020 is someone calling Americans to a moral high ground. Our win lies not to harnessing people’s rage but in harnessing their conscience.,41,178,909,"{'hashtags': [], 'urls': [], 'photos': [], 'videos': []}"
1182068052654882816,False,2019-10-10 06:59:20,"Live from Charleston, SC! A Conversation with US Presidential Candidate Marianne Williamso https://www.pscp.tv/w/cG5dyDFkdktPTG9WZ3lnalh8MU95S0Flbk5nb3dLYhe1GGwRI3XWb6JWrkpwrFr3CrXvgmBi1X_1V8Nnpyf6 …",8,43,159,"{'hashtags': [], 'urls': [], 'photos': [], 'videos': []}"
1182060614354534403,False,2019-10-10 06:29:46,"Live from Charleston, SC! A Conversation with US Presidential Candidate Marianne Williamso https://www.pscp.tv/w/cG5W2jFkdktPTG9WZ3lnalh8MXluS093ckFBbU9LUuOboEMZ8B2uqU0ApVjnvP2uUbOZhzyZMTqizemboMsa …",16,67,205,"{'hashtags': [], 'urls': [], 'photos': [], 'videos': []}"
1182055383763800064,False,2019-10-10 06:08:59,"Live from Charleston, SC! A Conversation with US Presidential Candidate Marianne Williamso https://www.pscp.tv/w/cG5R-zFkdktPTG9WZ3lnalh8MW1ueGV6d1hXcExLWINCSVThUnL4xzpHRGE72Y6UQ_kJLLzkFBBranqPjzbI …",4,35,129,"{'hashtags': [], 'urls': [], 'photos': [], 'videos': []}"
1181949031821578240,False,2019-10-09 23:06:23,Today would have been John Lennon’s 79th birthday. His absence from our lives over the last few decades has been an immeasurable loss. Doing anything we can to increase peace and love in the world is the highest form of praise we can give to the spirit he unleashed in our midst.,98,252,1486,"{'hashtags': [], 'urls': [], 'photos': [], 'videos': []}"
1181928128870043649,False,2019-10-09 21:43:19,The president’s betrayal of Kurdish forces in Syria is another example  - along with our giving aerial support to Saudi Arabia’s genocidal against Yemen -  of the United States having abandoned all moral authority regarding our foreign policy https://www.google.com/amp/s/www.nbcnews.com/news/amp/ncna1064106 …,75,156,497,"{'hashtags': [], 'urls': [], 'photos': [], 'videos': []}"
1181919237574578177,False,2019-10-09 21:07:59,All public policy should be built around one central question: what would help people thrive https://www.youtube.com/watch?v=EeghNumea14&feature=youtu.be …,38,81,329,"{'hashtags': [], 'urls': [], 'photos': [], 'videos': []}"
1181806130449637376,False,2019-10-09 13:38:33,Women shouldn’t use our power just to prop up the system; we should use our power to change the system pic.twitter.com/NTM4sAcNCa,43,197,802,"{'hashtags': [], 'urls': [], 'photos': [], 'videos': [{'id': 'TU5odhOnHGKcglps'}]}"
1181540540413820928,False,2019-10-08 20:03:11,"Today SCOTUS hears a case that will determine whether Title VII of the Civil Rights Act of 1964, protecting Americans from discrimination based on sex/gender, applies to trans people. If they rule that it does, those important protections will be available nationwide.",47,180,689,"{'hashtags': [], 'urls': [], 'photos': [], 'videos': []}"
1181518807078191104,False,2019-10-08 18:36:49,Our task is to close the gap between the goodness in our hearts and the venality of our public policy. My talk at the UNH Carsey School Of Public Policy.. https://www.youtube.com/watch?v=wz6ihZZSgc4&feature=youtu.be …,19,76,247,"{'hashtags': [], 'urls': [], 'photos': [], 'videos': []}"
1180454172681850880,False,2019-10-05 20:06:21,“We have it in our power to begin the world over again.” - Thomas Pain pic.twitter.com/h9hH1oD85F,76,252,1008,"{'hashtags': [], 'urls': [], 'photos': [], 'videos': [{'id': 'T6F9S-tXU86Q0D7e'}]}"
1180289590734856193,False,2019-10-05 09:12:21,This is one of the cruelest policies to come out of this White House yet. A nation cannot be great if it is not good https://www.nytimes.com/2019/10/04/us/immigrant-visas-health-care.amp.html …,129,175,650,"{'hashtags': [], 'urls': [], 'photos': [], 'videos': []}"
1180248007704375297,False,2019-10-05 06:27:07,"Democratic Presidential Candidate Marianne Williamson Live from Louisville, K https://www.pscp.tv/w/cGe-uzFkdktPTG9WZ3lnalh8MW1ueGV6UG1tUm5LWHbUFp0JIiOvfGbbpLZEqWrnZLiA_apEOMKfWc0E82Rd …",28,102,355,"{'hashtags': [], 'urls': [], 'photos': [], 'videos': []}"
1180247212971839488,True,2019-10-05 06:23:58,@marwilliamson San Diego I-5 Friday rush hour traffic and many eyeballs on YOU!  Horns honking too!! Love our Grassroots team! #WilliamsonRising #marianne202 pic.twitter.com/erDjUIZeyR,15,69,263,"{'hashtags': ['#WilliamsonRising', '#marianne2020'], 'urls': [], 'photos': ['https://pbs.twimg.com/media/EGEUk_lUwAASTeI.jpg'], 'videos': []}"
1180243582407430145,False,2019-10-05 06:09:32,"I’ll be live streaming tonight at 6:30pm ET from Louisville, KY. Join me here, Facebook, YouTube or o http://Marianne2020.com/live ",16,56,198,"{'hashtags': [], 'urls': [], 'photos': [], 'videos': []}"
1180146280250691584,True,2019-10-04 23:42:53,"It amazes me every time I hear @marwilliamson speak on #Reparations2020 and how effortlessly she bridges the divide between #ADOS & White Americans. It's clear to me who I'm voting for. Screw a #DemDebate without her, she's my #POTUS

Shame on the other candidates #ADOSConferenc pic.twitter.com/BliMJUisl1",13,75,221,"{'hashtags': ['#Reparations2020', '#ADOS', '#DemDebate', '#POTUS', '#ADOSConference'], 'urls': [], 'photos': ['https://pbs.twimg.com/media/EGC4xboX0AAAYOt.jpg', 'https://pbs.twimg.com/media/EGC4xuZXoAMZWJM.jpg', 'https://pbs.twimg.com/media/EGC4yB7WoAotGlh.jpg', 'https://pbs.twimg.com/media/EGC4yReXYAA-bOu.jpg'], 'videos': []}"
1180161247192309760,False,2019-10-05 00:42:22,My elevator pitch at Yahoo news.. https://www.yahoo.com/amphtml/lifestyle/elevator-pitch-marianne-williamson-144630414.html …,26,80,242,"{'hashtags': [], 'urls': [], 'photos': [], 'videos': []}"
1179941039131508736,False,2019-10-04 10:07:20,The whole Yahoo Finance intervie https://finance.yahoo.com/amphtml/news/marianne-williamson-plans-to-stay-in-the-race-and-backs-impeaching-lawless-trump-205711173.html …,17,56,188,"{'hashtags': [], 'urls': [], 'photos': [], 'videos': []}"
1179932475436470273,False,2019-10-04 09:33:18,God I love America.. https://twitter.com/blakepruitt/status/1170908718147493888 …,75,312,1728,"{'hashtags': [], 'urls': [], 'photos': [], 'videos': []}"
1179827420431556609,False,2019-10-04 02:35:51,The Yahoo Finance interview was thorough and fair today. Many thanks to the people there https://twitter.com/YahooFinance/status/1179819383536795648 …,29,123,491,"{'hashtags': [], 'urls': [], 'photos': [], 'videos': []}"
1179497169864269824,False,2019-10-03 04:43:33,We’re # 6 https://twitter.com/MonmouthPoll/status/1179418515905945601 …,187,311,1732,"{'hashtags': ['#2020Dem'], 'urls': [], 'photos': [], 'videos': []}"
1179456460419452928,False,2019-10-03 02:01:48,Everyone should have the right to join a union; the assault on unions is key to the corporatist agenda.  I’m proud to stand with @SEIU1984 (NH) and the employees of Rockingham County Rehabilitation and Nursing as they gear up for their October 3rd election.  #UnionsforAll #FITN,19,72,335,"{'hashtags': ['#UnionsforAll', '#FITN'], 'urls': [], 'photos': [], 'videos': []}"
1179447128151580672,False,2019-10-03 01:24:43,I'm on Thom Hartmann's show right now.. https://www.thomhartmann.com/radio/listen-live …,18,45,184,"{'hashtags': [], 'urls': [], 'photos': [], 'videos': []}"
1179420886249672710,False,2019-10-02 23:40:26,"My prayers are with @BernieSanders and his family while he recuperates and rests. We love you, Bernie!",151,965,10586,"{'hashtags': [], 'urls': [], 'photos': [], 'videos': []}"
1179356049234677760,False,2019-10-02 19:22:48,Economic system of the US was created & designed before women had a voice in the public realm. We do have a voice now; it’s important that we use it not to fit into the system but to change the system. The main engine of our economy should be the care & nurturance of our children,63,174,715,"{'hashtags': [], 'urls': [], 'photos': [], 'videos': []}"
1179324411511476224,False,2019-10-02 17:17:05,We need a Dept. of Children & Youth to adequately coordinate efforts to raise up & protect our kids. Nothing will more fundamentally disrupt the status quo & release the future to new possibilities than radical realignment of investment in their direction https://www.youtube.com/watch?v=wr3wkt2dp_I …,39,74,332,"{'hashtags': [], 'urls': [], 'photos': [], 'videos': []}"
1179320698868813824,False,2019-10-02 17:02:19,"Given our numbers, American women could and should be a moral force for good. We have tremendous power that we’re not yet using. #1 one should be the health and safety of children here & elsewhere. We should be fierce on their behalf, from safety to health to education to freedom",19,92,430,"{'hashtags': [], 'urls': [], 'photos': [], 'videos': []}"
1179315231887101952,False,2019-10-02 16:40:36,"Children have no capacity to defend themselves from abuse. It’s our moral & civic responsibility to do for them what they cannot do for themselves. There should be a public outcry, a demand that the fight against online abuse of children be properly funded and vigorously pursued.",15,86,418,"{'hashtags': [], 'urls': [], 'photos': [], 'videos': []}"
1179315230964420609,False,2019-10-02 16:40:36,Many times people say “I don’t even want to know about those things because there’s nothing I can do & it just makes me depressed.” But it’s actually the opposite. Power goes where attention goes. Know about such things in order to talk about them in order to change them.,6,86,360,"{'hashtags': [], 'urls': [], 'photos': [], 'videos': []}"
1179315227877400576,False,2019-10-02 16:40:35,"“The United States is number two in the world for hosting child pornography websites.” Dangers to our children should be a top priority, yet only half the money appropriated to fight crimes against children online has been given to the effort  https://www.pbs.org/newshour/show/why-its-so-hard-to-stop-images-of-child-sex-abuse …",20,89,269,"{'hashtags': [], 'urls': [], 'photos': [], 'videos': []}"
1179239382127185920,False,2019-10-02 11:39:12,I’m all in for Public Banking - bravo to those in California who are making it happen there. Recent interest in Public Banking is a healthy sign; pushing back against usurious practices on the part of banks has been an important corrective measure through our history. #bigtruth,35,175,969,"{'hashtags': ['#bigtruth'], 'urls': [], 'photos': [], 'videos': []}"
1179206836391747584,False,2019-10-02 09:29:53,"Loved being there, guys. Thank you https://twitter.com/nottonyt/status/1178825487059243009 …",18,54,320,"{'hashtags': [], 'urls': [], 'photos': [], 'videos': []}"
1179183789387456513,False,2019-10-02 07:58:18,"The ground on which we’ll unite  as Americans is the higher ground of moral repair. Not Left or Right, or even Democrats or Republicans. We’ll unite as Americans, having come to realize that aligning public policy with the goodness in our hearts is our best and only path forward.",70,156,664,"{'hashtags': [], 'urls': [], 'photos': [], 'videos': []}"
