tweetId,isRetweet,time,text,replies,retweets,likes,entries
1067202876706050048,False,2018-11-27 07:46:08,The HOPE Initiative and BH Link are just two of the new innovative programs helping to address the opioid crisis in Rhode Island. Thank you to the staff here working hard to save lives – @BloombergDotOrg is committed to replicating your progress across the nation pic.twitter.com/OAKG19jbB7,9,31,134,"{'hashtags': [], 'urls': [], 'photos': ['https://pbs.twimg.com/media/Ds93NJDWoAMNc0B.jpg'], 'videos': []}"
1067198071115841536,False,2018-11-27 07:27:02,"The opioid epidemic is a national emergency with devastating consequences, but progress is possible – state officials, medical professionals, law enforcement officers and survivors here in Rhode Island are proving it pic.twitter.com/ve1T3Q1NAP",4,23,92,"{'hashtags': [], 'urls': [], 'photos': ['https://pbs.twimg.com/media/Ds9yvatX4AA-RyS.jpg'], 'videos': []}"
1067192364899414016,False,2018-11-27 07:04:21,"Ending the opioid epidemic requires bold, urgent action – and cooperation among leaders in public health, criminal justice, and community advocacy. Under @GovRaimondo, Rhode Island's pioneering efforts provide a strong example for the country pic.twitter.com/j01Nsc9cPK",13,35,138,"{'hashtags': [], 'urls': [], 'photos': ['https://pbs.twimg.com/media/Ds9tp3yXgAEeg1a.jpg'], 'videos': []}"
1067152291894042624,True,2018-11-27 04:25:07,SASB was honored to ring the @Nasdaq opening bell today with @JetBlue and a host of supporters in celebration of our newly codified sustainability standards! SASB connects companies and investors on the financial impact of ESG (Photo @LibbyGreene /Nasdaq) #ESG #SASBStandard pic.twitter.com/TzGXLGt7tH,2,10,30,"{'hashtags': ['#ESG', '#SASBStandards'], 'urls': [], 'photos': ['https://pbs.twimg.com/media/Ds9JV8mWkAMSbWt.jpg', 'https://pbs.twimg.com/media/Ds9JWK2W0AA4mZ5.jpg', 'https://pbs.twimg.com/media/Ds9JWb7WkAEByVV.jpg'], 'videos': []}"
1067176001560551425,True,2018-11-27 05:59:20,"As former #NYC Mayor, businessman, author, & philanthropist, @MikeBloomberg knows how to lead. Get on his level by reading books by @HarvardBiz & many more! Then visit #SubwayReads and check out Climate of Hope, his book by @MacmillanUSA.  http://bit.ly/2zq5H2Y pic.twitter.com/9iGQzeiX2T",1,9,19,"{'hashtags': ['#NYC', '#SubwayReads'], 'urls': ['http://bit.ly/2zq5H2Y'], 'photos': ['https://pbs.twimg.com/media/Ds9e6lEWsAIDj4J.jpg'], 'videos': []}"
1064991927601369088,True,2018-11-21 05:20:36,"The majority of Americans want common-sense solutions to gun violence. @TOMS knows that, and they’ve launched a multifaceted campaign to #EndGunViolenceTogether.

We’re proud to stand alongside businesses like TOMS that are supporting efforts to keep our communities safe https://twitter.com/TOMS/status/1064731731381481472 …",32,72,219,"{'hashtags': ['#EndGunViolenceTogether', '#endgunviolencetogether'], 'urls': [], 'photos': [], 'videos': []}"
1065280830946373632,False,2018-11-22 00:28:36,"The Africa Business Media Innovators Forum this week will bring together some of the sharpest minds in business and government – with the hope of accelerating the successful growth of the media industry, the middle class, and economies across Africa https://mikebloom.bg/2zkl4Kf ",11,28,72,"{'hashtags': [], 'urls': [], 'photos': [], 'videos': []}"
1064930808526450691,False,2018-11-21 01:17:44,"Small businesses are the backbone of our economy, with 90% of U.S. companies having less than 20 employees. Great to join @LloydBlankfein & small business owners from around the country at the #10KSmallBiz Coaching Session today pic.twitter.com/WBxe79w1Ze",22,37,141,"{'hashtags': ['#10KSmallBiz'], 'urls': [], 'photos': ['https://pbs.twimg.com/media/DsdklGjW0AA7afs.jpg', 'https://pbs.twimg.com/media/DsdkpHKW0AEH0l0.jpg'], 'videos': []}"
1064891273373540352,False,2018-11-20 22:40:38,".@CoralSpringsFL, along w/ the City of Parkland, is a winner in the 2018 @BloombergDotOrg #PublicArtChallenge for their project “Inspiring Community Healing After Gun Violence: The Power of Art. https://mikebloom.bg/2FyCR5Y ",10,57,228,"{'hashtags': ['#PublicArtChallenge'], 'urls': [], 'photos': [], 'videos': []}"
1064621760233046016,False,2018-11-20 04:49:42,"Our people are our most important asset, and our entire organization benefits from the diverse and inclusive culture we have long had at @Bloomberg—great to see Peter Grauer recognized for leading our progress on this at the company https://mikebloom.bg/2Q4vC9X ",13,39,159,"{'hashtags': [], 'urls': [], 'photos': [], 'videos': []}"
1064289685739057152,False,2018-11-19 06:50:09,"Through programs like @CollegePoint & the American Talent Initiative, @BloombergDotOrg is committed to increasing the number of talented, lower-income students who attend top colleges. Today I’m glad to announce a gift to help build on that progress https://mikebloom.bg/2Q4VAdb ",80,292,1251,"{'hashtags': [], 'urls': [], 'photos': [], 'videos': []}"
1064265197156802561,False,2018-11-19 05:12:50,"I’m giving $1.8 billion to @JohnsHopkins for financial aid so admissions can be permanently need blind. I want to open the same door of opportunity that I had for generations of talented students, regardless of financial circumstances https://www.nytimes.com/2018/11/18/opinion/bloomberg-college-donation-financial-aid.html?action=click&module=Opinion&pgtype=Homepage …",1703,11110,45535,"{'hashtags': [], 'urls': [], 'photos': [], 'videos': []}"
1063501305438773248,False,2018-11-17 02:37:24,"The @US_FDA’s ruling on e-cigarettes does not go far enough—we need a comprehensive, nationwide ban on selling all flavored e-cigarettes. Without it, the tobacco industry will continue to endanger public health, especially among children https://bloom.bg/2OMssD2 ",80,102,284,"{'hashtags': [], 'urls': [], 'photos': [], 'videos': []}"
1063075367341187079,True,2018-11-15 22:24:53,"Today @BloombergDotOrg, @gatesfoundation, and @BallmerGroup announced that What Works Cities will receive an additional $12 million investment to help more people access economic opportunity in U.S. cities! Learn more here https://bloombg.org/2DkQsea ",7,51,134,"{'hashtags': [], 'urls': [], 'photos': [], 'videos': []}"
1063157932131602433,False,2018-11-16 03:52:58,"Cities are leading the way on innovative solutions to urban challenges—but if you can’t measure it, you can’t manage it. @BloombergDotOrg is joining @GatesFoundation & @BallmerGroup on a new project working to analyze economic mobility data in U.S. cities https://mikebloom.bg/2OJpxec ",17,67,212,"{'hashtags': [], 'urls': [], 'photos': [], 'videos': []}"
1062722495533473792,False,2018-11-14 23:02:42,"We can do more to ensure our veterans get a top-tier education. Today, members of our American Talent Initiative are committing to enrolling and graduating more of those who served. https://mikebloom.bg/2OFjkA0 pic.twitter.com/ThogjnGypv",13,47,149,"{'hashtags': [], 'urls': ['https://mikebloom.bg/2OFjkA0'], 'photos': [], 'videos': [{'id': 'Dr-MVnpUUAAhXUm'}]}"
1062367194439409669,False,2018-11-13 23:30:51,".@Amazon’s decision to locate to Long Island City is an affirmation not only of NYC’s growing tech talent, but also of all the investments - in housing, schools, parks, transportation, and culture - that have turned LIC into such a thriving neighborhood https://www.nytimes.com/2018/11/12/arts/design/amazon-hq2-long-island-city-costs-benefits.html …",120,163,643,"{'hashtags': [], 'urls': [], 'photos': [], 'videos': []}"
1061031338545987584,False,2018-11-10 07:02:38,"9 out of 10 people around the world breathe polluted air, but bold action can meet that challenge and make a real difference. In India, @BloombergDotOrg will join the @WorldBank, @GIZ_gmbh & @ADB_HQ to support cities in the fight to clean up the air https://mikebloom.bg/2OFPKdO ",39,210,504,"{'hashtags': [], 'urls': [], 'photos': [], 'videos': []}"
1060993363011428353,True,2018-11-10 04:31:44,"Can't talk about @amazon and @Google expansion in NYC without looking at the big things we've built here to signal NYC as a tech capital with a great pipeline of talent. There can be no doubt that @cornell_tech, and @MikeBloomberg's vision, led the way https://cnn.it/2DuqgyI ",4,36,167,"{'hashtags': [], 'urls': [], 'photos': [], 'videos': []}"
1060932033709531136,True,2018-11-10 00:28:02,I learned so much being on the selection committee for the @BloombergDotOrg 2018 #MayorsChallenge! Very excited to see how the nine winning cities use their awards to foster innovation and create change in their communities @PhiladelphiaGov @fortcollinsgov @huntingtoncit https://twitter.com/BloombergDotOrg/status/1056942906123128834 …,4,21,64,"{'hashtags': ['#MayorsChallenge', '#MayorsChallenge'], 'urls': [], 'photos': [], 'videos': []}"
1060907782604550146,False,2018-11-09 22:51:40,"Coal-fired power plants are closing faster than ever, because Americans know that cleaner, cheaper energy is good for the environment, public health and the economy https://www.bloomberg.com/professional/blog/u-s-coal-plant-retirements-near-time-high/ …",19,151,489,"{'hashtags': [], 'urls': [], 'photos': [], 'videos': []}"
1060329161904902144,True,2018-11-08 08:32:26,"The City & @anchoragemuseum are winners in the @BloombergDotOrg 2018 #PublicArtChallenge, receiving up to $1M to support our project, SEED Lab. We are tackling the challenges & opportunities of a changing climate, changing equities and a changing economy. http://bit.ly/2QtbtXW ",3,19,58,"{'hashtags': ['#PublicArtChallenge'], 'urls': ['http://bit.ly/2QtbtXW'], 'photos': [], 'videos': []}"
1060376392263708672,False,2018-11-08 11:40:07,"Anchorage’s 2018 Public Art Challenge-winning project SEED Lab – a partnership between @AnchorageMuseum and the City – can inspire ideas for solutions not only in Alaska, but across the world. https://mikebloom.bg/2zCdDNN pic.twitter.com/807QF1jEQt",7,22,71,"{'hashtags': [], 'urls': ['https://mikebloom.bg/2zCdDNN'], 'photos': ['https://pbs.twimg.com/media/Drc2QjpWwAEVPM3.jpg'], 'videos': []}"
1060300236600500225,False,2018-11-08 06:37:30,"Last night showed the strength of the gun violence prevention movement with 150+ gun-sense candidates winning their bids for Congress, proving that candidates who stand up for common-sense gun laws can be elected – and those that don't can be defeated https://twitter.com/Everytown/status/1060032024696836096 …",37,100,519,"{'hashtags': ['#GunSenseMajority', '#ElectionNight'], 'urls': [], 'photos': [], 'videos': []}"
1060127091138744321,False,2018-11-07 19:09:29,"By winning the House, Democrats can now serve as a bulwark against a White House that has shown no respect for the rule of law - and no interest in bringing the country together. We can do better in America today, and we must start now. https://mikebloom.bg/2DsRTZ7 ",144,649,2683,"{'hashtags': [], 'urls': ['https://mikebloom.bg/2DsRTZ7'], 'photos': [], 'videos': []}"
1059585781294157824,False,2018-11-06 07:18:31,"Thank you, @MayorKirkHNL, for the tour and your commitment to ambitious climate action. Congratulations again to Honolulu – we look forward to supporting your city’s work to cut climate pollution https://twitter.com/MayorKirkHNL/status/1059528829662715905 …",14,50,291,"{'hashtags': [], 'urls': [], 'photos': [], 'videos': []}"
1059248299818041344,False,2018-11-05 08:57:29,"On Election Day, we must tell Republicans in Washington that they have failed to lead, failed to find solutions and failed to bring us together – and that we won't stand for it. That's why I'm voting Democratic pic.twitter.com/RHDwps60JP",866,4911,13122,"{'hashtags': [], 'urls': [], 'photos': [], 'videos': [{'id': 'DrML7xMWkAATHLD'}]}"
1059126339758968836,False,2018-11-05 00:52:51,.@HonoluluGov’s plan for a Carbon-Free Corridor will steer the state and our country toward a greener future. Congrats to Honolulu on being selected in the Bloomberg American Cities Climate Challenge – and thanks to @MayorKirkHNL for all of his great work https://mikebloom.bg/2Dk746O ,18,63,244,"{'hashtags': [], 'urls': [], 'photos': [], 'videos': []}"
1058950803870961664,False,2018-11-04 13:15:20,"Over 2,400 American patriots lost their lives in the attack on Pearl Harbor nearly 77 years ago—it’s a sacred place. Thank you to Senator @BrianSchatz for today’s tour and to the men and women of the US Navy for their service pic.twitter.com/RnluOrhsEB",11,59,324,"{'hashtags': [], 'urls': [], 'photos': ['https://pbs.twimg.com/media/DrImJCVX4AAL7vQ.jpg'], 'videos': []}"
1058141911708459014,True,2018-11-02 07:41:05,"Every single day, 96 Americans are killed by guns. 

In partnership w/@Everytow pic.twitter.com/qqvySRtRLY",30,320,490,"{'hashtags': [], 'urls': [], 'photos': [], 'videos': [{'id': 'Dq9DIMxUcAAVRiH'}]}"
1058373210692042752,False,2018-11-02 23:00:11,"The American people have always favored common-sense gun regulations. This election, through the hard work of @Everytown, we’re sending a message that there is a price to pay for standing with the gun lobby instead of with us https://mikebloom.bg/2OmzuOn ",47,207,766,"{'hashtags': [], 'urls': [], 'photos': [], 'videos': []}"
1057684049194598401,True,2018-11-01 01:21:42,"On #WorldCitiesDay , I am also happy to see so many cities acting to prevent noncommunicable diseases & improve #RoadSafety under the Healthy Cities Partnership. Thank you @MikeBloomberg & @BloombergDotOrg for your great support & efforts to #BeatNCDs. https://partnershipforhealthycities.bloomberg.org/cities/ ",1,44,84,"{'hashtags': ['#WorldCitiesDay', '#RoadSafety', '#BeatNCDs'], 'urls': [], 'photos': [], 'videos': []}"
1057703085437526022,False,2018-11-01 02:37:21,"We are a nation of immigrants, and we do not have to choose between honoring and welcoming immigrants and securing our borders https://mikebloom.bg/2DfkbX0 ",22,120,432,"{'hashtags': [], 'urls': [], 'photos': [], 'videos': []}"
1057683996136652800,False,2018-11-01 01:21:30,Birthright citizenship is a sacred constitutional right. The president's attempt to end it is more evidence of why it's so important to elect a Democratic Congress. Vote https://mikebloom.bg/2DfkbX0 ,89,264,879,"{'hashtags': [], 'urls': [], 'photos': [], 'videos': []}"
1057255570015698944,False,2018-10-30 20:59:05,"Vote #BecauseItMatters – for all the issues you care about. On November 6th, this election will be decided by turnout and getting people to cast their ballots. Thank you to Jodie Foster, @_JulianneMoore, @LilyTomlin, @ConstanceWu and every woman who participated in this effort pic.twitter.com/x2H7Obi9MY",383,1582,3170,"{'hashtags': ['#BecauseItMatters'], 'urls': [], 'photos': [], 'videos': [{'id': 'DqwfxRJW4AAvXjc'}]}"
1057046028468322310,False,2018-10-30 07:06:26,"Here in Minneapolis, volunteers from @MomsDemand are putting their time and energy into making a difference. Thanks to all of the hard work, we can help the gun safety movement grow stronger and stronger pic.twitter.com/kIfr3lr6Og",33,128,688,"{'hashtags': [], 'urls': [], 'photos': ['https://pbs.twimg.com/media/DqthrFUXcAA7T5-.jpg'], 'videos': []}"
1057006924913434624,False,2018-10-30 04:31:03,"In our two-year acceleration program, the Bloomberg American Cities Climate Challenge will help cities grow their economies and protect public health by taking action to fight climate change. Congratulations to the seven winners named today. https://mikebloom.bg/2SqsFPc pic.twitter.com/PnkPlMSiru",337,1465,4917,"{'hashtags': [], 'urls': ['https://mikebloom.bg/2SqsFPc'], 'photos': ['https://pbs.twimg.com/media/Dqs96g8X4AEHvVC.jpg'], 'videos': []}"
1056987381507784705,False,2018-10-30 03:13:24,".@GretchenWhitmer is a pragmatist who knows how to compromise, reach across the aisle and get things done. Glad to support her in her campaign to be Michigan’s next governor pic.twitter.com/8irzxlvWTN",11,30,136,"{'hashtags': [], 'urls': [], 'photos': ['https://pbs.twimg.com/media/DqssKX3X0AUVYkH.jpg'], 'videos': []}"
1056968044998782976,False,2018-10-30 01:56:34,"It’s fair to say that – under @MayorMikeDuggan's strong leadership – the @CityofDetroit is writing a comeback story, from its economy to its growing population. His administration deserves a great deal of credit for that, and we're honored to be here for #CityLabDetroit pic.twitter.com/Fr8ZwKIG4M",12,83,306,"{'hashtags': ['#CityLabDetroit'], 'urls': [], 'photos': ['https://pbs.twimg.com/media/DqsarBJWkAIEoDM.jpg'], 'videos': []}"
1056963228566241282,False,2018-10-30 01:37:25,"Estonia is leading from the front when it comes to digitizing government services. Thank you, @KerstiKaljulaid, for joining us at #CityLabDetroit to share Estonia’s remarkable progress on connecting people quickly and efficiently to the services they need pic.twitter.com/h6MLgOyeiA",9,95,339,"{'hashtags': ['#CityLabDetroit'], 'urls': [], 'photos': ['https://pbs.twimg.com/media/DqsWWx3WwAU521T.jpg'], 'videos': []}"
1056956420741103616,False,2018-10-30 01:10:22,"With Washington asleep at the wheel, cities of all sizes are driving America into the future. They're leading the way on climate change, gun violence, public health and so much more – serving as the engines of our progress. And that's what CityLab is all about. #CityLabDetroi pic.twitter.com/OxFx26NXr2",46,217,790,"{'hashtags': ['#CityLabDetroit'], 'urls': [], 'photos': ['https://pbs.twimg.com/media/DqsP8w2X4AAE8R5.jpg', 'https://pbs.twimg.com/media/DqsQA4VW4Acxe14.jpg', 'https://pbs.twimg.com/media/DqsQCHlXcAABRvF.jpg'], 'videos': []}"
1056940659108667392,False,2018-10-30 00:07:44,Mayors across the country are tackling issues that Washington is ignoring and the @BloombergDotOrg #MayorsChallenge supports their big ideas. Congratulations to the nine winning cities – we look forward to seeing the impact of your work. https://mikebloom.bg/2PvbJbF pic.twitter.com/SiTVKllK0B,124,854,2814,"{'hashtags': ['#MayorsChallenge'], 'urls': ['https://mikebloom.bg/2PvbJbF'], 'photos': ['https://pbs.twimg.com/media/DqsBz8wXgAA7FEJ.jpg'], 'videos': []}"
1056898108825763840,True,2018-10-29 21:18:40,"We are LIVE at #CityLabDetroit underwritten by @GM, @jpmorgan, @knightfdn, @mastercard, @mckinsey, @aarp, @awscloud, GTY Technology Holdings and @RWJF. 

Watch the live stream here: http://citylab2018.theatlantic.com pic.twitter.com/0DEP07jJCb",0,11,23,"{'hashtags': ['#CityLabDetroit'], 'urls': ['http://citylab2018.theatlantic.com'], 'photos': ['https://pbs.twimg.com/media/DqrV8IpX0AEFDIK.jpg'], 'videos': []}"
1056866474139086849,False,2018-10-29 19:12:57,"Because more than 1 billion people rely on oceans for protein, overfishing & marine ecosystem decline are not just environmental problems – they are public health issues. Glad to partner with my friend @RayDalio to protect our oceans. https://mikebloom.bg/2OdrRdg pic.twitter.com/bMD1Fp9zCN",74,1329,4598,"{'hashtags': [], 'urls': ['https://mikebloom.bg/2OdrRdg'], 'photos': [], 'videos': [{'id': 'DqduFLIXQAAFgY7'}]}"
1056574943771717632,False,2018-10-28 23:54:31,I was in Pittsburgh last week with @momsdemand who are working to elect gun sense candidates. Today they’re mourning a heinous crime - and I join them. But I also know moms around the country will be even more determined to bring about change on Nov. 6 https://www.mikebloomberg.com/news/mike-bloomberg-statement-tree-life-synagogue-shooting/ …,54,465,1832,"{'hashtags': [], 'urls': [], 'photos': [], 'videos': []}"
1055972123112554497,False,2018-10-27 07:59:07,"For the sake of the environment and our health, the U.S. needs leaders around the country who want to confront climate change. Together with the @LCVoters Victory Fund, we’re backing candidates who will address rising emissions https://mikebloom.bg/2RgAnu0 ",29,80,258,"{'hashtags': [], 'urls': [], 'photos': [], 'videos': []}"
1055863008621219848,True,2018-10-27 00:45:32,"As a winner of @BloombergDotOrg’s American Cities Climate Challenge, @CityofSanDiego is taking big steps to act on climate: the city is creating its own utility that will provide clean, affordable energy https://nyti.ms/2AuJSjL ",6,26,45,"{'hashtags': [], 'urls': [], 'photos': [], 'videos': []}"
1055835978626228230,False,2018-10-26 22:58:08,Looking forward to joining global leaders at #CityLabDetroit next week to discuss challenges cities are facing and how we can work together to find solutions https://mikebloom.bg/2ENm4vz ,8,32,75,"{'hashtags': ['#CityLabDetroit'], 'urls': [], 'photos': [], 'videos': []}"
1055777175931179008,False,2018-10-26 19:04:28,"It’s clearer than ever that we need a new Congress. With the midterm elections less than two weeks away, we’re taking this message from coast to coast and urging voters to elect Democrats to the House and Senate. https://mikebloom.bg/2CFTM3f pic.twitter.com/vCQlN8AnEn",56,197,595,"{'hashtags': [], 'urls': ['https://mikebloom.bg/2CFTM3f'], 'photos': [], 'videos': [{'id': 'DqZkrtLXcAM-N0W'}]}"
1055542062454632448,True,2018-10-26 03:30:13,"As the leading force behind our diversity and inclusion efforts, Peter has been a vocal champion of #LGBT employees here at Bloomberg and around the world - just one of the many reasons he's made top 10 on the #OUTRoleModels18 Ally Executives list https://bloom.bg/2ArS1VQ ",13,21,51,"{'hashtags': ['#LGBT', '#OUTRoleModels18'], 'urls': [], 'photos': [], 'videos': []}"
1055502844558786560,False,2018-10-26 00:54:23,"November 6th is a big test of our political strength, and the only way to succeed is to get people to the polls. Text PLAN to 644-33 and make a plan to vote today pic.twitter.com/sd7CnQ29JE",41,212,552,"{'hashtags': [], 'urls': [], 'photos': [], 'videos': [{'id': 'DqXz2irXgAEnoKG'}]}"
1055411145975115776,True,2018-10-25 18:50:00,"Everytown for Gun Safety, a non-profit that advocates for gun control, is pouring over $11 million into digital ads to help vulnerable Democrats running for House seats this year https://www.axios.com/2018-midterm-elections-democrats-bloomberg-ad-buy-20a34bea-6a9b-498f-af54-c7ed3f7f93cd.html?utm_source=twitter&utm_medium=social&utm_campaign=organic …",10,54,136,"{'hashtags': [], 'urls': [], 'photos': [], 'videos': []}"
1055266264845897729,False,2018-10-25 09:14:18,"Bob Steel did a phenomenal job as NYC’s Deputy Mayor for Economic Development and guiding our long-term investments in science, tech, and the arts. He exemplifies service and leadership, and is a deserving recipient of @LincolnCenter’s Distinguished Service Award pic.twitter.com/0LCb5qoJmz",7,19,74,"{'hashtags': [], 'urls': [], 'photos': ['https://pbs.twimg.com/media/DqUPEmsWkAAuM21.jpg'], 'videos': []}"
1055243647179018240,False,2018-10-25 07:44:25,"As the effects of climate change grow more frequent & damaging, it is critical that we dramatically cut pollution to protect public health & the environment. Glad to work with the @UN Secretary-General as UN Special Envoy for Climate Action to drive bottom-up progress. #UNDa https://twitter.com/antonioguterres/status/1055136629634072578 …",17,66,285,"{'hashtags': ['#UNDay'], 'urls': [], 'photos': [], 'videos': []}"
1055088766623404032,True,2018-10-24 21:28:59,"Today on #WorldPolioDay, we’re recognizing the global fight to end polio. Thanks to the work of the Global Polio Eradication Initiative including partners like @Rotary & @GatesFoundation, polio cases are down by 99.9% since 1988. Join our efforts at http://EndPolio.org :",5,43,74,"{'hashtags': ['#WorldPolioDay'], 'urls': ['http://EndPolio.org'], 'photos': [], 'videos': []}"
1054704489888915456,True,2018-10-23 20:02:00,"This is not about right or left. It’s about right or wrong. Join me & @McCainInstitute in stepping up, voting Nov. 6 & signing the pledge: http://mavericksneeded.org  #MavericksNeeded (3/3)",75,192,763,"{'hashtags': ['#MavericksNeeded'], 'urls': ['http://mavericksneeded.org'], 'photos': [], 'videos': []}"
1054803264905076738,False,2018-10-24 02:34:30,"Glad to see Canadian PM @JustinTrudeau announce his country’s plans to put a price on climate pollution. Alongside his pledge to eliminate coal by 2030, this policy will help protect public health and the environment https://mikebloom.bg/2yYWMVb ",121,517,1556,"{'hashtags': [], 'urls': [], 'photos': [], 'videos': []}"
1054502537779396608,False,2018-10-23 06:39:31,Election Day is our chance to tell Washington to start working across the aisle to get things done. Glad to join the conversation at the #CITIZENCNN conference today to discuss the issues facing Americans https://mikebloom.bg/2OFK2ND ,17,50,214,"{'hashtags': ['#CITIZENCNN'], 'urls': [], 'photos': [], 'videos': []}"
1054177595691012096,False,2018-10-22 09:08:19,The road to victory in November runs straight through PA. Thank you to the @DelCoDems and @MontCoPADems for all their hard work – let's keep it up for the next 16 days pic.twitter.com/iLk9cMGlcO,14,63,277,"{'hashtags': [], 'urls': [], 'photos': ['https://pbs.twimg.com/media/DqEwiRcX4AAwIci.jpg', 'https://pbs.twimg.com/media/DqEwi_XWsAAyGr5.jpg'], 'videos': []}"
1054109629037379584,False,2018-10-22 04:38:14,"Thank you to the @MomsDemand members who have inspired people across PA. On November 6th, we have a chance to prove that candidates who stand up for common-sense gun laws can be elected – and those that don't can be defeated. Together, we need to make every day until then count pic.twitter.com/ljoJDIQidR",19,118,443,"{'hashtags': [], 'urls': [], 'photos': ['https://pbs.twimg.com/media/DqDy-B4WoAE-HTS.jpg'], 'videos': []}"
