tweetId,isRetweet,time,text,replies,retweets,likes,entries
1164967741394173952,False,2019-08-24 02:28:48,The fires in the Amazon rainforest are an international emergency and will only accelerate the climate crisis—but responsible action can put an end to it. The future of our planet is at stake. #ActForTheAmazo https://www.washingtonpost.com/weather/2019/08/21/amazonian-rainforest-is-ablaze-turning-day-into-night-brazils-capital-city/ …,32,107,344,"{'hashtags': ['#ActForTheAmazon'], 'urls': [], 'photos': [], 'videos': []}"
1164646036461228038,False,2019-08-23 05:10:27,John McCain understood that progress requires civil dialogue between those who hold different views. It’s up to all of us to follow his example. #ActsOfCivilit https://www.washingtonpost.com/opinions/2019/08/21/my-husband-john-mccain-was-man-civility-americans-can-still-learn-him/ …,41,117,551,"{'hashtags': ['#ActsOfCivility'], 'urls': [], 'photos': [], 'videos': []}"
1164593408893210625,False,2019-08-23 01:41:20,"In Wisconsin, @GovEvers has shown similar initiative, taking executive action to move his state forward to become carbon-free by 2050. Thanks to this kind of leadership at the state level, the United States is closer to moving #BeyondCarbo https://madison.com/wsj/news/local/govt-and-politics/gov-tony-evers-signs-executive-order-calling-again-for-carbon/article_d02c951c-6114-541d-bee6-64c001b7cd21.html …",6,11,70,"{'hashtags': ['#BeyondCarbon'], 'urls': [], 'photos': [], 'videos': []}"
1164593236767367170,False,2019-08-23 01:40:39,"In the face of national inaction, states continue to push the country forward on climate. Just last week, @NC_Governor released a plan to transition North Carolina to 100% clean energy, cutting carbon pollution and saving the state money https://www.wral.com/cooper-energy-plan-contemplates-carbon-cap/18574068/ …",6,27,117,"{'hashtags': [], 'urls': [], 'photos': [], 'videos': []}"
1164525435679596544,False,2019-08-22 21:11:14,Thanks @JayInslee for highlighting the urgent need for action on climate change throughout your campaign and setting a strong example of leadership in Washington https://twitter.com/JayInslee/status/1164353533421817856 …,13,40,315,"{'hashtags': [], 'urls': [], 'photos': [], 'videos': []}"
1163868038812327936,False,2019-08-21 01:38:58,"It’s key that our representatives hear from us – at rallies and on the phones.

Text CHECKS to 644-33 to tell your senators you expect their support on comprehensive background checks and a strong Red Flag law.",10,50,197,"{'hashtags': [], 'urls': [], 'photos': [], 'videos': []}"
1163867787141505024,False,2019-08-21 01:37:58,We will not let this moment pass https://twitter.com/MomsDemand/status/1163250830021210114 …,17,131,767,"{'hashtags': ['#RecessRally'], 'urls': [], 'photos': [], 'videos': []}"
1163586376819982338,False,2019-08-20 06:59:45,"Always great to discuss the importance of leadership, recognizing your staff, and what it takes to build a great team – especially with the innovative senior staff who joined us today for the @BHcityleaders convening. @koliverny pic.twitter.com/3S4rtSTqK6",7,17,125,"{'hashtags': [], 'urls': [], 'photos': ['https://pbs.twimg.com/media/ECXjo6DXsAI9vrm.jpg'], 'videos': []}"
1163450604712267777,False,2019-08-19 22:00:14,"One of my favorite parts of the @bloomberg European HQ in London is the Roman artifacts uncovered beneath it, including a rare Roman pen inscribed with a joke. It’s on view for the first time at Oxford's Ashmolean Museum, free to visit until January 2020 https://www.cnn.com/2019/07/28/uk/roman-stylus-london-scli-gbr-intl/index.html …",11,20,176,"{'hashtags': [], 'urls': [], 'photos': [], 'videos': []}"
1162186830311239680,False,2019-08-16 10:18:27,"Thanks to leaders like @narendramodi and @nitin_gadkari, the Motor Vehicles Amendment Bill will save countless lives in India — congratulations on this historic achievement for the country and road safety https://qz.com/india/1673553/indias-motor-vehicles-amendment-bill-2019-passed-by-rajya-sabha/ …",20,57,249,"{'hashtags': [], 'urls': [], 'photos': [], 'videos': []}"
1161649630209355776,False,2019-08-14 22:43:48,"It was great to speak with @SRuhle last weekend. The momentum and unity of the gun sense movement is stronger than ever, and I believe we’ll make real progress with partners like @Everytown, @MomsDemand, students and the 2020 Democratic candidates https://www.msnbc.com/stephanie-ruhle/watch/how-does-former-nyc-mayor-michael-bloomberg-plan-to-beat-the-nra-65840710002 …",41,145,752,"{'hashtags': [], 'urls': [], 'photos': [], 'videos': []}"
1161430586994712576,False,2019-08-14 08:13:24,"Thanks to @DarrenWalker, the @FordFoundation’s recent renovation has helped them become even more inclusive and forward-looking, advancing their social justice mission at every step pic.twitter.com/mRuFqUafh9",5,11,89,"{'hashtags': [], 'urls': [], 'photos': ['https://pbs.twimg.com/media/EB469dJXYAIW89z.jpg'], 'videos': []}"
1161333134614564864,False,2019-08-14 01:46:10,"Thanks to @jonfavs @TVietor08 @jonlovett for highlighting last week's historic Gun Sense Forum and the incredible work of @Everytown, @MomsDemand, students and survivors on Pod Save America.
 
There has never been more unity in the Democratic Party on guns and we won't let up now",25,137,1545,"{'hashtags': [], 'urls': [], 'photos': [], 'videos': []}"
1161025102407962624,False,2019-08-13 05:22:09,I spoke with @FacetheNation’s @Margbrennan on why we cannot stand by and let this moment pass. We have to put an end to the crisis of gun violence in America https://www.cbsnews.com/news/transcript-michael-bloomberg-on-face-the-nation-august-11-2019/ …,21,50,296,"{'hashtags': [], 'urls': [], 'photos': [], 'videos': []}"
1160994843348348929,False,2019-08-13 03:21:55,Enough is enough: Americans across the nation are calling for common-sense gun reform. I'm optimistic that together we will meet this moment and bring about the change our communities want and need pic.twitter.com/nRHUxaX7lL,92,147,884,"{'hashtags': [], 'urls': [], 'photos': [], 'videos': [{'id': '5eow-pp2Oxv260c8'}]}"
1160554869012480000,False,2019-08-11 22:13:37,"Democrats are unified when it comes to gun safety.

In 2020 we’ll make sure every voter in America understands that they have a choice between candidates who stand up for a family’s safety and those who bow down to special interests https://www.bloomberg.com/opinion/articles/2019-08-10/democrats-can-unite-to-defeat-nra-achieve-gun-law-reform …",306,501,3093,"{'hashtags': [], 'urls': [], 'photos': [], 'videos': []}"
1160540119834796035,True,2019-08-11 21:15:01,"TODAY: We interview former New York City Mayor and “@Everytown for Gun Safety” founder @MikeBloomberg
 On TV, the radio, and streaming online, don't miss @FaceTheNation this morning https://cbsn.ws/2ZTAVun pic.twitter.com/3jJVuQaxoL",11,14,59,"{'hashtags': [], 'urls': ['https://cbsn.ws/2ZTAVun'], 'photos': ['https://pbs.twimg.com/media/EBsRFqiWkAA86Aq.jpg'], 'videos': []}"
1160295716595671045,False,2019-08-11 05:03:50,"There has never been more unity on gun safety across so many Democratic presidential candidates – and across the entire Democratic Party – as there is today.

Now we must translate this unity into action in Washington pic.twitter.com/WNOKzAL8bc",186,347,2475,"{'hashtags': [], 'urls': [], 'photos': [], 'videos': [{'id': 'eY4FrxM1QVeikF-L'}]}"
1160290023666802688,False,2019-08-11 04:41:13,"Thank you @margbrennan and @FaceTheNation for shining a light on the historic #GunSenseForum.

I encourage everyone to tune in tomorrow https://twitter.com/margbrennan/status/1160277380272918530 …",20,31,157,"{'hashtags': ['#GunSenseForum', '#GunSenseForum'], 'urls': [], 'photos': [], 'videos': []}"
1160237824190406664,True,2019-08-11 01:13:48,"“We can save so many of those lives. But, we can only do it if we organize, and as it says on your t-shirts -- DEMAND ACTION!"" - @MikeBloomberg
#GunSenseForu pic.twitter.com/dKuZjOCJy5",5,64,218,"{'hashtags': ['#GunSenseForum'], 'urls': [], 'photos': ['https://pbs.twimg.com/media/EBn-JOlXUAEeK-R.jpg'], 'videos': []}"
1160273676299902977,False,2019-08-11 03:36:15,"Americans will not accept the toll that gun violence takes on communities across the country. In 2020, we’re going to show Washington just how strong the gun sense movement has grown — by voting out those who block progress pic.twitter.com/LezUkmjWHA",251,517,2991,"{'hashtags': [], 'urls': [], 'photos': [], 'videos': [{'id': 'NX8MfUnq2Y9dz7u9'}]}"
1160259443185061889,False,2019-08-11 02:39:42,"The gun sense movement is 6 million strong. 

And just like the midterm, we’ll make sure that if candidates don't lead on gun safety, we’ll vote them out on Election Day.

#GunSenseForum
https://www.mikebloomberg.com/news/mike-bloomberg-delivers-remarks-presidential-gun-sense-forum-iowa/ …",19,89,422,"{'hashtags': ['#GunSenseForum'], 'urls': ['https://www.mikebloomberg.com/news/mike-bloomberg-delivers-remarks-presidential-gun-sense-forum-iowa/'], 'photos': [], 'videos': []}"
1160235138137112577,False,2019-08-11 01:03:07,Speaking at the @Everytown Presidential #GunSenseForum now. Watch LIVE https://www.pscp.tv/Everytown/1ynJORDEWwVGR …,11,25,102,"{'hashtags': ['#GunSenseForum'], 'urls': [], 'photos': [], 'videos': []}"
1160223095833145345,False,2019-08-11 00:15:16,"It is time to put the issue of gun violence front and center in this election. 

Tune in to the Presidential #GunSenseForum LIVE https://www.pscp.tv/Everytown/1ynJORDEWwVGR …",21,37,139,"{'hashtags': ['#GunSenseForum'], 'urls': [], 'photos': [], 'videos': []}"
1160174695351762944,True,2019-08-10 21:02:57,"WATCH LIVE NOW: 2020 candidates are speaking at our Presidential #GunSenseForum in Des Moines, Iowa. Hear from @JoeBiden, @ewarren, @PeteButtigieg, @KamalaHarris, @BernieSanders, and more about their plans to address America's gun violence crisis https://www.pscp.tv/Everytown/1ynJORDEWwVGR …",9,113,182,"{'hashtags': ['#GunSenseForum'], 'urls': [], 'photos': [], 'videos': []}"
1159840136281989121,True,2019-08-09 22:53:31,TOMORROW I’ll be speaking with former NYC mayor @MikeBloomberg. The question: how does he plan to beat the NRA? TUNE IN TOMORROW at 12pET only on @MSNB pic.twitter.com/8hTZKuhFwk,23,25,134,"{'hashtags': [], 'urls': [], 'photos': ['https://pbs.twimg.com/media/EBiUdGZUcAUkj-q.jpg'], 'videos': []}"
1159860900649680896,True,2019-08-10 00:16:02,"It's past time for the Senate to act on gun safety. 

Text CHECKS to 644-33 to be connected to your senators and tell them it's time to pass a strong Red Flag law and background checks on all gun sales pic.twitter.com/L5gyeD822S",12,55,104,"{'hashtags': [], 'urls': [], 'photos': ['https://pbs.twimg.com/media/EBinVu-XsAUXms1.png'], 'videos': []}"
1159847812412190720,False,2019-08-09 23:24:02,"Mayors have been leading from the front on gun safety for years.
 
In 2006, we founded Mayors Against Illegal Guns to advocate for life-saving policies.
 
Now hundreds of @USMayors are joining the nationwide call for action to end gun violence https://www.nbcnews.com/politics/congress/hundreds-mayors-urge-senate-return-gun-bill-vote-n1040341 …",11,65,241,"{'hashtags': [], 'urls': [], 'photos': [], 'videos': []}"
1159481002311524352,False,2019-08-08 23:06:27,"As a winner of the Bloomberg American Cities Climate Challenge, Boston is leading the way to go @BeyondCarbon. Thanks to local action from leaders like Mayor @marty_walsh, we continue to make progress on the goals outlined in the Paris Agreement https://www.bostonglobe.com/metro/2019/07/25/boston-ranks-america-for-energy-efficiency/Ia940gys1V8YiO6SE5v6IJ/story.html …",11,28,155,"{'hashtags': [], 'urls': [], 'photos': [], 'videos': []}"
1159189261763186688,False,2019-08-08 03:47:11,"Momentum in the gun safety movement is at an all-time high, but political inaction continues to take a tragic toll.

On Saturday, I'll join @Everytown & @MomsDemand in Iowa to hear 2020 candidates share their plans for ending gun violence.

Join us https://every.tw/2M524HC ",16,129,715,"{'hashtags': [], 'urls': [], 'photos': [], 'videos': []}"
1158836483660419072,False,2019-08-07 04:25:22,"The House took action on gun violence this year, including passing a comprehensive background-check bill.

Senate Republicans have failed to act.
 
That will change only if more Americans demand it https://act.everytown.org/sign/smarter-gun-laws …",20,45,173,"{'hashtags': [], 'urls': [], 'photos': [], 'videos': []}"
1158800643890524160,False,2019-08-07 02:02:57,"Toni Morrison was — and will forever be — one of the great voices in American literature.

It was my honor to present her with the NYC Literary Honors in 2013. Her words and works will continue to play an important role in our country’s cultural fabric pic.twitter.com/zAnsvY6uKO",10,31,321,"{'hashtags': [], 'urls': [], 'photos': ['https://pbs.twimg.com/media/EBTjCqtXoAAVPfD.jpg'], 'videos': []}"
1158429440336117762,False,2019-08-06 01:27:55,"Now is the time to say #EnoughIsEnough and hold our leaders accountable. Call your senators to act on passing background checks on all gun sales and a strong Red Flag law:
 
Text CHECKS to 644-33 and @Everytown will connect you https://every.tw/2T3TF7Q ",27,152,427,"{'hashtags': ['#EnoughIsEnough'], 'urls': [], 'photos': [], 'videos': []}"
1158404252525563904,False,2019-08-05 23:47:50,Maybe this time will be different. That’s the thought on the minds of many Americans now. It can be – but only if we reward political leaders who protect public safety and drive those who don’t from public office. We cannot let this moment pass https://www.bloomberg.com/opinion/articles/2019-08-05/el-paso-dayton-shootings-channel-anger-into-gun-law-reform …,48,275,857,"{'hashtags': [], 'urls': [], 'photos': [], 'videos': []}"
1157357157098151936,False,2019-08-03 02:27:03,"Voters want candidates to take strong positions on gun safety, and they are going to reward those that do. @LucyMcBath proved that gun safety is a winning message when she was elected to Congress pic.twitter.com/P2sfk2zDth",23,54,252,"{'hashtags': [], 'urls': [], 'photos': [], 'videos': [{'id': 'dYWTo2mfVAWh2Gy0'}]}"
1157322807740653568,False,2019-08-03 00:10:34,"Friends, partners, and examples of citizen action at its best. Great to be with @shannonrwatts and @MomsDemand volunteers from around the country at Gun Sense University pic.twitter.com/z8elYD1Ydp",10,79,448,"{'hashtags': [], 'urls': [], 'photos': ['https://pbs.twimg.com/media/EA-i9KvXoAAH6la.jpg'], 'videos': []}"
1157307905332404224,False,2019-08-02 23:11:21,"In the past two years, more than 20 states have strengthened their gun laws with bills passed by both Democrats and Republicans. That is in no small part because of the time, energy, and passion of @MomsDemand #GSU19 https://www.mikebloomberg.com/news/mike-bloomberg-delivers-remarks-moms-demand-actions-gun-sense-university-2019/  pic.twitter.com/WMEKBHyDyS",3,35,205,"{'hashtags': ['#GSU19'], 'urls': ['https://www.mikebloomberg.com/news/mike-bloomberg-delivers-remarks-moms-demand-actions-gun-sense-university-2019/'], 'photos': ['https://pbs.twimg.com/media/EA-VZw_XoAIGiJ2.jpg'], 'videos': []}"
1156582337062342658,False,2019-07-31 23:08:12,The climate crisis warning signs are all around us. This is the fight of our time – we must move @BeyondCarbon https://www.usatoday.com/story/news/nation/2019/07/24/global-warming-july-expected-earths-hottest-month-record/1814783001/ …,43,132,377,"{'hashtags': [], 'urls': [], 'photos': [], 'videos': []}"
1156357969329758210,False,2019-07-31 08:16:38,"Ahead of the #DemocraticDebate in Detroit, a new poll shows that voters in Michigan want action on the climate crisis. Tonight and tomorrow, voters deserve discussion that reflects their priorities https://www.lcv.org/article/new-michigan-poll-majority-voters-believe-climate-issues-important/ …",10,19,100,"{'hashtags': ['#DemocraticDebate'], 'urls': [], 'photos': [], 'videos': []}"
1155951463643766785,True,2019-07-30 05:21:20,"In Tanzania, one woman dies every hour from pregnancy or childbirth-related complications. Over the last 13 years, we’ve worked in rural regions – like Kigoma – to bring lifesaving obstetric care closer to communities and save lives. https://bloombg.org/2Kzta8P pic.twitter.com/wLeO9afX3h",14,193,641,"{'hashtags': [], 'urls': ['https://bloombg.org/2Kzta8P'], 'photos': [], 'videos': [{'id': 'EArDgoMVUAArXtH'}]}"
1155930087960633344,True,2019-07-30 03:56:23,"The biggest obstacle to building better cities is ourselves. When we connect people with places, we set the stage for a new city to emerge. Hear the oral history behind the street. @BloombergDotOrg @BloombergAsso https://www.bloomberg.org/blog/follow-data-podcast-times-square-worlds-plaza/ …",3,61,168,"{'hashtags': [], 'urls': [], 'photos': [], 'videos': []}"
1155462406073737218,False,2019-07-28 20:57:59,Home to one of America’s greatest universities and hospitals. Home to hundreds of thousands of America’s proudest people. Resilient and strong. #WeAreBaltimore,319,2508,14932,"{'hashtags': ['#WeAreBaltimore'], 'urls': [], 'photos': [], 'videos': []}"
1154808172621783040,False,2019-07-27 01:38:18,As a long term partner of @WHO I am encouraged by the progress countries are making on tobacco-free policy. From NYC to Melbourne billions of people across the globe are healthier for it. Stopping the global tobacco epidemic must continue to be a priority. http://bloombg.org/2K6YmtC pic.twitter.com/ukK000gQy2,20,26,129,"{'hashtags': [], 'urls': ['http://bloombg.org/2K6YmtC'], 'photos': ['https://pbs.twimg.com/media/EAaz6M5XoAE4UtM.jpg'], 'videos': []}"
1154761220110659585,False,2019-07-26 22:31:43,"From cutting energy consumption to creating art that sparks conversation about ecology & conservation, climate leadership takes many forms. Don’t miss Ackroyd & Harvey’s new installation, a living artwork of 52 oaks at @Bloomberg’s European HQ in London https://www.theartnewspaper.com/blog/green-day-for-london-as-beuysian-acorns-at-bloomberg-and-tate-declares-climate-emergency …",7,26,91,"{'hashtags': [], 'urls': [], 'photos': [], 'videos': []}"
1154490138275094528,True,2019-07-26 04:34:33,Our summer paid internship program gives students valuable hands-on experience and immerses them in the work ethic that defines our company culture. Keep up the hard work! #NationalInternDa pic.twitter.com/D0RMY1sgIW,7,12,64,"{'hashtags': ['#NationalInternDay'], 'urls': [], 'photos': ['https://pbs.twimg.com/media/EAWSp8gWwAUMX4T.jpg'], 'videos': []}"
1154474332376031232,False,2019-07-26 03:31:44,California is going toe-to-toe with the Trump administration’s rollbacks — and winning. This deal will deliver more fuel-efficient vehicles for the entire country and help drive progress in the fight against the climate crisis https://www.washingtonpost.com/climate-environment/2019/07/25/major-automakers-strike-climate-deal-with-california-rebuffing-trump-proposed-mileage-freeze/ …,14,41,250,"{'hashtags': [], 'urls': [], 'photos': [], 'videos': []}"
1154357424981258241,False,2019-07-25 19:47:11,"The Bloomberg Global Business Forum is a unique opportunity for world leaders to build new partnerships, share ideas, and combat the greatest current threats to global prosperity – the rise of economic and environmental instability. #BloombergGBF
https://gbf.bloomberg.org/news/2019-global-business-forum-bringing-together-heads-state-international-ceos-address-restoring-global-economic-stability-investing-transition-low-carbon-economy/  pic.twitter.com/imMerIZ7rq",11,17,89,"{'hashtags': ['#BloombergGBF'], 'urls': ['https://gbf.bloomberg.org/news/2019-global-business-forum-bringing-together-heads-state-international-ceos-address-restoring-global-economic-stability-investing-transition-low-carbon-economy/'], 'photos': ['https://pbs.twimg.com/media/EAUZ9QxXsAE7t1J.jpg'], 'videos': []}"
1154135354447925249,False,2019-07-25 05:04:45,"When the President tells us to go back...we go forward.

Always forward pic.twitter.com/h5IzY5Uz7o",44,175,794,"{'hashtags': [], 'urls': [], 'photos': [], 'videos': [{'id': 'SnZFRehIya0U7RBI'}]}"
1154109047479656452,False,2019-07-25 03:20:13,"Improving the American education system must be a top priority for our country.

http://mikebloomberg.com/news/mike-bloomberg-2019-naacp-convention-education-holds-key-biggest-challenges/  pic.twitter.com/qdKR5oREkK",21,37,172,"{'hashtags': [], 'urls': ['http://mikebloomberg.com/news/mike-bloomberg-2019-naacp-convention-education-holds-key-biggest-challenges/'], 'photos': [], 'videos': [{'id': '9Z2XkDZQ1R3lUbqO'}]}"
1154089301363372033,False,2019-07-25 02:01:46,"Thanks, Derrick for your continued leadership and encouraging us all to keep up the fight https://twitter.com/DerrickNAACP/status/1154014701271076866 …",4,7,53,"{'hashtags': ['#NAACPConvention', '#WhenWeFightWeWin'], 'urls': [], 'photos': [], 'videos': []}"
1154047047835758592,False,2019-07-24 23:13:52,"Education holds the key to many of the major challenges we face.

But for far too long, zip code & skin color have determined a child’s education.

That is tragically wrong & I believe fixing it must be a top priority for our country & our next president. https://www.mikebloomberg.com/news/mike-bloomberg-2019-naacp-convention-education-holds-key-biggest-challenges/ …",20,38,150,"{'hashtags': [], 'urls': ['https://www.mikebloomberg.com/news/mike-bloomberg-2019-naacp-convention-education-holds-key-biggest-challenges/'], 'photos': [], 'videos': []}"
1154005841277853696,False,2019-07-24 20:30:07,"For 110 years, @NAACP has worked to make this country a more equal and just place for everyone. Looking forward to speaking at the #NAACPconvention today. Watch live http://bit.ly/2M94Dr9 ",6,13,78,"{'hashtags': ['#NAACPconvention'], 'urls': [], 'photos': [], 'videos': []}"
1153672270092623872,True,2019-07-23 22:24:38,"Tomorrow, @MikeBloomberg will give opening remarks at the #NAACPConvention. 

Stay up to date with events and speakers, and watch live streams from the convention at http://naacpconvention.org .

#WhenWeFightWeWi pic.twitter.com/154P5qKoF1",8,17,59,"{'hashtags': ['#NAACPConvention', '#WhenWeFightWeWin'], 'urls': ['http://naacpconvention.org'], 'photos': ['https://pbs.twimg.com/media/EAKqzjHXkAAGeaV.jpg'], 'videos': []}"
1153664897030524930,True,2019-07-23 21:55:20,"Thousands of talented, lower-income students are qualified to attend our nation’s top colleges, but too many never get the chance. Last year, our American Talent Initiative continued its work to graduate 50K lower-income students at top US schools by 2025. https://bloombg.org/2ObR2C5 pic.twitter.com/Wv1UaMrvcG",6,83,354,"{'hashtags': [], 'urls': ['https://bloombg.org/2ObR2C5'], 'photos': [], 'videos': [{'id': 'EAKh3OhXoAAv7P0'}]}"
1153329923131678722,False,2019-07-22 23:44:16,"Cities play a key role in improving public health, with mayors like @SadiqKhan leading the charge. Our Partnership for Healthy Cities supports mayors in 50+ cities and helps realize the full potential of local leaders to act on urgent health challenges https://www.gov.uk/government/publications/chief-medical-officer-annual-report-2019-partnering-for-progress …",13,27,131,"{'hashtags': [], 'urls': [], 'photos': [], 'videos': []}"
1153305045640929281,False,2019-07-22 22:05:24,"Robert Morgenthau dedicated his life to making New York a safer and more just city, and he played a central role in bringing crime down to historic lows. His legacy will be felt for many years to come https://www.mikebloomberg.com/news/statement-passing-robert-morgenthau/ …",7,20,124,"{'hashtags': [], 'urls': [], 'photos': [], 'videos': []}"
1152249909191544833,False,2019-07-20 00:12:40,"We must carry on the American spirit of taking moonshots—not to explore space, but to save our planet from the climate crisis. That’s why I launched @BeyondCarbon—the largest coordinated campaign to move the country towards a clean energy future. #Apollo50 https://bloom.bg/2O394GJ pic.twitter.com/Qc5Pp4fRjo",38,119,390,"{'hashtags': ['#Apollo50'], 'urls': ['https://bloom.bg/2O394GJ'], 'photos': [], 'videos': [{'id': '8cbsRIl6ynqzcZxn'}]}"
1151941585556447232,False,2019-07-19 03:47:30,"This is exactly the kind of climate leadership our country needs. Through @BeyondCarbon, we are committed to helping states, along with cities & communities, follow the example set by NY state & @NYGovCuomo in charting the course for 100% clean energy https://www.politico.com/states/new-york/city-hall/story/2019/07/18/new-york-takes-lead-in-climate-change-fight-1107964 …",17,77,302,"{'hashtags': [], 'urls': [], 'photos': [], 'videos': []}"
1151573796832337923,False,2019-07-18 03:26:03,"Mayors are on the frontline of almost every issue we face today. Hear from leaders like @Woodards4Tacoma, @MayorSchewel, and @randallwoodfin about how the Bloomberg Harvard City Leadership Initiative is helping them drive progress pic.twitter.com/xKWyZReUl6",6,22,77,"{'hashtags': [], 'urls': [], 'photos': [], 'videos': [{'id': 'D_s2DbBWwAAjHpy'}]}"
1151200942915817472,True,2019-07-17 02:44:27,"In 2019, our most important mission is not to explore deep space. 

It's to save our planet from climate change. Unlike 1962, the primary challenge is not scientific or technological. It's political https://bloom.bg/2jOGhr9 ",13,53,115,"{'hashtags': [], 'urls': [], 'photos': [], 'videos': []}"
1151151421011779585,False,2019-07-16 23:27:40,"Weakening the enforcement of fuel efficiency standards will pollute our air and harm our climate. Once again, the President and his administration are putting industry interests ahead of our health and future https://www.bloomberg.com/news/articles/2019-07-13/highway-agency-tosses-obama-proposal-to-raise-fuel-economy-fines …",23,88,209,"{'hashtags': [], 'urls': [], 'photos': [], 'videos': []}"
