tweetId,isRetweet,time,text,replies,retweets,likes,entries
1118639255063019520,True,2019-04-18 06:15:56,"As part of our Innovation Teams program, @iteam_LongBeach Director of Innovation Lauren Vargas collaborates with city leadership to implement a more data-driven approach to local decision-making – helping to provide services that improve residents’ lives pic.twitter.com/8MkoZRLvYB",6,14,70,"{'hashtags': [], 'urls': [], 'photos': [], 'videos': [{'id': 'D4YzxIkW4AEVMW0'}]}"
1118881526215782400,False,2019-04-18 22:18:38,I couldn’t agree more. Cities are incubators for innovation and action on the most pressing challenges facing our planet and our communities — and making progress where others are not https://twitter.com/CityLab/status/1118075060177317889 …,6,57,194,"{'hashtags': [], 'urls': [], 'photos': [], 'videos': []}"
1118867416719736834,True,2019-04-18 21:22:34,"The inclusion of yuan-denominated securities in the Bloomberg Barclays Global Aggregate Index shows growing confidence by international investors, writes Mary Schapiro, our Vice Chair for Global Public Policy https://bloom.bg/2KOzaLR ",2,14,35,"{'hashtags': [], 'urls': [], 'photos': [], 'videos': []}"
1118562725574193154,False,2019-04-18 01:11:50,"The vote in Sacramento, CA banning flavored tobacco products should embolden other cities to act and protect children from being targets of tobacco and e-cigarette companies. https://bit.ly/2Gt4bRx https://twitter.com/TobaccoFreeKids/status/1118503534499119105 …",20,44,157,"{'hashtags': [], 'urls': ['https://bit.ly/2Gt4bRx'], 'photos': [], 'videos': []}"
1118537991084019714,False,2019-04-17 23:33:33,My friend @RobertIger made the #Time100 list because the risks he's taken have turned @Disney - an iconic 20th century company - into one of the most innovative of the 21st century http://time.com/collection/100-most-influential-people-2019/5567846/bob-iger/ …,14,17,123,"{'hashtags': ['#Time100'], 'urls': [], 'photos': [], 'videos': []}"
1116858523542011905,False,2019-04-13 08:19:56,We all have something to learn from New Zealand’s leadership after unspeakable tragedy. Tune in to @ViceNews and witness @JacindaArdern make historic change https://twitter.com/vicenews/status/1116793160129060865 …,39,112,480,"{'hashtags': [], 'urls': [], 'photos': [], 'videos': []}"
1116758472882892801,False,2019-04-13 01:42:22,"Through innovative power, lighting, water, and ventilation, our new @Bloomberg London office uses 73% less water and 35% less energy than a typical office building. Environmentally-friendly practices can be as good for business as they are for the planet pic.twitter.com/mKaOOpBHXH",105,2736,23688,"{'hashtags': [], 'urls': [], 'photos': ['https://pbs.twimg.com/media/D3-ECb4W4AIZv_W.jpg', 'https://pbs.twimg.com/media/D3-EEe0W4AAobm2.jpg', 'https://pbs.twimg.com/media/D3-EGC2WsAAT9RH.jpg', 'https://pbs.twimg.com/media/D3-EHkpXoAAPF_y.jpg'], 'videos': []}"
1116713805147529218,False,2019-04-12 22:44:53,Chicago’s decision to transition to 100% clean energy is yet another example of real local leadership. Our American Cities Climate Challenge is helping cities like Chicago accelerate their progress — turning these ambitious commitments into a reality https://www.sierraclub.org/sierra/chicago-commits-100-renewable-clean-energy …,39,291,953,"{'hashtags': [], 'urls': [], 'photos': [], 'videos': []}"
1116372450651066368,False,2019-04-12 00:08:28,"Giving back to the community is one of the most important things we can do. 

Thank you to @Bloomberg employees worldwide for volunteering over 161,000 hours in 2018, including thousands of hours to help make cities greener and more sustainable pic.twitter.com/9LpVR58Blc",16,54,216,"{'hashtags': [], 'urls': [], 'photos': ['https://pbs.twimg.com/media/D34ki3eXkAAnO0A.jpg', 'https://pbs.twimg.com/media/D34klFqW4AE9afx.jpg', 'https://pbs.twimg.com/media/D34kpdmX4AEqquJ.jpg', 'https://pbs.twimg.com/media/D34ktPeWkAQRihj.jpg'], 'videos': []}"
1116359522988244995,False,2019-04-11 23:17:05,"As governor, Hugh Carey was known as the “man who saved New York.” The NY that stands today is a testament to Governor Carey’s foresight and fortitude. While today would have been his 100th birthday, his legacy grows larger with each passing year pic.twitter.com/iUTHnLCSJu",13,30,172,"{'hashtags': [], 'urls': [], 'photos': ['https://pbs.twimg.com/media/D34acQlWwAUg1-9.jpg'], 'videos': []}"
1115729194116370432,True,2019-04-10 05:32:23,Tanzania has the sixth-highest number of maternal deaths in the world – because many women don’t have timely access to obstetric care. Dr. @Neena_P from our Public Health team discusses our work to bring life-saving care closer to where women live pic.twitter.com/cNcYy7YS7K,9,39,78,"{'hashtags': [], 'urls': [], 'photos': [], 'videos': [{'id': 'D3vdtzAWAAE9GCt'}]}"
1116083508857004034,False,2019-04-11 05:00:18,"It was great to meet with @EU_Commission’s @VDombrovskis today to discuss how we can scale financing for global climate action.

His work is essential to ramping up global ambition towards our #ParisAgreement goals, and I'm thankful for his leadership in Europe pic.twitter.com/x2TuiG6Yk1",10,84,256,"{'hashtags': ['#ParisAgreement'], 'urls': [], 'photos': ['https://pbs.twimg.com/media/D30fmCAWwAAAt4S.jpg'], 'videos': []}"
1115989025544921088,False,2019-04-10 22:44:52,Great partnerships drive impact. That’s why @BloombergDotOrg partners with the @WHO to help promote health and save lives around the world. Glad to support this important work as the WHO Global Ambassador for NCDs https://www.who.int/news-room/events/inaugural-partners-forum …,5,59,160,"{'hashtags': [], 'urls': [], 'photos': [], 'videos': []}"
1115964100184563713,False,2019-04-10 21:05:49,"We all need to do more to confront climate change. 

At @Bloomberg, we try to lead by example. We've improved our energy efficiency by 45%, with a goal of 100% clean power by 2025.

Learn more about our progress in our 2018 Impact Report released today.",41,278,4460,"{'hashtags': [], 'urls': [], 'photos': [], 'videos': [{'id': 'D3vm_s_WkAE_9wQ'}]}"
1115330816719110146,False,2019-04-09 03:09:23,"2M+ Londoners live in areas w/illegal levels of air pollution — incl. 400K children. Today’s launch of the #ULEZ will reduce air pollution, cut carbon emissions & encourage people to switch to EVs. Great to see @MayorofLondon leading on bold climate actio https://mikebloom.bg/2Z1L8VN ",22,89,365,"{'hashtags': ['#ULEZ'], 'urls': [], 'photos': [], 'videos': []}"
1115298224242339842,False,2019-04-09 00:59:52,"Support for coal-dependent communities is an integral part of the clean energy transition. EC Commissioner @MAC_Europa has led on this issue & partnered with us to create workshops that build clean energy capacity, community engagement, & jobs training. #CoalRegionsE pic.twitter.com/6wm7hlvoL1",5,52,121,"{'hashtags': ['#CoalRegionsEU'], 'urls': [], 'photos': ['https://pbs.twimg.com/media/D3pVhzcWwAAjCWj.jpg', 'https://pbs.twimg.com/media/D3pViwdX4AEsQho.jpg', 'https://pbs.twimg.com/media/D3pVjzmWsAE3zzJ.jpg', 'https://pbs.twimg.com/media/D3pVrEkXkAEjMqj.jpg'], 'videos': []}"
1114215152956706822,False,2019-04-06 01:16:08,Honored to be invited to address @WUSTL’s Class of 2019 and be part of the graduating students’ big day https://twitter.com/WUSTL/status/1113931059450798080 …,6,48,253,"{'hashtags': ['#WashU19'], 'urls': [], 'photos': [], 'videos': []}"
1113842553370087424,True,2019-04-05 00:35:33,"BREAKING: Despite NRA opposition, the U.S. House just voted to pass the reauthorization of the Violence Against Women Act, which includes life-saving gun safety provisions that are bipartisan, like keeping guns out of the hands of abusive dating partners and stalkers pic.twitter.com/bpAifd1yfA",39,230,753,"{'hashtags': [], 'urls': [], 'photos': ['https://pbs.twimg.com/media/D3UOKFvW4AA3ZLP.jpg'], 'videos': []}"
1113439755742720002,False,2019-04-03 21:54:59,Secretary-General @antonioguterres is right—we have no excuse not to act now on climate change https://twitter.com/QuickTake/status/1113067361182068736 …,12,39,150,"{'hashtags': ['#CycloneIdai'], 'urls': [], 'photos': [], 'videos': []}"
1113241080814809089,False,2019-04-03 08:45:31,"Transatlantic collaboration is central to tackling some of the biggest challenges of our time. Glad to join Designing Our Future which will encourage partnerships between government, business and academia in the UK, US, and beyond pic.twitter.com/PwIWfgQa0l",9,43,152,"{'hashtags': [], 'urls': [], 'photos': ['https://pbs.twimg.com/media/D3MG3EqWkAILjS2.jpg', 'https://pbs.twimg.com/media/D3MG3EsWsAA1hBk.jpg'], 'videos': []}"
1113064283917541378,True,2019-04-02 21:02:59,"Madeline Kerner is the CEO and co-founder of one of our @CollegePoint partners, @MatriculateOrg, that matches trained advisors to talented, lower-income students & provides support on their road to top U.S. colleges. Here, she discusses Matriculate’s roots pic.twitter.com/3TXKJoeTqs",3,10,50,"{'hashtags': [], 'urls': [], 'photos': [], 'videos': [{'id': 'D3JaztuXcAINqhS'}]}"
1112844489348014080,False,2019-04-02 06:29:36,"Great to see Minister @Bill_Morneau today as Canada’s federal carbon tax goes into effect. Fighting climate change with smart, market-based solutions is good for the environment and good for the economy pic.twitter.com/QX2YtsOdcV",52,232,618,"{'hashtags': [], 'urls': [], 'photos': ['https://pbs.twimg.com/media/D3GeKb0XQAAggsQ.jpg'], 'videos': []}"
1112816839636279296,False,2019-04-02 04:39:44,"Fighting climate change with smart, market-based solutions is good for the environment and good for the economy. Putting a price on pollution is one of the most practical and affordable tools we have to reduce emissions https://twitter.com/cathmckenna/status/1112730072467890176 …",30,115,437,"{'hashtags': [], 'urls': [], 'photos': [], 'videos': []}"
1112761225576960000,False,2019-04-02 00:58:44,"The more we do to support the arts, and connect artists and audiences, the brighter our future will be. Thank you to everyone who worked so hard to bring @theShedNY to life pic.twitter.com/RNd1jN4NrV",8,28,143,"{'hashtags': [], 'urls': [], 'photos': ['https://pbs.twimg.com/media/D3FSCwzX4AEtwWa.jpg', 'https://pbs.twimg.com/media/D3FSCwmX4AcIUGd.jpg'], 'videos': []}"
1111706833352298496,False,2019-03-30 03:08:58,Looking forward to being back at @HarvardHBS to address the class of 2019 https://twitter.com/HarvardHBS/status/1111689535103086592 …,13,17,145,"{'hashtags': ['#HBS19'], 'urls': [], 'photos': [], 'videos': []}"
1111680944509988864,False,2019-03-30 01:26:05,"Yet another study has found that keeping guns out of the hands of those who pose a danger to themselves or others can make our communities safer. If we’re serious about ending the gun violence epidemic, we need to make universal background checks the law of the land https://twitter.com/Everytown/status/1111642286666981377 …",68,189,721,"{'hashtags': [], 'urls': [], 'photos': [], 'videos': []}"
1111338612770123776,False,2019-03-29 02:45:47,"When the president withdrew from the Paris Agreement, cities, states & businesses committed to upholding @AmericasPledge—and they're making major progress.

I’m glad to see House Democrats taking action on this. We’re moving forward with or without Trump https://thehill.com/homenews/house/436088-pelosi-dems-unveil-bill-to-bind-trump-to-paris-climate-accord …",15,58,240,"{'hashtags': [], 'urls': [], 'photos': [], 'videos': []}"
1110995982706229248,True,2019-03-28 04:04:18,".@SierraClub’s @MaryAnneHitt grew up a witness to the impacts of coal pollution from mining and pollution. Inspired, she now helps lead a people-powered movement to push the U.S. toward 100% clean energy – @BeyondCoal. #WomensHistoryMont pic.twitter.com/EaL9Rnz9I1",16,95,236,"{'hashtags': ['#WomensHistoryMonth'], 'urls': [], 'photos': [], 'videos': [{'id': 'sTwhnhk0B47m_K4h'}]}"
1110632937517654022,True,2019-03-27 04:01:41,"""Seeing Spartanburg,"" an inaugural #PublicArtChallenge-winning project, helped strengthen community relations in @SpartanburgCity through art. Our partner @ChapmanCenter's CEO Jennifer Evins played a big role in the project's success. #WomensHistoryMonth https://bloombg.org/2TA0tsG pic.twitter.com/sJE0qrSjDg",9,19,58,"{'hashtags': ['#PublicArtChallenge', '#WomensHistoryMonth'], 'urls': ['https://bloombg.org/2TA0tsG'], 'photos': [], 'videos': [{'id': 'tGYQbm9rXlvKY5SR'}]}"
1111004840266731520,False,2019-03-28 04:39:30,Those who say we must choose between tackling climate change and growing the economy are wrong—job creation and climate action go hand in hand. These stories prove that https://www.nytimes.com/interactive/2019/03/26/climate/wind-solar-energy-workers.html …,32,217,582,"{'hashtags': [], 'urls': [], 'photos': [], 'videos': []}"
1110295176705134594,True,2019-03-26 05:39:33,"In partnership with our economic development initiative, Executive Director of Relationship Coffee Institute Ruth Coleman has worked to help 38,000 women in East Africa enter the international coffee market as entrepreneurs. #WomensHistoryMont pic.twitter.com/UuAJwrn4Z5",2,20,62,"{'hashtags': ['#WomensHistoryMonth'], 'urls': [], 'photos': [], 'videos': [{'id': '0fr9c1LDOKec0uXj'}]}"
1110268858139635712,True,2019-03-26 03:54:58,"Our hearts are broken by the tragic news out of Parkland and Sandy Hook that gun violence survivors died by suicide over the past few days. We’re sending love and support to their families, friends, and communities.

If you’re in crisis, you are not alone. Help is available. pic.twitter.com/LLwg0XKbyJ",9,141,231,"{'hashtags': [], 'urls': [], 'photos': ['https://pbs.twimg.com/media/D2h3iBDWoAA5iO8.jpg'], 'videos': []}"
1110275413287321600,False,2019-03-26 04:21:01,"Utilities play a critical role in tackling climate change, so we will create a Decarbonization Tracker to help them do it. We announced it today at the #BNEFSummit with two leaders in the fields: @XcelEnergy & @ENGIEgroup https://mikebloom.bg/2UQwSMV pic.twitter.com/EwXJ1wg8Du",11,63,168,"{'hashtags': ['#BNEFSummit'], 'urls': ['https://mikebloom.bg/2UQwSMV'], 'photos': ['https://pbs.twimg.com/media/D2h9K2BWkAA65UB.jpg'], 'videos': []}"
1109145457211654144,False,2019-03-23 01:30:58,"Clean air & water is a basic human right—the current scale of coal pollution is unacceptable. That’s why I started the @BeyondCoal campaign w/@SierraClub, helping to close more than 50% of U.S. coal plants so far. #WorldWaterDay https://content.sierraclub.org/coal/ pic.twitter.com/FfD4Ho4PcX",12,74,191,"{'hashtags': ['#WorldWaterDay'], 'urls': ['https://content.sierraclub.org/coal/'], 'photos': ['https://pbs.twimg.com/media/D2R1oqtXcAIeuKV.jpg'], 'videos': []}"
1109108116325629954,False,2019-03-22 23:02:35,"EPA scientists have recognized clean-water access as the biggest environmental threat, yet the Trump admin has spent the last 2 yrs waging an assault on safe drinking water & air protections. This admin is failing miserably at protecting our environment https://www.cnn.com/2019/03/20/politics/epa-andrew-wheeler-clean-water-speech/index.html …",22,71,197,"{'hashtags': [], 'urls': [], 'photos': [], 'videos': []}"
1108906062307098624,False,2019-03-22 09:39:42,".@UNCF is an organization I’ve believed in and supported for a long time. Under @DrMichaelLomax’s leadership, they’re making a big difference for so many young people – and for our country. Thank you for this incredible honor pic.twitter.com/bwEmo0nIQy",5,23,102,"{'hashtags': [], 'urls': [], 'photos': ['https://pbs.twimg.com/media/D2OgIV3W0AIVBb-.jpg', 'https://pbs.twimg.com/media/D2OgIV5XcAEXInR.jpg', 'https://pbs.twimg.com/media/D2OgIV2XQAAYtxD.jpg', 'https://pbs.twimg.com/media/D2OgIV4XQAcDs7S.jpg'], 'videos': []}"
1108824980106694656,False,2019-03-22 04:17:30,".@BloombergDotOrg partnered w/@NatGeo on a #YourShot photography assignment to capture local climate action around the world. The remarkable entries show the devastating effects of climate change, and the inspiring bottom-up solutions. https://yourshot.nationalgeographic.com/stories/climate-action-your-community/  pic.twitter.com/fF7IUohkyw",1,19,70,"{'hashtags': ['#YourShot'], 'urls': ['https://yourshot.nationalgeographic.com/stories/climate-action-your-community/'], 'photos': ['https://pbs.twimg.com/media/D2NVTX7X4AEefOQ.jpg', 'https://pbs.twimg.com/media/D2NVTXUWkAEt4ME.jpg', 'https://pbs.twimg.com/media/D2NVTUhXcAAv84z.jpg', 'https://pbs.twimg.com/media/D2NVTXvXcAAQnhz.jpg'], 'videos': []}"
1108763736419041280,False,2019-03-22 00:14:09,What percentage of all toxic water pollution in the U.S. comes from coal-fired power plants? Check back tomorrow on #WorldWaterDay to find out.,14,36,63,"{'hashtags': ['#WorldWaterDay'], 'urls': [], 'photos': [], 'videos': []}"
1108737129931247617,False,2019-03-21 22:28:25,"Thank you to @JunckerEU and @VDombrovskis for your strong leadership on the Sustainable Finance Action Plan, and to the entire @EU_Commission for taking the initiative to build an international network of countries committed to supporting sustainable finance https://twitter.com/VDombrovskis/status/1108656469082279936 …",6,48,141,"{'hashtags': ['#SustainableFinanceEU'], 'urls': [], 'photos': [], 'videos': []}"
1108372390772383744,True,2019-03-20 22:19:05,"What will public-sector innovation look like ten years from now? For the 100th issue of our Spark newsletter, @BloombergCities asked that question to leading urban thinkers from around the world. Their answers give us A LOT to think about! Read them here https://bit.ly/2Whgqpt ",3,33,63,"{'hashtags': [], 'urls': [], 'photos': [], 'videos': []}"
1108041447448739842,False,2019-03-20 00:24:02,"I challenged the largest U.S. cities to submit big ideas to tackle climate change for the Bloomberg American Cities Climate Challenge. It’s no surprise that they delivered:

— 25 winning cities
— Ambitious solutions
— Potential to reduce carbon emissions by 40 million metric ton pic.twitter.com/Aci7eOgowU",60,188,736,"{'hashtags': [], 'urls': [], 'photos': [], 'videos': [{'id': 'D2CNiO5XgAAsGmN'}]}"
1107658567912435713,False,2019-03-18 23:02:36,This is leadership. Resolve and action in the face of senseless violence https://www.bloomberg.com/news/articles/2019-03-17/gun-law-overhaul-starts-in-new-zealand-after-mosque-shootings …,26,140,586,"{'hashtags': [], 'urls': [], 'photos': [], 'videos': []}"
1106657793329766400,False,2019-03-16 04:45:53,The youth climate strikes today have sparked a movement in our nation and across the world. They’ve shown us that waiting to act on climate change is unacceptable - and that it’s time we hold our leaders accountable https://mikebloom.bg/2W0KUM3 ,34,98,385,"{'hashtags': [], 'urls': [], 'photos': [], 'videos': []}"
1106574994006573060,True,2019-03-15 23:16:52,"We stand with the victims, survivors, and all those impacted by the white supremacist mass shooting at the Al Noor and Linwood Mosques in Christchurch, New Zealand pic.twitter.com/0zm7lulaiU",20,103,304,"{'hashtags': [], 'urls': [], 'photos': ['https://pbs.twimg.com/media/D1tWBH_XgAEiyw-.jpg'], 'videos': []}"
1106602201030496257,False,2019-03-16 01:04:59,There’s no time to waste. We need action now. https://mikebloom.bg/2XXRPra pic.twitter.com/seFCa3wgly,14,51,194,"{'hashtags': [], 'urls': ['https://mikebloom.bg/2XXRPra'], 'photos': ['https://pbs.twimg.com/media/D1tu3hAXQAAk6-x.png'], 'videos': []}"
1106272096748036096,False,2019-03-15 03:13:16,States are leading the fight against the opioid epidemic. That’s why I’m partnering with @GovWhitmer to provide the resources & expertise necessary to end this crisis once and for all. Glad to meet with you & dedicated first responders in Michigan today. https://bit.ly/2TADlz6 pic.twitter.com/AOrasQzsLR,10,18,116,"{'hashtags': [], 'urls': ['https://bit.ly/2TADlz6'], 'photos': ['https://pbs.twimg.com/media/D1pDge7XQAAeIhD.jpg', 'https://pbs.twimg.com/media/D1pDjr7XcAASNx5.jpg', 'https://pbs.twimg.com/media/D1pDmNHWsAAXVyy.jpg'], 'videos': []}"
1106147416229756932,False,2019-03-14 18:57:49,"Opioid overdose strikes without prejudice, taking the lives of 5 Americans every hour. Last year, we announced a $50M plan to help states hit hardest by this crisis develop bold new strategies. Today, Michigan was selected as the 2nd state in the program https://www.detroitnews.com/story/opinion/2019/03/14/fighting-back-against-michigans-opioid-crisis/3142774002/ …",14,47,225,"{'hashtags': [], 'urls': [], 'photos': [], 'videos': []}"
1105480543817383938,False,2019-03-12 22:47:55,"Congrats Dean @EllenJMacKenzie & @JohnsHopkinsSPH - again named the top public health school by @USNews. Through programs like the Bloomberg @AmericanHealth Initiative, Hopkins is leading the way in tackling today's greatest public health challenges https://www.jhsph.edu/news/news-releases/2019/hopkins-bloomberg-school-ranked-number-one-by-u-s-news-and-world-report.html …",16,54,263,"{'hashtags': [], 'urls': [], 'photos': [], 'videos': []}"
1105423219262189568,True,2019-03-12 19:00:07,"We registered the domain http://Bloomberg.com  in 1993 more than a decade after we built @TheTerminal, which was one of the world's first intranets. When we were building it, we could only dream of a world connected by the Web. #Web30 #ForTheWe pic.twitter.com/6mWF760xlf",7,62,185,"{'hashtags': ['#Web30', '#ForTheWeb'], 'urls': ['http://Bloomberg.com'], 'photos': ['https://pbs.twimg.com/media/D1dAjrNWoAAsmFp.jpg'], 'videos': []}"
1105091045371641857,True,2019-03-11 21:00:11,"On March 27 at #BloombergEquality @BloombergTV Anchor @CarolMassar will talk with @MayorAdler, @MayorSlyJames and @MayorPugh50 about the strides towards equality and inclusion they've made in their respective cities. pic.twitter.com/WTtuRAyDIh",2,14,32,"{'hashtags': ['#BloombergEquality'], 'urls': [], 'photos': ['https://pbs.twimg.com/media/D1YScvuXQAAn4Ko.jpg'], 'videos': []}"
1105121624632803330,False,2019-03-11 23:01:42,"Thanks for highlighting #BeyondCoal on your latest @PodSaveAmerica show, @jonfavs & @danpfeiffer. With @SierraClub, we’ve helped close more than half of the nation's coal-fired power plants in favor of cheaper, cleaner energy - reducing emissions & saving lives. Much more to do.",20,133,938,"{'hashtags': ['#BeyondCoal'], 'urls': [], 'photos': [], 'videos': []}"
1104124505327321088,False,2019-03-09 04:59:30,New Mexico's new gun safety law was made possible by the kind of local action I'll be doing more to support across America. Congrats to @GovMLG - and @MomsDemand & @Everytown - for adopting a strong background check bill similar to the one Republicans in Washington are blocking.,21,85,499,"{'hashtags': [], 'urls': [], 'photos': [], 'videos': []}"
1104047948038631424,False,2019-03-08 23:55:17,"At @Bloomberg & @BloombergDotOrg we're dedicated to empowering women across every level & every function. Through our philanthropic work, industry-leading initiatives & inclusive policies, we are working to advance gender equality around the world https://www.bloomberg.com/women  #IWD2019",6,52,149,"{'hashtags': ['#IWD2019'], 'urls': ['https://www.bloomberg.com/women'], 'photos': [], 'videos': []}"
1103038257623908352,False,2019-03-06 05:03:08,"While there would be no higher honor than serving as president, my highest obligation as a citizen is to help the country the best way I can, right now. That's what I'll do, including the launch of a new effort called Beyond Carbon. My full statement https://www.bloomberg.com/opinion/articles/2019-03-05/our-highest-office-my-deepest-obligation …",949,2472,12218,"{'hashtags': [], 'urls': [], 'photos': [], 'videos': []}"
1101281351314083841,False,2019-03-01 08:41:49,It’s been nearly four years since a hate-filled man got his hands on a gun and took the lives of nine innocent Americans. Thank you to leaders in the House for finally taking steps to close the Charleston loophole https://www.postandcourier.com/politics/u-s-house-passes-bill-to-close-charleston-loophole-for/article_82a7d844-3ae8-11e9-9c82-a79568a1347f.html …,51,125,621,"{'hashtags': [], 'urls': [], 'photos': [], 'videos': []}"
1101219807494619136,False,2019-03-01 04:37:16,"Looking forward to addressing the graduates of one of America's top universities, @UofMaryland, this coming May. https://mikebloom.bg/2UbuMqE https://twitter.com/UofMaryland/status/1101198983685464064 …",30,82,352,"{'hashtags': ['#UMD', '#UMDgrad'], 'urls': ['https://mikebloom.bg/2UbuMqE'], 'photos': [], 'videos': []}"
1100873042090213377,False,2019-02-28 05:39:21,"Poll after poll shows overwhelming support for common sense gun reform like universal background checks. Today the House honored the will of the people, taking action where the Senate and WH have not, and showing us the power of citizens demanding change. https://www.nytimes.com/aponline/2019/02/27/us/politics/ap-us-congress-gun-control.html …",44,105,537,"{'hashtags': [], 'urls': ['https://www.nytimes.com/aponline/2019/02/27/us/politics/ap-us-congress-gun-control.html'], 'photos': [], 'videos': []}"
1100545272311177216,False,2019-02-27 07:56:54,"Nevada has been a leader on critical issues that matter to Americans, like gun safety, thanks to leaders like @SenatorReid—great to catch up today and discuss progress pic.twitter.com/WtzSdkhRnV",24,45,209,"{'hashtags': [], 'urls': [], 'photos': ['https://pbs.twimg.com/media/D0XsBLPWwAAY0o9.jpg'], 'videos': []}"
