tweetId,isRetweet,time,text,replies,retweets,likes,entries
1194341683032399872,True,2019-11-13 03:50:21,"This is incredibly significant. Not only does it demonstrate that Trump had advance knowledge of Wikileaks releases of hacked emails, it also shows additional witnesses who can confirm that the president gave false written answers to investigators in violation of the law https://twitter.com/jimsciutto/status/1194307259507134464 …",434,7884,20279,"{'hashtags': [], 'urls': [], 'photos': [], 'videos': []}"
1194327633653387264,False,2019-11-13 02:54:32,Here’s the deal: Trump colluded with a foreign government in the 2016 election. He welcomed & encouraged Russian interference. He’s done the same thing with the 2020 election. He pressured China & Ukraine to interfere. He’s betraying America right before our eyes https://twitter.com/kylegriffin1/status/1194323992930324482 …,107,243,842,"{'hashtags': [], 'urls': [], 'photos': [], 'videos': []}"
1194289533119950848,True,2019-11-13 00:23:08,"So there was collusion, and there was lying to cover it up. And while I suspect the impeachment articles will be narrowly Ukraine-focused, members of Congress deliberating on impeachment are entitled to consider whether Ukraine is part of a longer train of abuses and usurpations https://twitter.com/BradMossEsq/status/1194281788916555776 …",193,2881,8626,"{'hashtags': [], 'urls': [], 'photos': [], 'videos': []}"
1194319596439900161,False,2019-11-13 02:22:35,I don’t believe a word Trump says. He’s lying and America’s farmers are dying https://twitter.com/markknoller/status/1194312582934466560 …,68,73,356,"{'hashtags': [], 'urls': [], 'photos': [], 'videos': []}"
1194268437729689600,False,2019-11-12 22:59:18,"All Trump cares about is Trump. When he loses, he won’t go quietly. When he loses, he’ll destroy everything in his wake. All these Republicans who stay silent now believing everything will be great when Trump is gone are smoking something.

This is why he must be called out now.",69,206,1025,"{'hashtags': [], 'urls': [], 'photos': [], 'videos': []}"
1194259143047163905,False,2019-11-12 22:22:22,"Not scientific at all, but another day of campaigning in New Hampshire, another round of conversations with GOP voters, most all of whom said: “I’m tired of Trump. Elizabeth Warren scares me, but I don’t want 4 more years of Trump’s bullshit. Nothing will get done.”

Agreed.",61,75,453,"{'hashtags': [], 'urls': [], 'photos': [], 'videos': []}"
1194251710958624772,False,2019-11-12 21:52:50,It should no longer amaze my friend. What Trump did is indefensible. The only defense for the indefensible is lies and nonsense https://twitter.com/Timodc/status/1194248137906495488 …,21,40,182,"{'hashtags': [], 'urls': [], 'photos': [], 'videos': []}"
1194242311821123584,False,2019-11-12 21:15:29,“In his mind” he still doesn’t think Russia interfered in 2016. “In his mind” he thinks we’ve built a bunch of new wall. “In his mind” he thinks Kim Jong-un is a good guy. Who cares what’s “in his mind? https://twitter.com/meridithmcgraw/status/1194236864615649280 …,1388,4846,26443,"{'hashtags': [], 'urls': [], 'photos': [], 'videos': []}"
1194235768182657024,False,2019-11-12 20:49:29,"“Truthful” and “Trump” are two words that should never, ever, ever be put in the same sentence https://twitter.com/jimsciutto/status/1194229067488333826 …",46,72,371,"{'hashtags': [], 'urls': [], 'photos': [], 'videos': []}"
1194233479472590848,False,2019-11-12 20:40:23,This https://twitter.com/JoeNBC/status/1194231614345269251 …,7,59,332,"{'hashtags': [], 'urls': [], 'photos': [], 'videos': []}"
1194194582377914368,True,2019-11-12 18:05:50,"A new video from Republicans for the Rule of Law, reminding House Republicans how some of their predecessors rose to the occasion 45 years ago. Will at least some of today’s Republicans put country and Constitution first? 
The ad will air on Fox and will be promoted digitally pic.twitter.com/SRvGFkwNAb",1403,15242,38406,"{'hashtags': [], 'urls': [], 'photos': [], 'videos': [{'id': 'pf9RfQfGyg0Q0WWW'}]}"
1194104040088621057,False,2019-11-12 12:06:03,"Pathetic. @NikkiHaley, you should be ashamed of yourself. You’ve put your own self interest ahead of the country. Shame on you https://twitter.com/anniekarni/status/1194098402432299010 …",432,1564,9843,"{'hashtags': [], 'urls': [], 'photos': [], 'videos': []}"
1194057702592397313,True,2019-11-12 09:01:55,"Trump retweets Bill O'Reilly, Jesse Watters, and Greg Gutfeld like a frightened toddler clutching his superhero dolls when the lights go out",503,5598,32255,"{'hashtags': [], 'urls': [], 'photos': [], 'videos': []}"
1194046024928628738,True,2019-11-12 08:15:31,Fantastic twee https://twitter.com/Phil_Sledge/status/1194008827932360712 …,10,60,495,"{'hashtags': [], 'urls': [], 'photos': [], 'videos': []}"
1194045266657189889,True,2019-11-12 08:12:30,"Conversely people like  @WalshFreedom, @GeorgeWill, @ananavarro stand up.",5,6,38,"{'hashtags': [], 'urls': [], 'photos': [], 'videos': []}"
1194039114636693504,False,2019-11-12 07:48:03,"A reminder this Veterans Day that ANY American - gay, straight, or transgender - who wants to serve and meets the basic requirements to serve, should have the right to serve their country.

#VeteransDay",57,229,1518,"{'hashtags': ['#VeteransDay'], 'urls': [], 'photos': [], 'videos': []}"
1194027245272289281,False,2019-11-12 07:00:53,"New Hampshire voter today: “Ok Joe, I get you hate Trump. But why should I vote FOR you?”

Me: “Because we’ll get rid of Trump’s tariffs immediately, we’ll secure our border humanely, we’ll rebuild our infrastructure, and we’ll actually do something about our debt.”

He smiled.",194,222,1980,"{'hashtags': [], 'urls': [], 'photos': [], 'videos': []}"
1194011695540252673,True,2019-11-12 05:59:06,"#OnThisDay in 1918, at the 11th hour of the 11th day of the 11th month, World War I came to an end, and 65 years later, #VeteransDay was declared a national holiday dedicated to giving thanks to all US veterans who have served our country.

To all U.S. veterans, we salute you pic.twitter.com/Nw0CkwvCCo",1,44,133,"{'hashtags': ['#OnThisDay', '#VeteransDay'], 'urls': [], 'photos': ['https://pbs.twimg.com/media/EJH7Tm_WsAAO2TB.jpg'], 'videos': []}"
1194009432696532998,True,2019-11-12 05:50:07,"Schiff, Engel, and Maloney: Cooper testified Trump ""directed the freeze on hundreds of millions of dollars of critical military aid for Ukraine"" through OMB ""against the judgment of career officials in the Department of Defense, Department of State, and other relevant agencies.""",114,3004,8394,"{'hashtags': [], 'urls': [], 'photos': [], 'videos': []}"
1194003518421708801,False,2019-11-12 05:26:36,"It’s a sad thing to say, but if you’re in the conservative media world, it takes real courage to speak the truth in this age of Trump. I know from personal experience. Kudos @Judgenap. We appreciate your courage https://twitter.com/allahpundit/status/1193991110097592321 …",17,57,274,"{'hashtags': [], 'urls': [], 'photos': [], 'videos': []}"
1193903653414785024,True,2019-11-11 22:49:47,"Thank you to everyone who has served this country 
#VeteransDay",40,212,3255,"{'hashtags': ['#VeteransDay'], 'urls': [], 'photos': [], 'videos': []}"
1193983144401219586,False,2019-11-12 04:05:39,"Nobody is impeaching @realDonaldTrump. He’s impeaching himself. In fact, I’ll end my primary challenge to Trump tomorrow if you can prove to me that @AdamSchiff or @SpeakerPelosi or anybody else forced our poor little helpless President to say “Hey, do me a favor...”",139,742,4152,"{'hashtags': [], 'urls': [], 'photos': [], 'videos': []}"
1193964593930022912,False,2019-11-12 02:51:56,"Campaigning in Manchester, New Hampshire this morning. Enjoyed laughs & breakfast at the always tasty Red Arrow Diner pic.twitter.com/VLOYrsw5pM",22,18,156,"{'hashtags': [], 'urls': [], 'photos': ['https://pbs.twimg.com/media/EJHQcjWXkAAyxmp.jpg'], 'videos': []}"
1193952979562487810,False,2019-11-12 02:05:47,Trump repeatedly betrays our country. Republican silence or neutrality in the midst of this betrayal is despicable. @Zigmanfreu https://twitter.com/Mediaite/status/1193948086495842304 …,28,61,337,"{'hashtags': [], 'urls': [], 'photos': [], 'videos': []}"
1193891747883040769,False,2019-11-11 22:02:28,"Great ad from a Democrat Congresswoman. Unlike Trump, she’ll uphold her oath and defend the Constitution https://twitter.com/ElaineLuriaVA/status/1193884497705439233 …",45,87,436,"{'hashtags': [], 'urls': [], 'photos': [], 'videos': []}"
1193885685947731968,True,2019-11-11 21:38:23,"Good column. Focus on substance. Don't speculate. Don't be distracted. And don't let the quest for ""fairness"" lead you to report falsehoods. That's a trap https://www.washingtonpost.com/lifestyle/style/media-beware-impeachment-hearings-will-be-the-trickiest-test-of-covering-trump/2019/11/08/1f2b0aac-0239-11ea-8501-2a7123a38c58_story.html …",11,98,276,"{'hashtags': [], 'urls': [], 'photos': [], 'videos': []}"
1193876030643146752,True,2019-11-11 21:00:01,The letter in the wall: The story of Radioman 3rd class Lawrence Merideth – The Athleti https://theathletic.com/1366166/2019/11/11/the-letter-in-the-wall-the-story-of-radioman-3rd-class-lawrence-merideth/ …,3,32,127,"{'hashtags': [], 'urls': [], 'photos': [], 'videos': []}"
1193861093870968837,True,2019-11-11 20:00:40,pic.twitter.com/ptfmYBz9Qm,4,52,194,"{'hashtags': [], 'urls': [], 'photos': [], 'videos': [{'id': 'EJFyVOmXsAUQggO'}]}"
1193715225016569857,False,2019-11-11 10:21:02,Republicans would be losing their shit if Barack Obama spent his entire presidency tweeting positive book reviews for his favorite sycophants and retweeting nice things he heard about himself on MSNBC.,703,4156,26697,"{'hashtags': [], 'urls': [], 'photos': [], 'videos': []}"
1193711291103399936,False,2019-11-11 10:05:24,"There are very few times in life when you’re given the opportunity to truly stand on principle, do what’s right, and risk losing everything. For Republicans, this is one of those times.",216,515,2475,"{'hashtags': [], 'urls': [], 'photos': [], 'videos': []}"
1193700759478685699,True,2019-11-11 09:23:33,"25 of the 56 signatories of the Declaration of Independence were lawyers.

32 of the 55 framers of the Constitution were lawyers.

Watch out https://twitter.com/VoteMarsha/status/1193668137759195137 …",285,2342,11433,"{'hashtags': [], 'urls': [], 'photos': [], 'videos': []}"
1193685668284784640,True,2019-11-11 08:23:35,"""President Trump’s behavior, consorting with a foreign government for his own personal benefit, is literally what the framers had in mind when they established the power to impeach a president for high crimes and misdemeanors.” -NYT",15,100,422,"{'hashtags': [], 'urls': [], 'photos': [], 'videos': []}"
1193685532708102144,False,2019-11-11 08:23:03,"Bill Moyers and I don’t agree on much politically. But on this we do. Our democracy is seriously, seriously hurt by a President who lies as much as this President lies https://twitter.com/brianstelter/status/1193677086487187456 …",23,67,352,"{'hashtags': [], 'urls': [], 'photos': [], 'videos': []}"
1193681256908767233,False,2019-11-11 08:06:03,"I always enjoy speaking with @Zigmanfreud, a tough, honest, principled conservative. His podcast never disappoints. Take a listen. Really good back & forth on impeachment https://twitter.com/Zigmanfreud/status/1193673604166115328 …",14,14,70,"{'hashtags': [], 'urls': [], 'photos': [], 'videos': []}"
1193662600581722112,False,2019-11-11 06:51:55,"Put country before party. To be neutral now is inexcusable. To be silent now is to be a coward. To not call out the cultish, moronic, authoritarian conman in the White House now is unforgivable.",82,457,2029,"{'hashtags': [], 'urls': [], 'photos': [], 'videos': []}"
1193637381074833416,True,2019-11-11 05:11:43,Republicans admit they have no fact witnesses — and Trump did i https://www.washingtonpost.com/opinions/2019/11/10/republicans-admit-they-have-no-fact-witnesses-trump-did-it/ …,11,114,398,"{'hashtags': [], 'urls': [], 'photos': [], 'videos': []}"
1193587596158472194,False,2019-11-11 01:53:53,"“We can’t impeach Trump for being corrupt because he’s corrupt all the time. That’s just who he is.”

Shame on you Republicans. Shame on you https://twitter.com/JesseCharlesLee/status/1193551087569125376 …",147,447,1783,"{'hashtags': [], 'urls': [], 'photos': [], 'videos': []}"
1193583655249166338,False,2019-11-11 01:38:13,Not impeaching Trump for pressuring foreign governments to interfere in our elections would be telling every future President they can do the same thing.,129,336,1982,"{'hashtags': [], 'urls': [], 'photos': [], 'videos': []}"
1193578322875363329,False,2019-11-11 01:17:02,It’s not complicated: @hughhewitt’s bosses (who used to be my bosses) told him to be a Trump sycophant. Hugh did what he was told and said yes https://twitter.com/SykesCharlie/status/1193542304545550336 …,17,82,412,"{'hashtags': [], 'urls': [], 'photos': [], 'videos': []}"
1193530140065751040,True,2019-11-10 22:05:34,"""A Plea From 33 Writers: Words Matter. Stop Using 'Quid Pro Quo.'""

""Please use words that refer only to criminal behavior here. Use 'bribery' or 'extortion' to describe Mr. Trump's demand to ... Ukraine, making it very clear that this is a crime. https://www.nytimes.com/2019/11/08/opinion/letters/quid-pro-quo.html …",383,5087,15543,"{'hashtags': [], 'urls': [], 'photos': [], 'videos': []}"
1193526477603651585,True,2019-11-10 21:51:01,"""It was his gains, and Clinton’s slippage, among those four key groups [independents, white suburban women, voters with some college, and minority men] that gave him his inside straight in the EC. Yet today Trump appears weaker with each of those groups. https://thebulwark.com/where-does-trump-really-stand-with-voters-one-year-out/ …",46,139,488,"{'hashtags': [], 'urls': [], 'photos': [], 'videos': []}"
1193504595131191296,True,2019-11-10 20:24:04,"“In farm country, mental health experts are seeing more suicides as families endure worst period for US agriculture in decades. bankruptcies and loan delinquencies rising, weather events ruining crops, profits vanishing in Trump’s global trade disputes https://www.washingtonpost.com/nation/2019/11/09/im-gonna-lose-everything/ …",915,6074,8487,"{'hashtags': [], 'urls': [], 'photos': [], 'videos': []}"
1193275510865960962,False,2019-11-10 05:13:46,"A big “thank you” this weekend to all the brave patriotic Americans who’ve risked one hell of a lot to publicly testify to Trump’s impeachable offenses with Ukraine.

And a big “shame on you” to all those in the Trump Administration who’ve stayed silent and refused to testify.",98,462,3332,"{'hashtags': [], 'urls': [], 'photos': [], 'videos': []}"
1193210923491766272,True,2019-11-10 00:57:07,https://twitter.com/RosenzweigP/status/1193207243329671168  pic.twitter.com/bstlbPUyTt,70,338,1395,"{'hashtags': [], 'urls': ['https://twitter.com/RosenzweigP/status/1193207243329671168'], 'photos': ['https://pbs.twimg.com/media/EI8jAfaWwAAIKcj.jpg'], 'videos': []}"
1193208551541329920,True,2019-11-10 00:47:42,It’s outrageous that some Congressional Republicans now say that inviting a foreign power to manipulate our elections isn’t impeachable. Of course it is. It’s a criminal act and our freedom relies heavily on the integrity of our elections. They know this!,386,4516,16409,"{'hashtags': [], 'urls': [], 'photos': [], 'videos': []}"
1193186395713617921,False,2019-11-09 23:19:39,".@NikkiHaley had a choice: Do what’s right, defend the rule of law, defend the Constitution or...suck up to Trump. She chose Trump https://twitter.com/markknoller/status/1192919782359814144 …",266,403,1839,"{'hashtags': [], 'urls': [], 'photos': [], 'videos': []}"
1193183980520120327,False,2019-11-09 23:10:03,"Heavy hitting, thoughtful, serious, meaningful commentary from @JesseBWatters: Impeachment is “boring” and the Ukraine issue isn’t “sexy.”

Ok https://www.mediaite.com/tv/fox-news-jesse-watters-impeachment-boring-so-far-not-a-sexy-scandal-americans-dont-care-about-ukraine/ …",40,15,114,"{'hashtags': [], 'urls': [], 'photos': [], 'videos': []}"
1193163008631070726,True,2019-11-09 21:46:43,"President George H.W. Bush, Nov 9, 1989:
""We're saluting those who can move forward with democracy. We are encouraging the concept of a Europe whole and free.""
Responding to a reporter who said the president didn't seem elated: “I'm elated. I’m just not an emotional kind of guy.”",24,84,458,"{'hashtags': [], 'urls': [], 'photos': [], 'videos': []}"
1193146583405252608,True,2019-11-09 20:41:27,"Yes, history was made, but it certainly did not end. When I interviewed Putin in ‘07, he said the breakup of the Soviet Union was the greatest tragedy of the 20th century. He’s trying to put it together again with the help of a @POTUS. Unthinkable https://twitter.com/carlbildt/status/1193057426808934401 …",46,580,1357,"{'hashtags': [], 'urls': [], 'photos': [], 'videos': []}"
1193018898058227713,False,2019-11-09 12:14:05,Bad answer Nikki. I was hoping you would put principle before your own self interest. You didn’t https://twitter.com/markknoller/status/1192919782359814144 …,159,206,2037,"{'hashtags': [], 'urls': [], 'photos': [], 'videos': []}"
1192889627146895360,False,2019-11-09 03:40:24,"When was the last time the President of the United States actually talked about public policy?

When was the last time he talked about something other than himself?",449,1353,9254,"{'hashtags': [], 'urls': [], 'photos': [], 'videos': []}"
1192831388891963392,False,2019-11-08 23:48:59,Bullshit. Trump IS the swamp https://twitter.com/joshtpm/status/1192830555068542976 …,595,492,3032,"{'hashtags': [], 'urls': [], 'photos': [], 'videos': []}"
1192828052348252160,True,2019-11-08 23:35:44,"After weeks of Republicans demanding that Schiff open up the doors and allow the public to see the impeachment proceedings, Trump says this morning: “They shouldn’t be having public hearings.”",2064,13256,43141,"{'hashtags': [], 'urls': [], 'photos': [], 'videos': []}"
1192801553045950464,False,2019-11-08 21:50:26,"I’m running against Trump in the GOP Primary. I’d really appreciate you considering making a contribution. I’m a conservative, our politics may be different, but we agree that Trump is a threat who must be stopped.

I’m your 1st shot to stop him. Thanks. http://Joewalsh.org .",106,125,600,"{'hashtags': [], 'urls': ['http://Joewalsh.org'], 'photos': [], 'videos': []}"
1192781208884826112,False,2019-11-08 20:29:35,"When it comes to all things Trump, I’m not a fan of “anonymous.” There’s much too much at stake. Put your name on it.",56,61,550,"{'hashtags': [], 'urls': [], 'photos': [], 'videos': []}"
1192617463852216320,False,2019-11-08 09:38:55,"I’m a free-market, limited government conservative, but I’d rather have a socialist in the White House than a dictator. Or a criminal.",749,1233,9341,"{'hashtags': [], 'urls': [], 'photos': [], 'videos': []}"
1192577006900301824,True,2019-11-08 06:58:10,"Asked for a reaction to the Bloomberg news, @WalshFreedom tells me, “Bloomberg should instead put $100 million into a Michael Bennett or Amy Klobuchar superpac.”",306,854,6119,"{'hashtags': [], 'urls': [], 'photos': [], 'videos': []}"
1192597895754596352,True,2019-11-08 08:21:10,"Trump isn’t the only Republican running for president. Some of them even believe in tackling the climate crisis. @GovBillWeld, @MarkSanford, and @WalshFreedom join us in a special presidential special addressing one of 2020’s biggest issues. Tonight at 8pm on @WeatherChannel pic.twitter.com/Qyayk0U3F2",15,65,195,"{'hashtags': [], 'urls': [], 'photos': ['https://pbs.twimg.com/media/EIz1dsRUcAE-Yl9.jpg', 'https://pbs.twimg.com/media/EIz1dsRVAAAwNsQ.jpg', 'https://pbs.twimg.com/media/EIz1dsSUwAA7F3z.jpg'], 'videos': []}"
1192612082899918848,False,2019-11-08 09:17:32,And another day to remind everyone that tariffs are bad and hurt the American people https://twitter.com/scottlincicome/status/1192590489087889408 …,22,36,173,"{'hashtags': [], 'urls': [], 'photos': [], 'videos': []}"
1192585155950583813,False,2019-11-08 07:30:32,"Hey America, he told a foreign government to dig up dirt on one of OUR fellow citizens. He told a foreign government to sabotage OUR elections. 

If that’s not impeachable, then nothing is.",127,483,2015,"{'hashtags': [], 'urls': [], 'photos': [], 'videos': []}"
1192516864179671041,True,2019-11-08 02:59:10,"Officials with far more to lose than Bolton (their jobs, pensions) are willing to perform their patriotic duty and testify about impeachable acts while Bolton waits for an engraved invitation from a court. He is hiding while others serve their country https://www.washingtonpost.com/opinions/2019/11/07/free-john-bolton/ …",975,5360,17525,"{'hashtags': [], 'urls': [], 'photos': [], 'videos': []}"
1192516574961381381,True,2019-11-08 02:58:02,"Just so it’s clear: New York has determined that Trump and his family cannot be trusted to be honest and responsible fiduciaries of charitable funds, and misused them for their own gain.

His use of the federal treasury as a piggy bank to be used for his own ends isn’t a stretch https://twitter.com/AP/status/1192512564317605888 …",449,9554,30022,"{'hashtags': [], 'urls': [], 'photos': [], 'videos': []}"
1192501367925030912,True,2019-11-08 01:57:36,"It's almost like these guys are changing their principles, based on what best serves their political interests in the moment https://twitter.com/VaughnHillyard/status/1192459122832269312 …",79,390,1290,"{'hashtags': [], 'urls': [], 'photos': [], 'videos': []}"
1192501974547066880,True,2019-11-08 02:00:01,The most urgent question of our time is how to combat the existential global crisis that is climate change. Tonight at 8pm ET 2020 candidates like @WalshFreedom give us their answers on @weatherchannel pic.twitter.com/e1fxo7Kr9y,20,21,94,"{'hashtags': [], 'urls': [], 'photos': ['https://pbs.twimg.com/media/EIyIzJfWoAcqNHu.jpg'], 'videos': []}"
1192484335645069313,True,2019-11-08 00:49:55,"Lolz, it's a fun look when your NH presidential primary filing event gets overshadowed by your VP having to answer questions about how you're probz about to be impeached. 

PS Team #Walsh2020 is excited to be in NH to file on 11/14!!",5,13,110,"{'hashtags': ['#Walsh2020'], 'urls': [], 'photos': [], 'videos': []}"
1192482306897920000,False,2019-11-08 00:41:51,Bolton could and should testify tomorrow. Nothing is stopping him https://twitter.com/JaxAlemany/status/1192480697048539136 …,16,35,203,"{'hashtags': [], 'urls': [], 'photos': [], 'videos': []}"
1192477512967716865,False,2019-11-08 00:22:48,"I don’t know how any American can read this story and not be thoroughly disgusted with @realDonaldTrump. Ukrainian soldiers are dying, our ally desperately needs our military aid, but Trump makes them get down on their knees and do a political favor for him first. Impeach him https://twitter.com/maggieNYT/status/1192424204718792704 …",63,188,766,"{'hashtags': [], 'urls': [], 'photos': [], 'videos': []}"
1192465783500263424,True,2019-11-07 23:36:12,"This, from the NYT, puts the proposed Warren spending surge in perspective. It's not wonky and interesting, it's radical and fantastical. It's not going to happen. She's insulting our intelligence by pretending it will https://www.nytimes.com/interactive/2019/11/06/us/politics/elizabeth-warren-policies-taxes.html …",97,200,524,"{'hashtags': [], 'urls': [], 'photos': [], 'videos': []}"
1192462464962588674,False,2019-11-07 23:23:01,"In 2016, he encouraged Russia to attack us.

In 2017-18, he repeatedly tried to stop the investigation into Russia’s attack.

In 2018, he sided with Putin over our own intel folks.

In 2019, he pressured China & Ukraine to sabotage our elections.

He’s disloyal. He’s a traitor.",214,1875,8861,"{'hashtags': [], 'urls': [], 'photos': [], 'videos': []}"
1192420381791051776,False,2019-11-07 20:35:47,Nobody forced Trump to pressure a foreign government to sabotage our elections. He chose to do it. This whole thing is on him.,119,589,4079,"{'hashtags': [], 'urls': [], 'photos': [], 'videos': []}"
1192411452176359424,True,2019-11-07 20:00:18,@WalshFreedom and @ScottAdamsSays join me this morning on @630KHOW http://khow.com/listen ,0,4,11,"{'hashtags': [], 'urls': [], 'photos': [], 'videos': []}"
1192405764855521280,True,2019-11-07 19:37:42,The numbers don’t add up: Nearly half of Warren’s proposed financing for her M4A plan falls into the “gimmick” category.  My @Morning_Joe chart pic.twitter.com/XuZbowwiU5,133,224,442,"{'hashtags': [], 'urls': [], 'photos': ['https://pbs.twimg.com/media/EIxGuRLWsAEqJ6q.png'], 'videos': []}"
1192279516468695040,False,2019-11-07 11:16:02,This is what “sucking up to Trump” looks like. Pathetic. Corrosive. Cruel. Ignorant https://twitter.com/Acyn/status/1192268836201873413 …,739,819,4544,"{'hashtags': [], 'urls': [], 'photos': [], 'videos': []}"
1192247139134582786,True,2019-11-07 09:07:23,Won’t someone find Trump his Roy Cohn? Michael is already in jail and Rudy is under investigation https://twitter.com/mattzap/status/1192246385493626882 …,82,206,968,"{'hashtags': [], 'urls': [], 'photos': [], 'videos': []}"
1192238376365236225,False,2019-11-07 08:32:34,This is what life is like with an utterly corrupt human being in the White House. It will get worse. Let’s say no to four more years of it.,100,141,1193,"{'hashtags': [], 'urls': [], 'photos': [], 'videos': []}"
