tweetId,isRetweet,time,text,replies,retweets,likes,entries
1202625849155031041,True,2019-12-06 00:28:40,"Pelosi’s whole answer is worth watching, as she distinguishes between the reasons Trump should be defeated electorally in 2020 and the reason he should be impeached now https://twitter.com/ABC/status/1202622169009668096 …",352,2373,9759,"{'hashtags': [], 'urls': [], 'photos': [], 'videos': []}"
1202601015620575234,True,2019-12-05 22:50:00,"Just ran into Republican candidates @WalshFreedom at The Red Arrow Diner in Manchester, NH. Election season in N.H.... not so different from Iowa I’m finding https://twitter.com/DJJudd/status/1202600737181708291 …",6,16,80,"{'hashtags': [], 'urls': [], 'photos': [], 'videos': []}"
1202592887495634944,False,2019-12-05 22:17:42,Most Democrats didn’t want to do this. Trump gave them no choice. The ONLY person to blame for impeachment is @realDonaldTrump. He’s the one who pressured a foreign government to sabotage our elections. This is on him.,327,1453,6848,"{'hashtags': [], 'urls': [], 'photos': [], 'videos': []}"
1202591240954490880,True,2019-12-05 22:11:09,"Speaker Pelosi: ""The facts are uncontested: The president abused his power for his own personal political benefit at the expense of our national security.""",27,530,1994,"{'hashtags': [], 'urls': [], 'photos': [], 'videos': []}"
1202590488815165441,True,2019-12-05 22:08:10,"Speaker Pelosi: ""In America, no one is above the law.""",51,293,1397,"{'hashtags': [], 'urls': [], 'photos': [], 'videos': []}"
1202583025076375552,True,2019-12-05 21:38:30,"The number of manicurists, landscapers, construction workers, and welders without health insurance rose by 2 million in 2018, the first wrong-way move in the insurance numbers in a decade https://khn.org/news/number-of-americans-without-insurance-rises-in-2018/  https://twitter.com/atrupar/status/1202576559015649280 …",201,1502,4053,"{'hashtags': [], 'urls': ['https://khn.org/news/number-of-americans-without-insurance-rises-in-2018/'], 'photos': [], 'videos': []}"
1202580686835798016,False,2019-12-05 21:29:13,"Great start to another day in NH in the @NHTodayShow studio with @JackHeathRadio. Always enjoy the conversation with you, my friend pic.twitter.com/Hv5t748c8o",4,5,20,"{'hashtags': [], 'urls': [], 'photos': ['https://pbs.twimg.com/media/ELBswPvX0AA-dtd.jpg'], 'videos': []}"
1202498676502827014,True,2019-12-05 16:03:20,"If you're only against authoritarianism when the authoritarians come from the opposite political team, congratulations, you're a typical authoritarian.",33,625,2904,"{'hashtags': [], 'urls': [], 'photos': [], 'videos': []}"
1202443299279249408,False,2019-12-05 12:23:17,".@realDonaldTrump must be defeated in 2020. He must not be re-elected. Because with Donald Trump, it’s always only about Donald Trump. It will be 4 more years of the Donald Trump show. Not health care. Not immigration. Not infrastructure. Just Trump. 24/7.

Can’t let that happen.",174,438,2157,"{'hashtags': [], 'urls': [], 'photos': [], 'videos': []}"
1202383834861453312,True,2019-12-05 08:27:00,"NC Republicans snub @WalshFreedom and @GovBillWeld, keeping them off the ballot to primary President Trump here

Meanwhile, the Libertarian primary will include 16 people including noted whale fan John McAfee and the highly memorable Vermin Supreme #ncpo https://www.newsobserver.com/news/politics-government/election/article238050649.html …",25,74,111,"{'hashtags': ['#ncpol'], 'urls': [], 'photos': [], 'videos': []}"
1202218035764793344,True,2019-12-04 21:28:10,"My latest for @thedailybeast:

""Trump’s GOP Sheds Its Dignity, and Chugs His Kool-Aid http://bit.ly/2rYYkOP ",309,1832,4245,"{'hashtags': [], 'urls': [], 'photos': [], 'videos': []}"
1202414725906259969,False,2019-12-05 10:29:45,"3 questions:

If @realDonaldTrump is so strong & invincible, how come Republican Party bosses in 8 states cancelled primaries?

What are Trump & GOP bosses afraid of?

Will Republican voters in these 8 states rise up against their party bosses & take back their right to vote?",128,562,2034,"{'hashtags': [], 'urls': [], 'photos': [], 'videos': []}"
1202407082579963906,False,2019-12-05 09:59:22,"Brad, you’re a punk and an ignorant thug. Just like the man you work for. @gtconway3d is a great American patriot. As the traitor you work for said, you couldn’t carry George Conway’s jockstrap https://twitter.com/parscale/status/1202399373273051156 …",141,256,2108,"{'hashtags': ['#JustSayin'], 'urls': [], 'photos': [], 'videos': []}"
1202393245461962752,False,2019-12-05 09:04:23,Testify https://twitter.com/ambjohnbolton/status/1202340739352596480 …,25,58,562,"{'hashtags': [], 'urls': [], 'photos': [], 'videos': []}"
1202381655278858240,False,2019-12-05 08:18:20,Trump’s Republican Party https://twitter.com/riegerreport/status/1202379560811204608 …,177,91,521,"{'hashtags': [], 'urls': [], 'photos': [], 'videos': []}"
1202373617608253440,False,2019-12-05 07:46:24,"Republican Party bosses in yet one more state decide to disenfranchise their voters in order to protect their unfit King.

This un-democratic bullshit should not happen in America. It just shouldn’t happen https://www.newsobserver.com/news/politics-government/election/article238050649.html …",62,81,252,"{'hashtags': [], 'urls': [], 'photos': [], 'videos': []}"
1202371045040230400,False,2019-12-05 07:36:10,"But, but, but, but...DEEP STATE https://twitter.com/kylegriffin1/status/1202369508305973248 …",32,54,328,"{'hashtags': [], 'urls': [], 'photos': [], 'videos': []}"
1202321310782803973,True,2019-12-05 04:18:33,"I’m a Republican, but the only reason this impeachment is “partisan” is because the Republicans refuse to acknowledge the facts.",190,1335,7275,"{'hashtags': [], 'urls': [], 'photos': [], 'videos': []}"
1202348822418079750,True,2019-12-05 06:07:52,Here is the irony: republicans argue against impeachment because of no direct witnesses while White House refuses to provide them and they say impeachment must be bipartisan as they refuse to consider impeachment.,85,539,1917,"{'hashtags': [], 'urls': [], 'photos': [], 'videos': []}"
1202351578528673792,True,2019-12-05 06:18:49,"""I watched Sean Hannity, I watched Laura Ingraham, I watched Tucker Carlson, I watched a lot of other legal scholars, frankly...legal talent...Alan Dershowitz, & many more""

     ummm https://twitter.com/atrupar/status/1202302562927566849 …",29,13,103,"{'hashtags': [], 'urls': [], 'photos': [], 'videos': []}"
1202352638408450048,False,2019-12-05 06:23:02,"Add your name and demand that the GOP stops cancelling primaries and denying the rights of voters! 
>>> https://w4p.link/38bhqlN pic.twitter.com/HdFLQqYgh7",9,20,68,"{'hashtags': [], 'urls': ['https://w4p.link/38bhqlN'], 'photos': ['https://pbs.twimg.com/media/EK-dWk4WkAA2fOg.jpg'], 'videos': []}"
1202332007973478403,True,2019-12-05 05:01:03,"Matt Gaetz argues that with the time consumed by this impeachment process, Congress could do things that Republicans declined to do when they controlled all three elected branches of the federal government",856,13485,50131,"{'hashtags': [], 'urls': [], 'photos': [], 'videos': []}"
1202327221488246785,False,2019-12-05 04:42:02,"This is more than a fight for the presidency. It's a fight for the heart and soul of our nation. Be brave. Join us!

>>> https://w4p.link/37h3SEB pic.twitter.com/S4gqUbxK4y",15,19,102,"{'hashtags': [], 'urls': ['https://w4p.link/37h3SEB'], 'photos': ['https://pbs.twimg.com/media/EK-GPGKWwAAsM49.jpg'], 'videos': []}"
1202321310782803973,False,2019-12-05 04:18:33,"I’m a Republican, but the only reason this impeachment is “partisan” is because the Republicans refuse to acknowledge the facts.",190,1335,7275,"{'hashtags': [], 'urls': [], 'photos': [], 'videos': []}"
1202314388088270850,False,2019-12-05 03:51:02,"State GOPs are using every trick in the book to protect Donald Trump from having to face us — but it hasn't slowed us down! We're getting on more ballots every day, but we need all hands on deck to get on every Super Tuesday ballot. 
Chip in here >>> https://w4p.link/2OAhB25 pic.twitter.com/wJ8Xj2REX5",4,6,34,"{'hashtags': [], 'urls': ['https://w4p.link/2OAhB25'], 'photos': ['https://pbs.twimg.com/media/EK96kGCWsAAj6-i.png'], 'videos': []}"
1202306086046445569,False,2019-12-05 03:18:03,"My musings today:

1. In America, no one, including the President, is above the law.

2. Pressuring foreign governments to interfere with OUR elections is such an extreme act of disloyalty.",37,78,495,"{'hashtags': [], 'urls': [], 'photos': [], 'videos': []}"
1202302060923891713,False,2019-12-05 03:02:03,Have you seen our campaign store yet? There's some great stuff available now and we're adding more every day! Put your bravery on display — check out the store here: https://w4p.link/2r8HFIm pic.twitter.com/OUpY4Xc1bX,10,4,24,"{'hashtags': [], 'urls': ['https://w4p.link/2r8HFIm'], 'photos': ['https://pbs.twimg.com/media/EK9vWj_X0AEN0oC.jpg'], 'videos': []}"
1202292353752616963,True,2019-12-05 02:23:29,Interesting to see GOP ranking member Collins furious at the idea that founders' intentions should be considered in weighing impeachment. Is this also his view of Supreme Court deliberations on founders' intent?,59,366,1560,"{'hashtags': [], 'urls': [], 'photos': [], 'videos': []}"
1202288849537437696,False,2019-12-05 02:09:33,Trump’s tariffs hurt the American people https://twitter.com/HeathMayo/status/1202286766562168834 …,19,51,158,"{'hashtags': [], 'urls': [], 'photos': [], 'videos': []}"
1202276626437935105,False,2019-12-05 01:20:59,"I remember when my fellow tea party conservatives once revered the Founders and the Constitution.

Now they revere Trump. Sad.",244,416,2820,"{'hashtags': [], 'urls': [], 'photos': [], 'videos': []}"
1202236478472040449,True,2019-12-04 22:41:27,"When the hour comes, as it does for us all, who would have ever imagined that Rudy Giuliani’s leadership after 9/11 wouldn’t be the opening paragraph of his obituary.  Instead, it will be his starring role as the kooky ringmaster of Trumps corruption circus.",319,2202,10265,"{'hashtags': [], 'urls': [], 'photos': [], 'videos': []}"
1202242467841658880,False,2019-12-04 23:05:15,Our Founders feared and rebelled against a ruler who was above the law. Donald Trump believes he’s above the law and behaves like he’s above the law. Donald Trump is the very thing our Founders feared.,61,118,560,"{'hashtags': [], 'urls': [], 'photos': [], 'videos': []}"
1202240003713175554,True,2019-12-04 22:55:28,"The Trumpification of the GOP continues apace. The only remaining redoubt of resistance is foreign policy. But given their retreat to Putin's talking points regarding Ukraine, I doubt that will last long https://www.politico.com/news/2019/12/02/trump-conquers-republicans-on-trade-074857?nname=playbook&nid=0000014f-1646-d88f-a1cf-5f46b7bd0000&nrid=00000162-39de-de85-a9fb-3dde96e30000&nlid=630318 …",0,7,32,"{'hashtags': [], 'urls': [], 'photos': [], 'videos': []}"
1202229238985895938,False,2019-12-04 22:12:41,The President of the United States used the powers of his office to cheat in the 2020 election. Elections are the very heart of our republic. To let him get away with this is to tell every future President they can cheat in elections as well.,73,169,818,"{'hashtags': [], 'urls': [], 'photos': [], 'videos': []}"
1202214595252740096,True,2019-12-04 21:14:30,"The Statue of Liberty was created to celebrate freed slaves, not immigrants, new museum recounts - The Washington Pos https://www.washingtonpost.com/history/2019/05/23/statue-liberty-was-created-celebrate-freed-slaves-not-immigrants/ …",82,935,2090,"{'hashtags': [], 'urls': [], 'photos': [], 'videos': []}"
1202219981754249218,False,2019-12-04 21:35:54,No https://twitter.com/WajahatAli/status/1202218384630390784 …,24,49,297,"{'hashtags': [], 'urls': [], 'photos': [], 'videos': []}"
1202061996562231296,False,2019-12-04 11:08:07,"As a former conservative talk radio host, I’m saddened to say that the reason impeachment won’t be bipartisan is because there are people who simply refuse to accept known facts, basic truths. And those people are the people who watch Fox News & listen to conservative talk radio https://twitter.com/svdate/status/1202049539793936386 …",90,164,773,"{'hashtags': [], 'urls': [], 'photos': [], 'videos': []}"
1202041269960228864,False,2019-12-04 09:45:46,"For those who won’t read the report, here’s all you need to know: @realDonaldTrump abused the powers of his office to cheat in the 2020 election.

He violated the public trust. He broke his oath. Our Founders wouldn’t stand for that. Neither should we.",152,827,3348,"{'hashtags': [], 'urls': [], 'photos': [], 'videos': []}"
1202023890282778624,False,2019-12-04 08:36:42,"We do agree Neal, on what matters most in our democracy. We also agree that Donald Trump deserves to be impeached. And we also agree that everyone should buy & read your new book to understand why he deserves to be impeached. It’s a great read. https://www.amazon.com/Impeach-Case-Against-Donald-Trump/dp/0358391172  https://twitter.com/neal_katyal/status/1201987089547571200 …",39,238,1232,"{'hashtags': [], 'urls': ['https://www.amazon.com/Impeach-Case-Against-Donald-Trump/dp/0358391172'], 'photos': [], 'videos': []}"
1202004407224803328,False,2019-12-04 07:19:17,"It wasn’t just a phone call. It was an elaborate plot.

1. He fired our corruption-fighting Ambassador to Ukraine.
2. He put Rudy in charge.
3. He put a hold on military aid.
4. He told Ukraine that to get the aid, they must go after the Bidens.

All to help him cheat in 2020.",223,1797,6087,"{'hashtags': [], 'urls': [], 'photos': [], 'videos': []}"
1201992393471537152,False,2019-12-04 06:31:33,"Paraphrasing @jaketapper, who rightly asks this question more than anyone else:

To every Republican ok with what President Trump did, would you be ok with a President Warren telling a foreign government to dig up dirt on her Republican opponent Nikki Haley?

They won’t answer.",86,448,2151,"{'hashtags': [], 'urls': [], 'photos': [], 'videos': []}"
1201985862613032960,False,2019-12-04 06:05:36,Great thread. Thanks for this @neal_katyal https://twitter.com/neal_katyal/status/1201972605730926592 …,11,56,335,"{'hashtags': [], 'urls': [], 'photos': [], 'videos': []}"
1201979503720960010,True,2019-12-04 05:40:20,"Sometimes, on a warm day in December, you interview presidential candidates (@WalshFreedom) on a picnic bench in Davenport, Iowa. #iacaucu pic.twitter.com/nMnd3B07ih",8,9,70,"{'hashtags': ['#iacaucus'], 'urls': [], 'photos': ['https://pbs.twimg.com/media/EK5J-w1XkAEG0Jb.jpg'], 'videos': []}"
1201968775739908102,False,2019-12-04 04:57:42,Here’s an article of impeachment right here https://twitter.com/kylegriffin1/status/1201958204269350920 …,27,293,1117,"{'hashtags': [], 'urls': [], 'photos': [], 'videos': []}"
1201960416856936453,False,2019-12-04 04:24:29,"I’m here in Iowa, where folks are paying the price for Donald Trump's reckless tariffs and trade wars — he lied to all of us. I never will. 

Join us at http://www.joewalsh.org pic.twitter.com/d8aIpLiTVZ",83,91,468,"{'hashtags': [], 'urls': ['http://www.joewalsh.org'], 'photos': [], 'videos': [{'id': 'xNitwLb3rbPXggSN'}]}"
1201952790786068481,False,2019-12-04 03:54:11,Running for President isn’t easy. You make huge sacrifices. Anyone seriously doing it should be commended. @KamalaHarris should be commended. Her voice will remain important and influential.,93,92,1125,"{'hashtags': [], 'urls': [], 'photos': [], 'videos': []}"
1201950993614868480,False,2019-12-04 03:47:02,"For #GivingTuesday I'm supporting @ProjectHood1 — making things happen on Chicago’s south side!

You can learn more about this great organization here: https://w4p.link/2ReokjR pic.twitter.com/ByYpqwuR0A",0,5,22,"{'hashtags': ['#GivingTuesday'], 'urls': ['https://w4p.link/2ReokjR'], 'photos': ['https://pbs.twimg.com/media/EK4wDvrXUAAuaK0.png'], 'videos': []}"
1201938168775352320,False,2019-12-04 02:56:05,"No, impeachment has nothing to do with an orange in a refrigerator. It has to do with a President pressuring a foreign government to sabotage our elections https://twitter.com/ddale8/status/1201894448801701894 …",31,26,184,"{'hashtags': [], 'urls': [], 'photos': [], 'videos': []}"
1201907151742128128,False,2019-12-04 00:52:49,"Within one hour, Trump said he DOESN’T support Iranian protestors and he DOES support Iranian protestors. Within one hour.

Every time Donald Trump is on the world stage, we’re all reminded that he really has absolutely no f*cking idea what he’s doing.",158,811,4075,"{'hashtags': [], 'urls': [], 'photos': [], 'videos': []}"
1201871527987335175,True,2019-12-03 22:31:16,"Yes it’s different, @SenatorBurr . Officials in another country having an opinion about a U.S. presidential candidate is different than a state-sponsored covert foreign intelligence operation intended to sway the election for the preferred candidat https://twitter.com/frankthorp/status/1201649575037145093 …",357,3989,13714,"{'hashtags': [], 'urls': [], 'photos': [], 'videos': []}"
1201885563160322049,False,2019-12-03 23:27:02,"Georgia GOP bosses have chosen to disenfranchise their own voters to protect Donald Trump. They should be ashamed — and we need to fight back. 

Donate today — because next time, it could be your vote that's stolen.

>>> http://w4p.link/2OAhB25 pic.twitter.com/Waeb2SFciF",16,15,56,"{'hashtags': [], 'urls': ['http://w4p.link/2OAhB25'], 'photos': ['https://pbs.twimg.com/media/EK30jGwWkAMfY4x.jpg'], 'videos': []}"
1201877698861314049,True,2019-12-03 22:55:47,The GOP elected officials were unified in outrage at Obama’s lack of support for the Green Revolution (except maybe Rand). I presume there will be overwhelming silence on this from the new Charles Lindbergh part https://twitter.com/davidmdrucker/status/1201876312052371459 …,8,36,120,"{'hashtags': [], 'urls': [], 'photos': [], 'videos': []}"
1201877306085646337,False,2019-12-03 22:54:14,Trump is lying. Again https://twitter.com/revrrlewis/status/1201834407344197634 …,74,69,374,"{'hashtags': [], 'urls': [], 'photos': [], 'videos': []}"
1201876430818332673,True,2019-12-03 22:50:45,.@WalshFreedom According to @MorningConsult & @NationalCouncil 2/3 of NH voters would be more likely to vote for you if you promised to do more to address #mentalhealth. We’re looking forward to hearing your plans on Dec 16 in NH: https://www.mentalhealthforus.net/open-letter-candidates-for-president-the-united-states-america/ … #UniteforMentalHealth,2,2,12,"{'hashtags': ['#mentalhealth', '#UniteforMentalHealth'], 'urls': ['https://www.mentalhealthforus.net/open-letter-candidates-for-president-the-united-states-america/'], 'photos': [], 'videos': []}"
1201864060821803010,False,2019-12-03 22:01:36,"It’s a cool time politically to be alive in America. One of those rare times for choosing. We all must choose: 1)The Constitution & the rule of law; or 2)Trump. 

We all must choose. History will judge each of us.",102,247,1201,"{'hashtags': [], 'urls': [], 'photos': [], 'videos': []}"
1201852096628363270,True,2019-12-03 21:14:03,"If you’re a conservative trying to understand how the Republican President could be trying to intimidate a state’s governor into appointing his pick to the Senate, just remember Trump doesn’t even understand separation of powers and couldn’t find federalism on a map.",16,41,206,"{'hashtags': [], 'urls': [], 'photos': [], 'videos': []}"
1201817877759680512,True,2019-12-03 18:58:05,Truly bizarre to watch the Republican Party reject the free market and go Soviet-style with a preordained choice for their nominee https://twitter.com/walshfreedom/status/1201654484985880578 …,14,76,244,"{'hashtags': [], 'urls': [], 'photos': [], 'videos': []}"
1201841008822169600,True,2019-12-03 20:30:00,"CNN confirms: The Republican-controlled Senate Intelligence Committee looked into allegations that Ukraine interfered in the 2016 election and found no evidence to support the claims, according to sources familiar with the matter https://www.cnn.com/2019/12/02/politics/senate-intelligence-ukraine-2016-election/index.html …",337,7224,17580,"{'hashtags': [], 'urls': [], 'photos': [], 'videos': []}"
1201711013592256513,False,2019-12-03 11:53:27,"Will any of my fellow Republicans have the courage to call @TuckerCarlson out? Will any of them have the courage to say that @chucktodd doesn’t hate America?

Or, like Tucker, do they side with Russia over Ukraine? Putin over Chuck Todd? Expect silence https://www.mediaite.com/tv/tucker-carlson-putin-for-all-his-faults-does-not-hate-america-as-much-as-some-in-the-media-do/ …",197,452,1729,"{'hashtags': [], 'urls': [], 'photos': [], 'videos': []}"
1201702076335689728,False,2019-12-03 11:17:56,Amen https://twitter.com/neeratanden/status/1201700476175171585 …,17,36,262,"{'hashtags': [], 'urls': [], 'photos': [], 'videos': []}"
1201698402364465152,False,2019-12-03 11:03:20,"I end my day today pretty damn depressed. It’s like all my former Republican colleagues in Congress, in total servitude to Trump, disavow truth and have become nothing but a bunch of conspiracy theorists.

Campaigning in Iowa tomorrow, talking to actual voters, will pick me up.",288,465,3456,"{'hashtags': [], 'urls': [], 'photos': [], 'videos': []}"
1201681464737312768,False,2019-12-03 09:56:02,"This time, don’t believe Tucker if he says again he was joking https://twitter.com/acyn/status/1201674758158352385 …",82,136,751,"{'hashtags': [], 'urls': [], 'photos': [], 'videos': []}"
1201675023943122944,False,2019-12-03 09:30:26,"Barr lied to Congress when he said under oath that Trump was spied upon. Barr, awhile ago, ceased to be America’s lawyer. He’s solely Trump’s lawyer. And just like his client, Bill Barr should be impeached as well https://twitter.com/NicolleDWallace/status/1201664941171904512 …",72,405,1470,"{'hashtags': [], 'urls': [], 'photos': [], 'videos': []}"
1201667106992992258,False,2019-12-03 08:58:58,"Really, really important, insightful thread here by @AshaRangappa_. Explains very cogently why Trump gets away with his corruption. Give it a read https://twitter.com/AshaRangappa_/status/1201652206644203523 …",20,109,408,"{'hashtags': [], 'urls': [], 'photos': [], 'videos': []}"
1201661986326695941,True,2019-12-03 08:38:37,Unreal. It is not uncommon for an AG to disagree with an IG finding because it is too tough on DOJ. I have never heard of an IG confirming the department did things correctly and an AG disputing it. Just shocking partisan behavior https://twitter.com/devlinbarrett/status/1201657883919867905 …,617,9476,29139,"{'hashtags': [], 'urls': [], 'photos': [], 'videos': []}"
1201654484985880578,False,2019-12-03 08:08:49,"Republican Party bosses in South Carolina, Nevada, Kansas, Arizona, Alaska, Minnesota, & Georgia cancelled their 2020 primaries & caucuses. They’ve disenfranchised their voters. To please HIM, they’ve literally cancelled elections.

I guess Donald Trump is a dictator after all.",505,2831,7760,"{'hashtags': [], 'urls': [], 'photos': [], 'videos': []}"
1201644681039187968,True,2019-12-03 07:29:52,"A whopping 43% of Republicans now believe a president free of checks and balances could address the country's problems more effectively, a number that has grown from just 14% during Trump's presidency. More evidence of his reshaping of the party in favor of authoritarianism https://twitter.com/pewresearch/status/1201623583556018177 …",1543,5104,9644,"{'hashtags': [], 'urls': [], 'photos': [], 'videos': []}"
1201630810752921600,False,2019-12-03 06:34:45,"GOP defense of Trump: “He did NOTHING wrong.”

So in 2022, when President Biden tells a few foreign governments to dig up dirt on @NikkiHaley before the 2024 elections, and if they don’t, he won’t give em the US aid they’ve been waiting on, the GOP will see nothing wrong with it https://twitter.com/mkraju/status/1201611531508686848 …",102,161,728,"{'hashtags': [], 'urls': [], 'photos': [], 'videos': []}"
1201597709775450113,False,2019-12-03 04:23:13,"Fine Heath, but now call out @BrianKempGA for just disenfranchising Georgia voters by allowing only Donald Trump’s name on the Georgia primary ballot. That’s despicable and un-American https://twitter.com/HeathMayo/status/1201576993327849474 …",16,34,165,"{'hashtags': [], 'urls': [], 'photos': [], 'videos': []}"
1201592130344542208,False,2019-12-03 04:01:03,"Super Tuesday is right around the corner and we need your help to get on every Super Tuesday ballot. If you believe that America deserves a choice, donate to the Super Tuesday Fund!

https://w4p.link/2OAhB25 pic.twitter.com/4mmFVBmDr2",11,8,28,"{'hashtags': [], 'urls': ['https://w4p.link/2OAhB25'], 'photos': ['https://pbs.twimg.com/media/EKzprKgXkAYDf8f.jpg'], 'videos': []}"
1201588655204241415,True,2019-12-03 03:47:14,Your boss apparently thought so https://twitter.com/kellyannepolls/status/1201585936208924672 …,15027,19553,112501,"{'hashtags': [], 'urls': [], 'photos': [], 'videos': []}"
1201588607263367169,False,2019-12-03 03:47:03,We just released our Official Campaign Poster! You can pick yours up at this link: https://w4p.link/34IjGP1 pic.twitter.com/YKWrJ5ldQW,17,14,41,"{'hashtags': [], 'urls': ['https://w4p.link/34IjGP1'], 'photos': ['https://pbs.twimg.com/media/EKzmeGVWsAM7mb2.jpg'], 'videos': []}"
1201587620897275904,False,2019-12-03 03:43:07,".@GaRepublicans just chose Trump over Georgians. @realDonaldTrump is a vulnerable criminal

Is the #GAGOP so scared they have to protect him from the “significant support” they say he’d have in a contested primary pic.twitter.com/50bMDfIpWQ",26,42,93,"{'hashtags': ['#GAGOP'], 'urls': [], 'photos': ['https://pbs.twimg.com/media/EKzlkeeW4AE6I86.jpg', 'https://pbs.twimg.com/media/EKzlkegW4AEdhg3.jpg'], 'videos': []}"
