tweetId,isRetweet,time,text,replies,retweets,likes,entries
1197948392728432641,False,2019-11-23 02:42:08,"A voter earlier: “Why not run as a Democrat? All u do is bash Trump.”

Me: “Bcuz I’m not a Democrat. I believe in freedom, free markets, & limited government.”

Him: “But u want Trump impeached.”

Me: “Bcuz he betrayed his oath & abused his power.”

Him: “Nah. You’re a Democrat.”",1184,644,5287,"{'hashtags': [], 'urls': [], 'photos': [], 'videos': []}"
1197936700137201665,False,2019-11-23 01:55:40,John McCain would slap Lindsey Graham upside the head for this. https://twitter.com/EdwardTHardy/status/1197915140093566987 …,52,89,434,"{'hashtags': [], 'urls': ['https://twitter.com/EdwardTHardy/status/1197915140093566987'], 'photos': [], 'videos': []}"
1197931459379515392,False,2019-11-23 01:34:51,He can’t help himself. He lies as he breathes https://twitter.com/sbg1/status/1197930039339364352 …,9,22,154,"{'hashtags': [], 'urls': [], 'photos': [], 'videos': []}"
1197910150042079234,True,2019-11-23 00:10:10,"The man you call ""Vindictive Vindman"" has shrapnel in his body because he served this country protecting you from terrorist attacks https://twitter.com/MarshaBlackburn/status/1197875810256007170 …",516,5693,29545,"{'hashtags': [], 'urls': [], 'photos': [], 'videos': []}"
1197919691970211845,False,2019-11-23 00:48:05,Trump. He’s completely nuts and doesn’t listen to anybody but himself https://twitter.com/lopezlinette/status/1197917602607239171 …,15,28,174,"{'hashtags': [], 'urls': [], 'photos': [], 'videos': []}"
1197916210861682690,True,2019-11-23 00:34:15,The explanation of the non-hanging of portraits is just what you would expect ... @ddale https://twitter.com/LukensLewis/status/1197912792642269187 …,68,771,2584,"{'hashtags': [], 'urls': [], 'photos': [], 'videos': []}"
1197905154529484800,True,2019-11-22 23:50:19,"NEW: Amb. Yovanovitch’s lawyers say Trump’s claim that she refused to hang his picture in the embassy in Ukraine is false: “The Embassy in Kyiv hung the official photographs of the President, Vice President, and Secretary of State as soon as they arrived https://www.washingtonpost.com/politics/after-nine-months-federal-offices-are-still-waiting-to-hang-trumps-picture/2017/09/11/b36025c0-94b5-11e7-aace-04b862b2b3f3_story.html …",638,3001,6085,"{'hashtags': [], 'urls': [], 'photos': [], 'videos': []}"
1197907172698599427,False,2019-11-22 23:58:20,"If I were still in the House of Representatives, I’d vote to impeach this President. It’s not a close call.

I’d probably be the only Republican voting to impeach. I don’t say this to sing my praises. I say it to shame my former Republican colleagues.",251,549,2869,"{'hashtags': [], 'urls': [], 'photos': [], 'videos': []}"
1197903096892006400,False,2019-11-22 23:42:08,No games Mr Bolton. Do what’s right. That’s all https://twitter.com/AmbJohnBolton/status/1197900337690107904 …,43,250,1162,"{'hashtags': [], 'urls': [], 'photos': [], 'videos': []}"
1197898492322222082,True,2019-11-22 23:23:51,"Hey @Jim_Jordan, tell the whole story. Or are you afraid of the full truth?
#DemocracyDiesInASeaOfLie pic.twitter.com/hDM3Zc2WxR",178,295,844,"{'hashtags': ['#DemocracyDiesInASeaOfLies'], 'urls': [], 'photos': ['https://pbs.twimg.com/media/EJ_KU8-XYAABtZG.jpg'], 'videos': []}"
1197897704023744513,False,2019-11-22 23:20:43,I cannot adequately describe how damn disappointed I am in my former Republican colleagues in Congress.,969,2118,16375,"{'hashtags': [], 'urls': [], 'photos': [], 'videos': []}"
1197894549617684482,False,2019-11-22 23:08:11,"And sadly, Hannity et al. last night led with: “I told you! Deep state proven! https://twitter.com/BradMossEsq/status/1197888249580138497 …",10,10,88,"{'hashtags': [], 'urls': [], 'photos': [], 'videos': []}"
1197887320994799624,True,2019-11-22 22:39:27,President Trump's delusional call to Fox News this AM shows how important it is to understand the fantasy land in which so many Trump supporters have imprisoned themselve https://www.theatlantic.com/ideas/archive/2019/11/devin-nunes-attack-press-misguided/602347/ …,373,3295,10468,"{'hashtags': [], 'urls': [], 'photos': [], 'videos': []}"
1197884697952555008,False,2019-11-22 22:29:02,Put country before party Mr Ambassador. Testify https://twitter.com/AmbJohnBolton/status/1197862304462901248 …,33,118,726,"{'hashtags': [], 'urls': [], 'photos': [], 'videos': []}"
1197871983276498944,True,2019-11-22 21:38:30,"How is a process, specifically spelled out in the constitution, unconstitutional?",27,19,146,"{'hashtags': [], 'urls': [], 'photos': [], 'videos': []}"
1197878902540193794,False,2019-11-22 22:06:00,He’s a four-year old child. @foxandfriends is his blankie https://twitter.com/TheViewFromLL2/status/1197876601662390272 …,115,550,3427,"{'hashtags': [], 'urls': [], 'photos': [], 'videos': []}"
1197878013414821888,False,2019-11-22 22:02:28,"Respectfully, please stop marveling https://twitter.com/JonahDispatch/status/1197874082076905473 …",9,7,119,"{'hashtags': [], 'urls': [], 'photos': [], 'videos': []}"
1197876350616506368,False,2019-11-22 21:55:52,In his own words https://twitter.com/jaketapper/status/1197726867383566336 …,12,39,145,"{'hashtags': [], 'urls': [], 'photos': [], 'videos': []}"
1197865370377498625,True,2019-11-22 21:12:14,"Trump on Fox again repeats his complaint that Europe isn’t giving money Ukraine. In fact, Europe has given more than the United States. Reupping this https://www.nytimes.com/2019/09/24/us/politics/trumps-misleading-defense-for-withholding-assistance-to-ukraine.html …",389,4275,8167,"{'hashtags': [], 'urls': [], 'photos': [], 'videos': []}"
1197867363863019520,True,2019-11-22 21:20:09,"Of the Ukraine/DNC server conspiracy theory that POTUS continues to push, remember his former WH homeland security adviser Tom Bossert calls it “completely  debunked... it has no validity. https://www.google.com/amp/s/www.nytimes.com/2019/09/29/us/politics/tom-bossert-trump-ukraine.amp.html …",457,2241,5957,"{'hashtags': [], 'urls': [], 'photos': [], 'videos': []}"
1197862731732283394,True,2019-11-22 21:01:45,"My conversation on the @JonahRemnant podcast with @smarick inspired me to dash off this ranty column. Whenever I hear leftwingers -- and, increasingly rightwingers -- denounce today's ""unfettered capitalism"" I wonder ""What the f*ck are they talking about? https://www.nationalreview.com/2019/11/economic-policy-unfettered-capitalism-does-not-exist-in-united-states/ …",30,43,164,"{'hashtags': [], 'urls': [], 'photos': [], 'videos': []}"
1197738813352763392,True,2019-11-22 12:49:20,"This video of Lindsey Graham talking about Joe Biden - ""as good a man as God ever created"" - is really something to watch now that Graham has sold his soul to Trump https://twitter.com/LGsConscience/status/1197692999976804353 …",501,4839,11369,"{'hashtags': [], 'urls': [], 'photos': [], 'videos': []}"
1197720942199345153,False,2019-11-22 11:38:19,"So what have we learned these past two weeks? Donald Trump sold out his country for personal gain. Yet again.

Go ahead Republicans. Defend that.",318,604,3150,"{'hashtags': [], 'urls': [], 'photos': [], 'videos': []}"
1197709232319193089,False,2019-11-22 10:51:48,"In 2016, he encouraged Russian interference.

In 2017-18, he obstructed the Russian investigation.

In 2018, he sided with Putin over our own people.

In 2019, he said he’d take dirt from a foreign source.

In 2019, he pressured 2 other countries to interfere.

See a pattern?",203,882,3144,"{'hashtags': [], 'urls': [], 'photos': [], 'videos': []}"
1197626874270228481,True,2019-11-22 05:24:32,"Fiona Hill distilled the impeachment inquiry down to three weighty words: ""Domestic political errand."" @Kevinliptakcnn pens this smart piece that you should read https://www.cnn.com/2019/11/21/politics/fiona-hill-gordon-sondland-impeachment-trump/index.html …",107,2577,9659,"{'hashtags': [], 'urls': [], 'photos': [], 'videos': []}"
1197590913834459136,True,2019-11-22 03:01:38,"It's crystal clear that our democracy—the soul of our nation—has taken a back seat to Donald Trump's reckless self-interest and narcissistic meltdown. He must answer to the American people — he must be impeached!

Add your name and make your voice heard https://w4p.link/34bP88i ",24,49,213,"{'hashtags': [], 'urls': [], 'photos': [], 'videos': []}"
1197590494357966848,False,2019-11-22 02:59:58,"Wajahat, I am happily married as well. In fact, I just told my wife that I’ve fallen in love with Fiona Hill, and my wife told me she completely understands https://twitter.com/WajahatAli/status/1197587218338131968 …",48,103,1221,"{'hashtags': [], 'urls': [], 'photos': [], 'videos': []}"
1197585999204892672,True,2019-11-22 02:42:06,Starting to get the sense that Republicans wish Fiona Hill had to run to catch a flight to Brussels.,165,610,6835,"{'hashtags': [], 'urls': [], 'photos': [], 'videos': []}"
1197584904596447234,True,2019-11-22 02:37:45,Fiona Hill on Sondland: he wasn’t  coordinating w us because he wasn’t doing the same thing we were doing. ..he was involved in a domestic political errand.,78,1177,4861,"{'hashtags': [], 'urls': [], 'photos': [], 'videos': []}"
1197573289775898624,False,2019-11-22 01:51:36,"So my wife turned on the radio just now to find out what Rush Limbaugh had to say. She told me Rush was making fun of Fiona Hill’s accent.

Powerful stuff.",377,283,2172,"{'hashtags': [], 'urls': [], 'photos': [], 'videos': []}"
1197552268524105728,False,2019-11-22 00:28:04,"I really should tweet this out everyday:

@realDonaldTrump is the most disloyal President we’ve ever had. He pressures foreign governments to sabotage our elections. He does whatever Putin tells him to do.

He’s not at all loyal to America. Call that whatever you want to call it.",187,655,3092,"{'hashtags': [], 'urls': [], 'photos': [], 'videos': []}"
1197513140801552384,True,2019-11-21 21:52:36,"""It’s important to say that again: ""Playing footsie with white supremacists is not normal. Having your campaign manager, lawyer, and political guru in prison is not normal. Defending Putin by criticizing your own intelligence agencies is not normal.""
 https://thebulwark.com/its-not-never-trump-its-country-first/ … via",28,491,1345,"{'hashtags': [], 'urls': ['https://thebulwark.com/its-not-never-trump-its-country-first/'], 'photos': [], 'videos': []}"
1197536736781451265,True,2019-11-21 23:26:21,"Dr. Hill to @DevinNunes, @RepMarkMeadows, @Jim_Jordan, and @mattgaetz: You are all Russian puppets and total tools ",545,5402,21705,"{'hashtags': [], 'urls': [], 'photos': [], 'videos': []}"
1197534339401158661,True,2019-11-21 23:16:50,Good for Fiona Hill for calling BS on the Russia-fueled conspiracy crap coming out of Nunes and other members of the committee and Congress.,17,263,1928,"{'hashtags': [], 'urls': [], 'photos': [], 'videos': []}"
1197527494771068930,True,2019-11-21 22:49:38,Holmes adds to mountain of evidence that everyone involved knew that Burisma meant Bidens,71,1084,5354,"{'hashtags': [], 'urls': [], 'photos': [], 'videos': []}"
1197527062715813888,False,2019-11-21 22:47:55,All roads lead to Putin.,44,73,532,"{'hashtags': [], 'urls': [], 'photos': [], 'videos': []}"
1197521034104254465,False,2019-11-21 22:23:58,Agreed. And what Hill is also asserting this morning is that the guy in the White House is a gullible conspiracy theorist and current GOP Members of Congress are his enablers https://twitter.com/DavidJollyFL/status/1197517631382786049 …,17,62,283,"{'hashtags': [], 'urls': [], 'photos': [], 'videos': []}"
1197518292421955585,False,2019-11-21 22:13:04,I’m trying. http://Joewalsh.org https://twitter.com/tigermountainbk/status/1197517795472420865 …,22,14,174,"{'hashtags': [], 'urls': ['http://Joewalsh.org'], 'photos': [], 'videos': []}"
1197516680412487683,False,2019-11-21 22:06:40,He should be impeached. He will be impeached. He should be removed. He won’t be removed. And he won’t be removed because he has @seanhannity & the rest of my former world of conservative media echoing his lies everyday. And his hardcore base of support is comforted by those lies.,117,272,1134,"{'hashtags': [], 'urls': [], 'photos': [], 'videos': []}"
1197511775815684097,False,2019-11-21 21:47:10,"A Republican voter asked me yesterday what I most objected to about Trump. I paused and then said, “He lies all the time. He lies virtually every time he opens his mouth. No matter one’s politics, none of us should accept that. If basic truth is destroyed, democracy dies.”",126,719,3869,"{'hashtags': [], 'urls': [], 'photos': [], 'videos': []}"
1197499185534263296,True,2019-11-21 20:57:08,"From Fiona Hill’s opening statement: “As I told this Committee last month, I refuse to be part of an effort to legitimize an alternate narrative that the Ukrainian government is a U.S. adversary, and that Ukraine—not Russia—attacked us in 2016.”",39,465,1971,"{'hashtags': [], 'urls': [], 'photos': [], 'videos': []}"
1197495285716533253,True,2019-11-21 20:41:39,"Dr. Fiona Hill has released her opening statement, @mkraju reports. 

“Based on questions and statements I have heard, some of you on this committee appear to believe that Russia and its security services did not conduct a campaign against our country...",480,5215,19969,"{'hashtags': [], 'urls': [], 'photos': [], 'videos': []}"
1197293452058386433,True,2019-11-21 07:19:38,"Really looking forward to this! 

#NLCC https://twitter.com/leagueofcities/status/1197269885119795202 …",22,22,194,"{'hashtags': ['#NLCCS', '#NLCCS'], 'urls': [], 'photos': [], 'videos': []}"
1197379902909104128,False,2019-11-21 13:03:09,"Actually, it was a bad day for President Trump. After today, there’s zero doubt that he ordered the withholding of US military aid to Ukraine unless Ukraine help him get re-elected. Bribery. Extortion. Abuse of power. An impeachable offense. A day can’t get much worse than that https://twitter.com/GOPLeader/status/1197360532443090945 …",120,334,1603,"{'hashtags': [], 'urls': [], 'photos': [], 'videos': []}"
1197348472413982721,True,2019-11-21 10:58:16,The top of tomorrow's New York Times front page pic.twitter.com/5LhbHW1Hex,104,1877,5008,"{'hashtags': [], 'urls': [], 'photos': ['https://pbs.twimg.com/media/EJ3WFlpW4AEDY0p.jpg'], 'videos': []}"
1197337707665600512,False,2019-11-21 10:15:29,I recommend everybody join @IAmSophiaNelson as she live tweets the debate. She’s honest & insightful. You all ought to be following her on Twitter to begin with https://twitter.com/IAmSophiaNelson/status/1197334384044642306 …,8,6,31,"{'hashtags': ['#DemocraticDebate', '#WokeVote2020', '#DemDebate'], 'urls': [], 'photos': [], 'videos': []}"
1197323443781488642,False,2019-11-21 09:18:48,He lies. About everything. And his supporters don’t care https://twitter.com/ddale8/status/1197299363418181632 …,60,202,854,"{'hashtags': [], 'urls': [], 'photos': [], 'videos': []}"
1197293452058386433,False,2019-11-21 07:19:38,"Really looking forward to this! 

#NLCC https://twitter.com/leagueofcities/status/1197269885119795202 …",22,22,194,"{'hashtags': ['#NLCCS', '#NLCCS'], 'urls': [], 'photos': [], 'videos': []}"
1197290640335396869,True,2019-11-21 07:08:27,"It’s continually humbling in the #ImpeachmentHearings to hear so many career civil servants clearly strain themselves to as carefully as possible outline the facts, and just the facts — especially given that they serve under a president so determined to do the opposite.",16,56,447,"{'hashtags': ['#ImpeachmentHearings'], 'urls': [], 'photos': [], 'videos': []}"
1197283444189007873,False,2019-11-21 06:39:52,"Imagine if Trump held up US aid to Ukraine unless Ukraine agreed to personally pay HIM $10 million. Bribery, right? Extortion. An unimaginable abuse of his office. He’d be impeached & removed in a nanosecond. Even Hannity might have issues with it.

That’s exactly what Trump did.",182,486,2145,"{'hashtags': [], 'urls': [], 'photos': [], 'videos': []}"
1197264335585906688,False,2019-11-21 05:23:56,Tell him to put country before party. And before his book deal https://twitter.com/soledadobrien/status/1197260161213186049 …,16,65,510,"{'hashtags': [], 'urls': [], 'photos': [], 'videos': []}"
1197262769860550657,False,2019-11-21 05:17:43,"When we're out on the campaign trail, we're always being asked where folks can pick up their official Walsh 2020 gear — now, we have an answer! Check out our newly-launched Walsh 2020 campaign store!

LINK: https://w4p.link/2r8HFIm pic.twitter.com/SlBSnQIKZm",9,7,36,"{'hashtags': [], 'urls': ['https://w4p.link/2r8HFIm'], 'photos': ['https://pbs.twimg.com/media/EJ2IJPNXkAASQhv.jpg'], 'videos': []}"
1197260689347424256,False,2019-11-21 05:09:27,"If you read one tweet thread today, please read this thread: Absolutely spot on https://twitter.com/BryanGividen/status/1197196374787448832 …",14,61,229,"{'hashtags': [], 'urls': [], 'photos': [], 'videos': []}"
1197251194705588224,False,2019-11-21 04:31:43,"Respectfully Linda, I am standing up. I’m challenging Trump in the Republican Primary. I’m not a wealthy man, but I gave up my livelihood to take Trump on and to try to wake Republicans up to the fact that Trump is a danger to our country. Support me: http://joewalsh.org https://twitter.com/Alegreone/status/1197243562917806081 …",30,40,325,"{'hashtags': [], 'urls': ['http://joewalsh.org'], 'photos': [], 'videos': []}"
1197241711682105344,True,2019-11-21 03:54:02,Deep State https://twitter.com/WalshFreedom/status/1197241091692650499 …,3,13,118,"{'hashtags': [], 'urls': [], 'photos': [], 'videos': []}"
1197241091692650499,False,2019-11-21 03:51:34,"As a former conservative talk radio host, I can tell you what talk radio listeners & @foxnews viewers will hear today & tonight: “It’s all fake news, there’s no proof the President directed anybody to do anything, Ukraine got their aid, the hearings are boring, Hillary did it.”",534,955,5602,"{'hashtags': [], 'urls': [], 'photos': [], 'videos': []}"
1197192865409110017,True,2019-11-21 00:39:56,"Guys, Giuliani did not have the authority to put a hold on the aid. And it didn't hold itself up.",25,130,702,"{'hashtags': [], 'urls': [], 'photos': [], 'videos': []}"
1197231872293650432,True,2019-11-21 03:14:56,"And, in that case, how is refusal to provide that testimony not obstruction https://twitter.com/NoahCRothman/status/1197231278350839809 …",13,62,218,"{'hashtags': [], 'urls': [], 'photos': [], 'videos': []}"
1197227057002033159,True,2019-11-21 02:55:48,"It's always ""former"" or ""retiring,"" thoug https://twitter.com/RebeccaShabad/status/1197188265461374977 …",16,36,373,"{'hashtags': [], 'urls': [], 'photos': [], 'videos': []}"
1197222111695294466,True,2019-11-21 02:36:09,Lighter tweeting today while we wait for the bus to stop running people over,916,4762,43730,"{'hashtags': [], 'urls': [], 'photos': [], 'videos': []}"
1197219596534726658,False,2019-11-21 02:26:09,"So if @realDonaldTrump did nothing wrong, Pompeo could exonerate him. Pence could exonerate him. Mulvaney could exonerate him. Bolton could exonerate him. Hell, Trump could exonerate himself.

Oh yeah...they’re ALL refusing to testify.",94,1028,4291,"{'hashtags': [], 'urls': [], 'photos': [], 'videos': []}"
1197210217559269377,False,2019-11-21 01:48:53,"The best that can be said about VP Mike Pence is that there was an elaborate, corrupt bribery/extortion scheme going on all around him, he was well aware of it, and he chose to do & say nothing about it.

That’s the BEST that can be said about him.",134,896,4527,"{'hashtags': [], 'urls': [], 'photos': [], 'videos': []}"
1197207787677376512,True,2019-11-21 01:39:14,"Trump is an experienced crook. He deputizes thugs like Cohen and Giuliani to do his dirty work, directs everyone to work with them, and then feigns ignorance about the compromising details if anyone asks.",871,7425,30642,"{'hashtags': [], 'urls': [], 'photos': [], 'videos': []}"
1197193734905094144,False,2019-11-21 00:43:23,"Every day the case for Donald Trump's impeachment is getting stronger. It's become crystal clear that our democracy took a back seat to his self-interest and narcissism. 

But we want to hear from you — do you think he should be impeached? Let us know: https://w4p.link/347sg9F pic.twitter.com/hAQZHDzNV5",23,24,143,"{'hashtags': [], 'urls': ['https://w4p.link/347sg9F'], 'photos': ['https://pbs.twimg.com/media/EJ1JW3sWsAAsZwf.jpg'], 'videos': []}"
1197193249389207552,False,2019-11-21 00:41:28,This is what it looks like when a criminal in the White House is once again revealed.,19,88,705,"{'hashtags': [], 'urls': [], 'photos': [], 'videos': []}"
1197181769231077376,True,2019-11-20 23:55:51,"FLASHBACK: ""If you could show me that, you know, Trump actually was engaging in a quid pro quo, outside the phone call, that would be very disturbing."" - Lindsey Graham",225,1686,7665,"{'hashtags': [], 'urls': [], 'photos': [], 'videos': []}"
1197181640860196865,False,2019-11-20 23:55:20,I’m just gonna re-tweet this tweet from Monday. I stand by it https://twitter.com/WalshFreedom/status/1196493984006385664 …,42,86,721,"{'hashtags': [], 'urls': [], 'photos': [], 'videos': []}"
1197180871717113857,False,2019-11-20 23:52:17,That’s ballgame.,94,100,940,"{'hashtags': [], 'urls': [], 'photos': [], 'videos': []}"
1197178909911060480,True,2019-11-20 23:44:29,At this point Rudy just needs to mail in his guilty plea.,151,444,4083,"{'hashtags': [], 'urls': [], 'photos': [], 'videos': []}"
1197169063094566913,False,2019-11-20 23:05:21,“Everyone was in the loop. Everyone.”,23,76,609,"{'hashtags': [], 'urls': [], 'photos': [], 'videos': []}"
1197162088130592773,False,2019-11-20 22:37:38,He got the memo. He’s just not adroit enough to adjust https://twitter.com/davidfrum/status/1197159762565193728 …,14,42,272,"{'hashtags': [], 'urls': [], 'photos': [], 'videos': []}"
1197159651634294785,False,2019-11-20 22:27:57,"In 2016, Trump welcomed & encouraged foreign interference in our elections. 

Because he got away with it, he did it again. It’s clear that he did not just ENCOURAGE foreign interference in our 2020 elections, he held up US military aid to FORCE a foreign government to interfere.",27,94,397,"{'hashtags': [], 'urls': [], 'photos': [], 'videos': []}"
1197156572390154240,True,2019-11-20 22:15:43,"Holy smokes. This Sondland testimony closes whatever loose ends remained. Confirms quid pro quo. Confirms impropriety. Links to State & to Trump. A terrible day for the President and his apologists ahead, the worst yet. Buckle up.",49,195,843,"{'hashtags': [], 'urls': [], 'photos': [], 'videos': []}"
1197154691555176448,False,2019-11-20 22:08:15,"Sondland is going to name names. It’s clear what happened. This all came from Trump. He extorted a foreign government to force that foreign government to help him get re-elected.

The only question is do the Republicans have the balls and the decency to do what’s right?",293,431,2148,"{'hashtags': [], 'urls': [], 'photos': [], 'videos': []}"
1197130365984362497,True,2019-11-20 20:31:35,Oh https://twitter.com/yashar/status/1197129949519450112 …,7,22,96,"{'hashtags': [], 'urls': [], 'photos': [], 'videos': []}"
1197125477628026882,False,2019-11-20 20:12:10,".@RickSantorum said last night that pretty much everything Trump says doesn’t matter and should be ignored.

Yikes. It’s just pathetic the lengths people will go to defend this man who they know is utterly unfit to be President https://twitter.com/AC360/status/1196976751768944640 …",67,101,465,"{'hashtags': [], 'urls': [], 'photos': [], 'videos': []}"
1196955722119909376,False,2019-11-20 08:57:37,Because Putin told him not to https://twitter.com/sam_vinograd/status/1196949761322041346 …,29,75,462,"{'hashtags': [], 'urls': [], 'photos': [], 'videos': []}"
1196930845065588736,False,2019-11-20 07:18:46,"One takeaway for what it’s worth: @DevinNunes is a stupid, partisan hack.",682,1665,13415,"{'hashtags': [], 'urls': [], 'photos': [], 'videos': []}"
1196924562031681536,True,2019-11-20 06:53:48,"Can’t think of anything better than this FDR quote to describe Lt Col Vindman today: “Courage is not the absence of fear, but rather the assessment that something else is more important than fear.”",103,5830,25233,"{'hashtags': [], 'urls': [], 'photos': [], 'videos': []}"
1196915702332055552,True,2019-11-20 06:18:35,"If you were heavily involved in this Trump-Ukraine scandal and you knew that the president wanted a so-called Ukrainian investigation into Burisma and also an investigation into the Bidens, it's just not believable that you didn't realize the two were one in the same.",48,375,1816,"{'hashtags': [], 'urls': [], 'photos': [], 'videos': []}"
1196910761806901253,False,2019-11-20 05:58:57,It’s also a lie https://twitter.com/DavidCornDC/status/1196910266304389128 …,47,64,479,"{'hashtags': ['#ImpeachmentHearings'], 'urls': [], 'photos': [], 'videos': []}"
1196888348809400321,True,2019-11-20 04:29:54,"Actually, extortion is closer to what Trump did than bribery. ""Nice country you've got there. Too bad Russia is attacking you. Be a shame if you didn't get the military aid we promised you. https://twitter.com/ABC/status/1196876746467020806 …",433,925,3904,"{'hashtags': ['#ImpeachmentHearings'], 'urls': [], 'photos': [], 'videos': []}"
1196888920740581377,True,2019-11-20 04:32:10,"Big change from Volker's first testimony to his opening statement today. 

Left: he says ""no"" when asked categorically whether investigations were brought up in July 10 meeting
Right: He says Sondland did bring up investigations, and he found it ""inappropriate pic.twitter.com/VNeV93wNPI",204,3230,6743,"{'hashtags': [], 'urls': [], 'photos': ['https://pbs.twimg.com/media/EJw0IOTXkAUStEB.png', 'https://pbs.twimg.com/media/EJw0IOOWoAAk2Kc.jpg'], 'videos': []}"
